date,time,category,headline,content
20200905,오전 10:07,정치,北 SLBM 시험 발사 준비 신호…트럼프 대북외교 성과 없어종합,11월 대선 노리는 트럼프는 신경 쓰지 않을 것 북한이 2016년 함경남도 신포 인근 해상에서 잠수함발사탄도미사일 SLBM 을 시험발사한 모습. 뉴스1DB 2017.2.12 뉴스1 서울 뉴스1 김정한 기자 북한의 중거리 잠수함발사탄도미사일 SLBM 시험발사 준비 상황을 암시하는 활동이 인공위성으로 포착됐다고 미국 싱크탱크 전략국제문제연구소 CSIS 가 밝혔다. 4일 현지시간 로이터통신에 따르면 CSIS는 홈페이지에 게재한 사진에서 북한 신포조선소 내에 선박 여러 척이 나왔다. 이 가운데 하나는 기존의 SLBM 발사 시험대가 장착된 바지선을 해상으로 끌어낼 때 사용했던 선박과 유사하다. CSIS는 이번 활동이 잠수함 탄도 미사일 시험대에서 발사된 북극성 3호의 시험 발사를 위한 준비작업이 벌어지고 있음을 시사한다 면서도 다만 이것이 결론은 아니 아니다 고 밝혔다. 지난해 10월 북한은 외부 위협을 억제하고 자위권을 강화하기 위한 것이라는 명목으로 SLBM인 북극성 3호를 성공적으로 시험 발사했다고 밝힌 바 있다. 분석가들은 이번 SLBM 시험 발사가 북한이 지난 2018년 핵무기 및 미사일 프로그램을 놓고 미국과 대화에 들어간 이후 가장 도발적인 것이라고 보고 있다. 2019년 7월 도널드 트럼프 미국 대통령이 판문점을 방문해 북측에서 악수를 나눈 후 김정은 북한 국무위원장과 함께 남측으로 넘어오고 있다 © 로이터 뉴스1 ◇ 트럼프 대북외교 성과 없음 시사 북한은 지난 2017년부터 장거리 미사일과 핵실험을 중단했다. 하지만 도널드 트럼프 미국 대통령이 주도한 핵 개발과 미사일 포기 노력은 거의 성과를 거두지 못하고 있다. 앞서 트럼프 대통령은 기자회견에서 북한에 대한 자신의 외교정책이 성공을 거두어왔다고 자화자찬했다. 그는 대통령 당선 당시 미국 국민들이 일주일 안에 북한과 전쟁을 할 것이라고 예측했다 면서 하지만 그동안 우리는 북한과 친하게 지내왔고 전쟁을 하지 않았다 고 말했다. 트럼프 대통령은 자신의 대북 외교 성공 덕분에 지난 2017년 이후 북한의 대륙간탄도미사일 ICBM 과 핵실험은 없었다고 밝혔다. 또한 같은 기간 중 일어난 북한의 수많은 단거리 시험 발사는 그 의미를 축소했다. 미국 매사추세츠공대 MIT 의 핵 비확산 전문가인 비빈 나랑 교수는 트위터에서 북한의 지난해 10월 SLBM 북극성 3호 시험 발사는 당시 트럼프 대통령의 레드라인을 넘지 않았고 이번에도 그럴 것 같다 며 트럼프 대통령은 신경 쓰지 않을 것 이라고 밝혔다. 트럼프 대통령은 오는 11월 대통령선거에서 재선을 노리고 있다 따라서 대선 전에 북한이 미사일 시험 발사를 할 경우 그가 추구하는 북한과의 화해는 성과가 없다는 점이 크게 부각될 가능성이 있다. 한국군 당국은 지난해 시험한 북극성 3호가 450km를 날아갔고 고도가 910km에 달했으며 사거리는 1300km에 달했을 것이라고 밝혔다. CSIS의 이번 보고서에 대해 미국 국무부나 국방부로부터 즉각적인 언급은 없었다.
20200905,오전 10:06,정치,5달 만에 11억 늘어…선관위 조수진 재산 의혹 조사,사진 출처 연합뉴스 조수진 국민의힘 의원의 재산이 5개월 만에 수억원 이상 늘어났다는 의혹이 불거지자 중앙선거관리위원회가 사실관계 파악에 나섰다. 선관위 관계자는 지난 4일 조 의원의 재산 의혹에 대해 신고가 들어와 사실관계를 확인 중 이라며 본인 소명을 받아 본 뒤 위법 정도와 고의성 여부에 따라 추후 조치를 결정할 예정 이라고 설명했다. 국회 공직자윤리위원회가 공개한 국회의원 재산등록현황에 따르면 조 의원은 지난 4월 총선 당시 18억5000만원 2019년 12월 31일 기준 을 재산으로 신고했다. 그러나 지난달 28일 공개된 국회의원 재산신고 내역에 따르면 조 의원의 재산은 30억여원 2020년 5월 30일 기준 으로 11억5000만원 가량이 늘었다. 세부적으로는 예금이 2억원에서 6억2000만원으로 늘었고 타인에게 빌려줬다는 채권이 5억원 추가돼 현금성 자산만 11억2000만여원이 증가했다. 이에 정치권에서는 조 의원이 총선 후보자 등록 당시 재산을 허위로 신고한 것이라는 의혹이 불거졌다. 김용민 더불어민주당 의원은 이와 관련해 지난 2일 사회관계망서비스 SNS 에서 4월에는 없던 채권 5억원이 발생한 것도 문제지만 예금 및 보험 금액에서 6억원 차이가 나 단순 누락으로 보기 매우 어렵다 고 지적했다. 공직선거법에 따르면 국회의원 후보자가 재산을 거짓으로 기재하면 5년 이하의 징역 또는 3000만원 이하의 벌금에 처해진다. 또 선거법 위반 혐의로 벌금 100만원 이상의 형이 확정되면 당선도 무효가 된다. 조 의원 측은 재산 증가와 관련해 아직 아무런 해명을 제시하지 않았다.
20200905,오전 10:06,정치,與野 초선 5개월 만 수억 원 급증…선관위 조수진 사실관계 확인중,헤럴드경제 이현정 기자 여야 일부 초선 의원들의 재산이 5개월 만에 수억 원 이상 늘어난 것으로 파악됐다. 5일 국회 공직자윤리위원회에 따르면 더불어민주당 소속 김홍걸·이수진 의원 국민의힘 소속 조수진 의원 양정숙 무소속 의원은 지난 총선 당시 신고액 지난해 12월 기준 보다 대폭 늘어난 재산을 신고했다. 김홍걸 의원은 당선 후 지난 5월 기준 국회에 신고한 재산액은 약 67억7000만원으로 총선 당시에 비해 약 9억7000만원이 증가했다. 이수진 의원은 총선 당시 재산이 5억6000만원이었지만 이번 재산 등록에선 6억원가량 늘어난 11억9000만원을 신고했다. 양정숙 무소속 의원은 총선 때보다 17억원이 늘어난 109억1000만원을 신고했다. 조수진 의원은 총선 당시 18억5000만원을 신고했지만 국회에는 11억원 넘게 늘어난 30억원의 재산을 등록했다. 김용민 민주당 의원은 페이스북을 통해 4월에는 없던 채권 5억원이 발생한 것도 문제지만 예금 및 보험 금액에서 6억원 차이가 나 단순 누락으로 보기 매우 어렵다 며 조 의원의 허위 재산 신고 의혹을 제기했다. 조 의원의 재산과 관련한 복수의 신고를 접수 받은 중앙선관위원회는 사실관계를 확인 중 이라고 밝혔다.
20200905,오전 10:06,정치,진중권 간호사 위로 대통령 SNS 메시지 간사해 보여,사진 출처 연합뉴스 문재인 대통령이 사회관계망서비스 SNS 를 통해 간호사들의 노고를 위로한 것을 두고 의료진 갈라치기 라는 지적이 불거진 가운데 진중권 전 동양대 교수가 중재와 통합의 대통령 역할이 사라졌다 고 비판했다. 진 전 교수는 지난 4일 SNS에 고민정 더불어민주당 의원의 발언을 보도한 기사를 공유하고 동의한다. 누가 썼느냐보다는 메시지가 중요하다 면서도 문제는 이번 SNS 메시지가 매우 간사해 보인다는 데에 있다 고 설명했다. 그는 글을 쓴 이가 문 대통령이든 오종식 청와대 기획비서관 이든 일단 대통령 공식 트위터로 나간 글은 대통령의 발언 이라며 그런 의미에서 지난 6월 청와대 전현직들이 보인 히스테리 반응은 불필요한 것이었다 고 평가했다. 이어 연설문을 누가 쓰든 중요한 것은 그 안에 대통령의 철학이 녹아 있느냐니까 라고 부연했다. 진 전 교수는 사회를 통합하는 역할을 해야 할 대통령이 나서서 마치 군사작전을 하듯이 코로나 환자들 치료에 고생을 한 의료진을 갈라치기 했으니 계산이 너무 얄팍해서 속이 너무 빤히 들여다보이더라 며 이게 뭐하는 짓이냐 고 꼬집었다. 또 대통령은 집권여당의 대표가 아니다. 대통령은 여든 야든 중도층이든 무당 층이든 모든 국민을 대표해야 한다 며 특히 이런 상황에서는 사회적 갈등을 해소하고 그 과정에서 발생한 상처를 치유하기 위한 대통령의 중재와 통합의 역할이 중요하다. 그런데 어느샌가 이 나라에서 그 대통령의 역할이 사라졌다 고 덧붙였다. 앞서 문 대통령은 지난 2일 SNS에 의료계 파업 중 간호사들의 노고를 두고 코로나19와 장시간 사투를 벌이며 힘들고 어려울 텐데 장기간 파업하는 의사들의 짐까지 떠맡아야 하는 상황이니 얼마나 힘들고 어려우시겠습니까 라고 적었다. 문 대통령은 지난 폭염 시기 옥외 선별진료소에서 방호복을 벗지 못하는 의료진들이 쓰러지고 있다는 안타까운 소식이 국민들의 마음을 울렸다 며 의료진이라고 표현되었지만 대부분이 간호사들이었다는 사실을 국민들은 잘 알고 있다 라고 설명했다. 이를 놓고 정치권 일각에서는 전체 국민을 헤아려야 하는 대통령이 이른바 의료진 갈라치기 편 가르기 를 하고 있다는 비난이 쏟아졌다. 야권을 중심으로 비난이 지속되자 청와대 부대변인 출신인 고민정 의원은 국민에게 그 뉴스를 통해 발신하고자 하는 메시지가 무엇인지가 가장 중요한 것이라고 생각한다. 지엽적인 문제들로 자꾸 번져나가는 것 같다 며 논란을 일축했다.
20200905,오전 10:06,정치,코로나19  5일 0시기준 168명 신규확진…사흘째 100명대,중앙방역대책본부는 5일 0시 기준으로 국내 신종 코로나바이러스 감염증 코로나19 신규 확진자가 168명 늘어 누적 2만1010명이라고 밝혔다. 사흘째 100명대를 유지했다. 일일 신규 확진자 수는 지난달 27일 400명대까지 치솟았으나 이후 28∼29일 이틀간 300명대 30∼2일 나흘간 200명대로 다소 줄어든 뒤 3일부터 이날까지 사흘째 100명대를 유지했다. 이날 신규 확진자의 감염 경로를 보면 지역발생이 158명이고 해외유입은 10명이다. 지역발생 상황을 살펴보면 서울에서 51명 경기에서 50명 인천에서 14명이 발생하면서 수도권 중심 확산세는 여전히 이어지고 있다. 이어 부산 10명 광주와 경남 각 8명이 발생했다. 한편 서울에서 진단검사를 받은 사람 중 양성 판정이 나오는 비율도 감소한 것으로 나타났다. 5일 서울시 공공보건의료재단에 따르면 9월 첫째 주 8월30일∼9월5일 검사건수 대비 양성률은 2.55％로 직전 주의 3.8％에서 1.25％포인트 하락했다.양성률 사상 최고를 기록한 8월 셋째 주의 4.57％에 비하면 2주 만에 절반 가까이 떨어진 수치다. 김승룡 기자 srkim dt.co.kr 사진설명 지난 4일 오전 광주 동구 전남대학교병원 선별진료소에서 의료진이 코로나19 진단검사를 준비하고 있다.
20200905,오전 10:02,정치,두산중공업 1조3000억원 유상증자…자구안 이행 가속페달,두산중공업이 1조3000억원의 규모 유상증자를 한다. 두산중공업의 재무구조 개선 작업이 당초 계획대로 진행되는 분위기다. 5일 두산그룹과 업계에 따르면 두산그룹의 3조원 마련 계획은 현재까지는 차질 없이 진행되고 있다. 두산중공업은 1조3000억원의 규모 유상증자를 한다고 밝혔다. 유상증자는 주주배정 후 일반공모 방식으로 진행된다. 실권이 발생하면 주관증권사가 인수한다. 두산중공업은 유상증자로 확보한 자금을 차입금 상환 등에 활용할 계획이다. 두산중공업은 지난달 초 골프장 클럽모우CC를 하나금융 모아미래도 컨소시엄에 1850억원에 매각하고 채권단 차입금을 처음 상환했다. 상환금액은 약 1200억원으로 알려졌다. ㈜두산은 유상증자 참여를 위해 두산솔루스와 모트롤 사업부도 매각했다. ㈜두산 대주주는 두산퓨얼셀 지분 23% 5740억원 어치를 두산중공업에 무상증여키로 했다. 책임경영 차원에서 사재출연을 결정한 것이다. 두산 관계자는 두산중공업 정상화를 위한 큰 틀을 차질 없이 마련하게 됐다 고 말했다. 두산그룹은 올해 초 두산중공업 경영위기를 해결하기 위해 채권단에서 3조6000억원을 긴급 지원받었다. 그 대신 3조원 규모 자구안을 마련했다. 박정원 회장은 지난 6월 11일 그룹 전 직원에게 보낸 메시지에서 두산중공업이 3조원 이상 재무구조 개선을 목표로 연내 1조원 규모 유상증자와 자본확충을 할 계획 이라고 밝힌 바 있다. 그동안 두산중공업은 비용 감축을 위해 두 차례 명예퇴직을 했고 현재 약 350명이 휴직에 들어갔다. 전체 계열사 임원들은 지난 4월부터 급여 30%를 반납했다.
20200905,오전 10:01,정치,미 CSIS 북 신포서 SLBM 시험발사 준비 암시 활동 포착,위성사진서 기존 발사 시험용 바지선의 예인선과 닮은 선박 발견 북한 신포조선소 선박 정박구역 내에서 발견된 선박들 전략국제문제연구소 CSIS 웹사이트. 재판매 및 DB 금지 서울 연합뉴스 김서영 기자 북한 함경남도 신포 조선소에서 중거리 잠수함발사탄도미사일 SLBM 의 시험 발사 준비를 암시하는 활동이 포착됐다는 분석이 나왔다. 로이터통신에 따르면 미국 싱크탱크 전략국제문제연구소 CSIS 는 4일 현지시간 웹사이트에 게재한 신포 조선소 위성사진에서 보안 구역 내 정박한 여러 척의 선박 중 하나가 기존의 수중 발사 시험용 바지선을 끌어낼 때 사용된 예인선과 유사하다고 밝혔다. CSIS는 이러한 움직임은 수중 시험대 바지선에서 SLBM 북극성 3형 을 시험 발사 하기 위한 준비 작업을 시사하나 결정적인 것은 아니다 라고 밝혔다. 앞서 북한은 지난해 10월 외부 위협을 억제하고 자위권을 강화하기 위한 노력의 일환으로 신형 SLBM인 북극성 3형 시험 발사에 성공했다고 선언한 바 있다. 전문가들은 당시 미사일 시험이 북한이 2018년 핵무기와 미사일 프로그램을 놓고 미국과 대화에 나선 이후 가장 도발적인 움직임으로 풀이했다. 북한은 2017년부터 장거리 미사일과 핵실험을 중단한 상태지만 북한이 핵무기와 미사일 프로그램을 아예 포기하도록 하려는 도널드 트럼프 미국 대통령의 노력은 성과를 거두지 못하고 있다. 로이터통신은 트럼프 대통령이 올 11월 미국 대선에서 재선을 노리고 있는 상황에서 북한이 거듭 미사일 시험 발사를 시도할 경우 트럼프 대통령과 김정은 위원장의 전례 없는 회동에도 핵 협상에서 큰 진전이 없었다는 사실이 부각될 것이라고 풀이했다. 앞서 우리 군 당국은 북한이 지난해 시험한 북극성 3형 미사일의 최대 비행고도는 910여㎞ 거리는 약 450㎞로 탐지됐다고 밝혔다.
20200905,오전 10:01,정치,“책임 없는 발언”으로 6라운드 붙은 홍남기 대 이재명,“국가부채 0.8% 증가만 감수하면 경제살리기 효과가 확실한데 기획재정부는 왜 국채를 핑계 대며 선별지원 고수하는지 정말 의문이다.” 지난 2일 이재명 지사는 페이스북에 올린 2차 긴급재난지원금 관련 글에서 기획재정부를 직접 겨냥했다. “ 긴급재난지원금을 30만원 정도 지급하는 걸 50번 100번 해도 서구 선진국의 국가채무비율에 도달하지 않는다” 지난달 28일 라디오 인터뷰 는 자신의 주장을 책임 없는 발언 지난달 31일 국회 예산결산특별위원회 이라고 깎아내린 홍남기 경제부총리의 발언에 맞대응한 것이다. 2차 재난지원금을 두고 두 사람이 처음 맞붙은 것은 지난 6월이었다. 홍 부총리가 “ 2차 재난지원금을 전혀 검토한 바가 없다”고 하자 이 지사는 라디오 인터뷰에 나와 “창고지기는 본인이 곳간을 여닫을 권한이 없다”고 했다. 이재명 경기도지사 왼쪽 와 홍남기 경제부총리 겸 기획재정부 장관. 중앙포토·뉴스1 재난지원금 이전에도 굵직한 이슈마다 둘 사이에는 파열음을 터졌다. 여권에서 수도권 부동산 공급 대책 논의가 분분하던 지난 7월 홍 부총리가 “그린벨트 문제도 같이 점검이 이뤄질 가능성도 열어 놓고 있다”고 말하자 이 지사는 “전국 로또 분양 광풍이 불 것”이라며 부정적인 입장을 내놨다. 지난달 21일 본지 인터뷰에서도 이 지사는 8·4 대책에 담긴 공급 대책을 땔감 하나 던져줘서 분양 광풍을 불러올 수 있다 고 평가했다. 2018년에는 이 지사의 국토보유세 주장을 두고 붙었다. 당시 홍 부총리는 “토지 이용 효율성이 떨어질 수 있고 지방재정도 약화시킬 수 있다. 신중한 검토가 필요하다”고 했다. 지난해 1월엔 예비타당성조사 면제 대상 선정 방식 문제로 올 3월엔 1차 재난지원금으로 이견을 보였다. 홍남기 대 이재명 충돌사 史 . 그래픽 박경민 기자 minn joongang.co.kr 이에 정통 기획재정부 관료 출신인 홍 부총리와 정책마다 포퓰리즘 논란을 끌고 다니는 이 지사 간의 입장차는 필연적이라는 분석이 나온다. 기획재정위를 경험한 한 민주당 의원은 기재부 공무원 출신들은 균형재정론을 바닥에 깔고 국가 부채를 고민하는 사고방식을 버리기 어렵다 며 표부터 생각하는 선출직 공무원과는 시각이 다를 수밖에 없다 고 말했다. 정치적 해석도 나온다. 홍 부총리와 이낙연 대표와의 관계에 초점을 둔 해석이다. 익명을 원한 민주당 관계자는 “홍 부총리는 사실상 이낙연의 사람으로 평가된다”며 “이 지사가 홍 부총리를 때리는 건 이 대표를 견제하는 것으로 해석되기 쉽다” 고 말했다. 홍 부총리는 문재인 정부 초기 1년 반 동안 국무조정실장으로 첫 총리였던 이 대표를 보필했다. 민주당 관계자는 “경제부총리 선정 과정에서도 이 대표의 추천이 강하게 작용했다는 게 정설”이라며 “이 대표와 이구동성인 홍 부총리가 이 지사와 갈등을 빚는 건 정치적으로 필연적”이라고 말했다. 최근 두 사람의 마찰은 당내로 번지고 있다. 진성준 민주당 의원은 지난달 31일 페이스북에 “참으로 경솔한 답변이 아닐 수 없다”고 비판했고 이재명계로 알려진 이규민 의원도 “대권주자 지지율 1 2위를 달리는 분의 뜻에 대해 철이 없다 는 식으로 발언한 것은 국민에 대한 예의를 지키지 않은 것”이라며 홍 부총리의 사과를 요구했다. 반면 양향자 최고위원은 지난 2일 “ 홍 부총리의 조금 아쉬운 발언이 있었다고 말의 꼬투리를 잡아 책임을 물을 때가 아니다”고 말했다. 홍남기 대 이재명 충돌사 史 . 그래픽 박경민 기자 minn joongang.co.kr 논란이 이어지자 이 지사는 4일 페이스북을 통해 “선별지급 입장이 완전히 잘못된 것이라 생각하지 않는다”며 기존의 강경한 입장에서 다소 물러서는 모습을 보였다. 이 지사는 ‘홍남기 부총리님께 드리는 마지막 호소’라는 제목의 글에서 “정당이 상명하복 일사불란한 군대가 아니어야 하는 반면에 콩가루 집안이 되어서도 안 된다”고 했다. 그러면서 이 지사는 “국채발행으로 국채비율이 높아져도 여전히 OECD 평균의 절반에도 미치지 않는다”며 “‘경제 망치고 국채비율 지켰다’는 평가보다 ‘국채비율 올렸지만 경제와 민생 살렸다’는 후대의 평가가 훨씬 의미 있지 않겠냐”며 뼈있는 말을 남겼다.
20200905,오전 10:00,정치,별점평가단 닻 올린 국민의힘... 시의적절 간판만 바꾸면 신장개업,편집자주 별점평가단은 국회 주요정당 소속 보좌진으로 구성돼 있습니다. 이 코너는 쟁점 이슈에 대한 이들의 반응을 통해 국회 현장의 실제 분위기를 전달한다는 취지의 연재물입니다. 김종인 국민의힘 비상대책위원장이 3일 국회에서 열린 취임 100일 기자회견에서 온라인 화상회의 시스템을 활용해 취재진의 질문에 답변하고 있다. 연합뉴스 미래통합당이 ‘국민의힘’으로 당명을 개정했습니다. 박근혜 전 대통령 탄핵 이후 새누리당→자유한국당→미래통합당을 거쳐 이번이 4번째입니다. ‘당’이라는 호칭을 과감하게 뺐을 뿐 아니라 과거 주로 중도진보 정당에서 사용한 ‘국민’ 이란 단어를 넣어 파격이라는 평가도 나옵니다. 이에 대해 어떻게 평가하십니까. 섬마을 고급건달 ★★★ 언제부터인가 저 당은 ‘극소수 국민의 힘’만 믿으며 대다수 국민과 멀어지는 길을 걸었다. 지난 총선 때 회초리를 세게 맞고서야 조금 정신을 차린 듯하다. 이름을 바꾼다고 당장 달라지진 않겠지만 이름을 바꿨으니 달라지려는 노력은 계속하지 않을까. 마지막으로 믿어본다. 너섬 진또배기 ★ 고리타분한 메뉴에 종업원들은 불친절하고 위생도 엉망인 식당이 간판만 바꿔 다는 신장개업. 손님들 입맛과 눈높이가 달라졌는데 반짝 신메뉴로 호객한다고 손님들이 돌아올지 의문. 결국 다시 옛날처럼 단골장사에 기댈 게 ‘안 봐도 넷플릭스’다. 토크멘터리 정치사 ★★★★★ 촛불혁명 이라며 국민의 힘을 빌려 탄생한 정부가 지지층이 아닌 국민을 무시하고 분열까지 시키고 있다. 이런 상황에서 제1야당의 당명 국민의힘 은 매우 시의적절 하다. 앞으로 중도보수 전체를 아우르길 기대한다. 스무해 ★★ 국가 구성의 3요소는 영토 국민 주권. 정당 구성의 3요소는 당 조직 당원 이념이다. 이념이 잘못됐으면 이념을 고쳐야지 없애면 쓰나. 이념은 없앴는데 당원은 못 바꾸니 진퇴양난이로다. 고시원의 푸른밤 ★★ 가치 나 이념 을 제시하는 것이 아니라 호감가는 이미지를 위한 당명 정권교체부터 해보자 라는 식이지만 이조차 꽤 먹힌다는 것이 대한민국 정치의 현주소이다. 이래저래 한나라당 더불어민주당 에 비해 몇 수 떨어지는 당명임은 부인하기 어렵다. 한강뷰 0 갑자기 이름 바꾸는 사람들 보통 점 보고 와서 그러지 않나 안 되는 식당이 간판만 바꿨다고 잘 되는 걸 본 적이 없다.
20200905,오전 10:00,정치,조수진 반 년만에 재산 11.5억 늘어... 김진애 선관위 분발해라,국민의 힘 조수진 총선 때보다 재산 신고액 급증 선관위 조사 착수 조수진 국민의 힘 의원. 연합뉴스 서울경제 조수진 국민의 힘 의원이 지난 4월 총선을 치르는 과정에서 재산 11억을 축소 신고했다는 의혹이 제기되고 있다. 선거관리위원회는 이 같은 의혹에 대해 사실확인에 나선 것으로 알려졌다. 공직선거법에 따라 국회의원 후보자가 재산을 거짓으로 기재하면 5년 이하의 징역 또는 3 000만원 이하의 벌금에 처하게 된다. 또 선거법 위반 혐의로 벌금 100만원 이상의 형이 확정되면 당선 무효가 된다. 실제로 조 의원이 지난 4월 총선 당시 비례대표 후보자로 등록할 때 공개한 재산내역을 보면 당시 재산은 18억5 000만원 2019년 12월 31일 기준 이었으나 지난달 28일 공개된 국회의원 재산신고 내역 2020년 5월 30일 기준 에서는 30억원으로 11억5 000만원 가량이 늘었다. 예금이 기존 2억원에서 8억2 000만원으로 6억2 000만원 늘었고 타인에게 빌려준 채권이 5억원 추가됐다. 조 의원은 현재까지 재산 증가와 관련해 구체적인 해명을 내놓지 않고 있는 상태다. 이에 따라 선관위에 신고가 접수됐고 선관위는 본인 소명 및 사실관계 확인을 거쳐 추후 조치에 나설 것으로 보인 여권은 즉각 공세에 나섰다. 김진애 열린민주당 의원은 지난 4일 SNS를 통해 “조수진 허위 재산 신고 사안에 본인 소명을 안 한다 하더라도 등록 시 근거 자료들이 선관위와 국회 사무국에 있을 것”이라며 “예금·주식·부동산 관련 근거 자료를 다 냈던 것으로 기억하는데 개인 부채도 마찬가지로 근거가 있을 거다. 선관위 분발하기 바란다. 11억 차이는 상속 증여가 없는 한 불가능 ”이라고 강조했다. 한편 동아일보 기자·논설위원 출신인 조 의원은 지난 4·15 총선에서 현재 국민의힘으로 통합된 미래한국당 비례대표로 국회의원에 당선됐다.
