date,time,category,headline,content
20200905,오후 11:16,정치,한정애 “전공의 의료현장 돌아올 명분 확보…정책 철회 아냐”,한정애 더불어민주당 정책위의장 오른쪽 과 최대집 대한의사협회장이 4일 오전 서울 여의도 민주당사에서 정책협약 이행 합의서에 사인 후 포즈를 취하고 있다. 민주당과 의협 간 합의안에는 의료계에서 파업 철회 조건으로 내걸어 온 “의대 정원 확대 공공의대 신설 추진 등을 원점에서 재검토한다”는 내용이 담겼다. 2020. 9. 4 정연호 기자 tpgod seoul.co.kr 한정애 더불어민주당 정책위의장은 5일 정부·여당과 대한의사협회 의협 의 합의에도 전공의들이 집단휴진을 지속하는 것과 관련해 “전공의들도 의료계 내부의 절차적 문제를 삼는 것이지 합의 자체를 문제 삼진 않는다”며 “돌아올 명분은 확보됐다고 본다”고 말했다. 한 의장은 이날 JTBC 뉴스룸에 출연해 “ 의료계와의 합의가 쉽지는 않았지만 서로 문제 의식은 같으니 방법을 찾아보자고 하면서 합의에 이르렀다”며 이같이 밝혔다. MobileAdNew center 특히 당내에서 ‘백기투항’이라는 비판이 나오는 데 대해 “코로나19 신종 코로나바이러스 감염증 와 전쟁을 치르는 상황에서 의료인들이 의료 현장을 지키게 하는 것도 정부 역할”이라며 “아픈 사람들은 빨리 치료를 받아야 하는데 그 절박함도 정부가 책임질 필요가 있다”고 강조했다. 그러면서 “국민과 환자에게 백기투항했다는 건 받아들일 수 있다”며 “ 공공의료 확충 정책을 절회하거나 정책을 추진하지 않으려는 것 아니냐는 것에는 동의하지 않는다”고 일축했다. 한 의장은 특히 “ 의대 정원 확대에 국민적 공감대는 형성됐다고 본다. 그랬기에 노사정 합의까지 다 된 것”이라면서도 “의료계에서 핵심이라고 할 수 있는 의료를 책임지는 분들과의 소통은 조금 부족하지 않았나”라고 평가했다. 논의 재개 시점에 대해서는 “ 일일 확진자 수가 10여명 수준으로 나오고 감염 경로가 불확실한 확진자의 발생률이 낮게 유지되면 논의를 시작할 수 있지 않나 생각한다”고 답했다.
20200905,오후 11:04,정치,美CSIS 北SLBM 시험발사 준비 활동 포착,서울 뉴시스 CNN은 미국 미들베리대학과 상업용 위성사진업체 플래닛사로부터 입수한 위성사진을 분석한 결과 북한이 함경남도 신포시에 위치한 해군조선소에서 진행 중인 잠수함 건조 작업이 진척을 거둔 것으로 보인다고 23일 현지시간 보도했다. 사진 CNN 홈페이지 갈무리 2019.09.24 사진 뉴시스 북한이 2016년 함경남도 신포 인근 해상에서 잠수함발사탄도미사일 SLBM 을 시험발사한 모습. 뉴스1DB 2017.2.12 뉴스1 사진 뉴스1 파이낸셜뉴스 북한의 중거리 잠수함발사탄도미사일 SLBM 시험 발사 준비 정황이 포착됐다. 미국 싱크탱크 전략국제문제연구소 CSIS 는 4일 현지시간 함경남도 신포 조선소 위성사진을 공개하면서 조선소 보안 구역 내 여러 척의 선박이 정박돼 있는데 그중 하나가 수중 발사 시험용 바지선을 끌어낼 때 사용된 예인선과 유사하다 고 밝혔다. CSIS는 이런 움직임은 북한이 바지선에서 SLBM 북극성 3호 를 시험 발사 하기 위한 준비 작업을 하고 있다는 것을 암시하지만 그 증거는 결정적이지는 않다 고 말했다. 앞서 북한은 작년 10월 외부 위협을 억제하고 자위권을 강화하기 위한 노력의 일환으로 신형 SLBM인 북극성 3호를 성공적으로 시험 발사했다고 밝힌 바 있다. CSIS는 아울러 이런 움직임은 북한이 지난 1년간 탄도미사일과 SLBM 개발 측면에서 진전을 거뒀고 정권 수립일 9월 9일 이나 노동당 창건 기념일 10월 10일 새로운 능력을 입증할 것이라는 추측을 뒷받침한다 고 전했다. 앞서 신포조선소에서 SLBM을 위한 잠수함과 함께 미사일 수중 사출 장치가 지속적으로 포착되고 있는 것으로 전해졌다. 국가정보원이 지난달 20일 국회 정보위원회에 보고한 내용에 따르면 신포 조선소에서 고래급 잠수함과 수중 사출 장비가 한미 정보 당국에 의해 지속적으로 식별되고 있다. 한편 로이터통신 등은 도널드 트럼프 대통령이 11월 미국 대선에서 재선을 노리는 상황에서 북한이 대선 전에 미사일 시험 발사를 할 경우 트럼프 대통령과 김정은 위원장의 전례없는 회동에도 핵 협상에서 큰 진전이 없었다는 점이 부각될 것이라고 평가했다. 빅터 차 CSIS 선임연구원은 트위터를 통해 신포 조선소의 움직임으로 인해 트럼프 대통령이 북한은 큰 일이 아니다 모든 나라가 그렇게 한다 고 일축하기 어렵게 됐다 고 전했다. 그는 또 북한이 준비 중인 것이 김 위원장이 언급했던 새로운 전략무기 일 수 있다고 부연했다.
20200905,오후 11:02,정치,신동근 “끝난 게임인데 참 딱하다”… 이재명 “국민은 생존의 문제”,‘친문’ 신 의원 “왜 미련을 못 버리나 제대로 주먹을 날리려면 때론 뒤로 물러나야” 이 지사 “집권 여당 최고위원으로서 국민의 팍팍한 삶과 현실에 좀 더 진지해 주시면 어떨까” 이재명 경기도지사 왼쪽 와 신동근 더불어민주당 의원. 연합뉴스 이재명 경기도지사가 ‘친문 親文 ’으로 꼽히는 신동근 더불어민주당 최고위원과 2차 재난지원금을 두고 사회관계망서비스 SNS 상에서 설전을 주고받았다. 신 최고위원은 지난 4일 밤 자신의 트위터에 올린 글에서 “1인당 10만원씩이라도 2차 재난지원금을 줘야 한다”는 이 지사의 발언과 관련해 “철학으로 보나 정책으로 보나 납득이 안 가는데 왜 미련을 못 버리냐”라며 “참 딱하다”라고 했다. 이어 “이미 재난지원금 지급 대상 끝난 게임”이라고 지적한 신 최고위원은 “제대로 주먹을 날리려면 때론 뒤로 물러나야 한다. 하지만 너무 물러나면 주먹을 날릴 수 없다”라고 이 지사에게 일침을 날렸다. 이미 당정 간 ‘선별지원’ 쪽으로 결론 난 재난지원금 관련해 이 지사가 계속해서 ‘전국민 보편 지급’을 주장하는 게 안쓰럽다는 의미였다. 이 지사 “게임 아니라 생존의 문제” 그러자 이 지사는 다음날 자신의 트위터에 “재난지원금을 선별 소수에 현금 지급할지 지역화폐로 전국민 지급할지는 위원님께는 게임이겠지만 국민은 생존의 문제”라고 발끈했다. 이어 그는 “게임 끝인지 시작인지는 시간이 말해 주겠지만 집권 여당 최고위원으로서 국민의 팍팍한 삶과 현실에 좀 더 진지해 주시면 어떨까 싶다”라고 쏘아붙였다. 신 의원은 이전에도 이 지사가 주장해온 기본소득제에 관해 “오히려 불평등을 완화하기보다 강화할 수 있다”라고 비판한 바 있다. 한편 이 지사는 1인당 30만원씩 전 국민에게 2차 재난지원금을 지급해야 한다고 주장해왔다. 하지만 4일 당정이 ‘선별지원’ 쪽으로 의견을 모으자 “준비된 재난지원금이 8조원이라면 1인당 10만원씩 지급하고 나머지로는 선별 핀셋 지원하는 절충적 방안도 검토해 주시기 바란다”라고 한발 물러난 모습을 보이기도 했다.
20200905,오후 11:01,정치,속보 한정애 “전공의 의료현장 돌아올 명분 확보”,한정애 더불어민주당 정책위의장 오른쪽 과 최대집 대한의사협회장이 4일 오전 서울 여의도 민주당사에서 정책협약 이행 합의서에 사인 후 포즈를 취하고 있다. 민주당과 의협 간 합의안에는 의료계에서 파업 철회 조건으로 내걸어 온 “의대 정원 확대 공공의대 신설 추진 등을 원점에서 재검토한다”는 내용이 담겼다. 2020. 9. 4 정연호 기자 tpgod seoul.co.kr 한정애 더불어민주당 정책위의장은 5일 정부·여당과 대한의사협회 의협 의 합의에도 전공의들이 집단휴진을 지속하는 것과 관련해 “전공의들도 의료계 내부의 절차적 문제를 삼는 것이지 합의 자체를 문제 삼진 않는다”며 “돌아올 명분은 확보됐다고 본다”고 말했다. 한 의장은 이날 JTBC 뉴스룸에 출연해 “ 의료계와의 합의가 쉽지는 않았지만 서로 문제 의식은 같으니 방법을 찾아보자고 하면서 합의에 이르렀다”며 이같이 밝혔다. MobileAdNew center 특히 당내에서 ‘백기투항’이라는 비판이 나오는 데 대해 “코로나19 신종 코로나바이러스 감염증 와 전쟁을 치르는 상황에서 의료인들이 의료 현장을 지키게 하는 것도 정부 역할”이라며 “아픈 사람들은 빨리 치료를 받아야 하는데 그 절박함도 정부가 책임질 필요가 있다”고 강조했다. 그러면서 “국민과 환자에게 백기투항했다는 건 받아들일 수 있다”며 “ 공공의료 확충 정책을 절회하거나 정책을 추진하지 않으려는 것 아니냐는 것에는 동의하지 않는다”고 일축했다.
