date,time,category,headline,content
20200905,오후 3:20,정치,당국 대규모 집단 감염 시 전국으로 확산…방역 고삐 더욱 조여야,선별진료소 사진 연합뉴스 국내 신종 코로나바이러스 감염증 코로나19 확진자가 사흘 연속으로 100명대로 나타나면서 방역당국은 코로나19 확산세가 점차 누그러들고 있다는 점을 보여주는 몇 가지 요인을 긍정적으로 평가했습니다. 다만 대규모 집단감염이 발생하면 언제라도 다시 코로나19가 전국에 급속히 퍼져나갈 수 있는 만큼 이런 시기에 거리두기와 마스크 착용 등을 더욱더 철저하게 지켜 위험의 크기를 줄여야 한다고 강조했습니다. 권준욱 중앙방역대책본부 방대본 부본부장은 5일 충북 오송 질병관리본부에서 열린 브리핑에서 국내 환자 발병 추이를 설명하며 오늘의 상황을 보면 긍정적으로 평가할 지점들이 많이 있다 고 진단했습니다. 권 부본부장은 무엇보다 전체적인 확진자 발생 규모가 줄어들었고 감염경로 미분류 규모와 비율이 감소했다. 그리고 중증환자의 발생 규모도 증가세가 느려졌고 자가격리자 규모도 감소세에 있다 라고 설명했습니다. 방대본에 따르면 이날 0시 기준 국내 확진자는 168명으로 지난 3일 이후 사흘째 100명대를 유지하고 있습니다. 상태가 위중하거나 중증 이상인 환자는 159명입니다. 앞서 위중·중증 환자는 하루에 20∼30명대의 증가 폭을 보였으나 지난 3일부터 이날까지는 154명 157명 159명 등의 일별 추이를 기록하는 등 증가세가 주춤해진 모습입니다. 권 부본부장은 이런 상황일수록 방역의 고삐를 바짝 조여야 한다고 강조했습니다. 그는 국민 여러분의 적극적인 거리두기로 간신히 확진자 증가세 등이 억제된 지금 상황에서는 대인 접촉 및 모임 자제 등을 계속 유지하면서 위험의 크기를 더더욱 크게 줄여놔야 한다 고 말했습니다. 이어 지금의 상황은 사실 언제라도 또 한 번의 대규모 집단 발생이 있으면 전국 발생으로 번질 수 있다. 이는 역학 역량을 넘어 의료 대응 체계까지도 마비시킬 수 있는 그동안 쌓여온 누적된 위험이 매우 큰 시기 라고 평가했습니다. 가을 겨울철이 되면 인플루엔자 독감 를 비롯한 호흡기 감염병까지 유행할 수 있기 때문에 코로나19 방역 대응에 있어 불리한 여건이 될 수 있다는 게 권 부본부장 설명입니다. 그는 지금의 거리두기 시기는 우리 지역사회 내에서 조용한 전파를 발견하는 시기로도 활용돼야 하기에 조금이라도 의심 증상이 있거나 위험한 상황에 노출된 분들은 적극적으로 검사받아달라 고 당부했습니다. 그러면서 앞으로도 코로나19의 확산 억제가 번갈아 발생할 수 있고 언젠가는 불가피하게 3단계 거리두기가 시행될 수 있겠지만 그 상황은 최후의 수단이 되어야 한다 면서 국민 모두가 방역에 동참해달라고 요청했습니다.
20200905,오후 3:16,정치,野 추미애 아들 휴가 의혹 특임검사가 수사해야 與 지나친 정치공세,국민의힘 檢 8개월째 수사 뭉개고 장관 눈치만 살펴 민주당 해당 사건 이미 검찰이 수사 진행 중 국민의힘은 5일 추미애 법무부 장관 아들의 군 휴가 특혜 의혹과 관련해 추 장관과 윤석열 검찰총장에게 특임검사 임명을 요청한다 고 했다. 이에 대해 더불어민주당은 지나친 정치공세라고 비판했다. 지난 1일 국회 예결위의장에서 전체회의가 열린가운데 추미애 법무부장관이 질의에 답하고 있다. 연합뉴스 김은혜 국민의힘 대변인은 이날 서면 논평을 통해 8개월째 수사를 뭉개고 있는 검찰은 장관의 눈치만 살필 뿐 의지가 보이지 않는다 며 이같이 요구했다. 김 대변인은 사제 병원 에 자택 병가 연장 전화 휴가 군에 다녀온 젊은이들은 언감생심 꿈도 꾸지 못할 일들 이라며 의사소견서 휴가명령서 아무것도 남아 있지 않다. 행정기록에 죽고 사는 군을 대표하는 장관은 행정절차상 오류 라며 60만 병사 사기를 꺾는다 고 했다. 그는 검찰은 고발 8개월째 함흥차사다. 심지어 전화받았다 는 진술마저 애매하다고 조서에 넣지 않았다고 한다 며 민주당은 장관 아들 질의가 나오려 하면 멀쩡한 상임위를 중단시킨다 고 했다. 그러면서 장관 아들 한 명 살리겠다고 전 부처가 난리통인게 정상인가 라고 했다. 김 대변인은 이 모든 불공정과 부정의는 추 장관 본인이 풀어야 한다 며 아들이 눈물 흘리고 있다 고 가슴 아파하는 엄마라면 그 아들이 당당하게 살아갈 수 있도록 더더욱 국민 앞에 해명해야 한다 고 했다. 이어 그러지 못한다면 법과 정의를 지키는 그 자리에 있을 이유가 없다 고 말했다. 이에 대해 강선우 대변인은 이날 구두논평에서 해당 사건에 대해서 이미 검찰이 수사를 진행 중인데 이런 절차를 건너뛰자는 것도 앞뒤에 맞지 않는 것 이라고 했다. 강 대변인은 검찰총장이 임명하는 특임검사 제도는 주로 검찰 내 비리 사건이 수사 대상 이라며 법무부 장관 임명 전 시기에 있었던 가족 관련 일에 적용하자는 것도 맞지 않는다 고 말했다.
20200905,오후 3:10,정치,홍준표 좌파정권 패악 최초 굴복 시킨 의료진…계속 지지,무소속 홍준표 의원. 연합뉴스 홍준표 무소속 의원이 5일 문재인 정권 출범 후 좌파정권의 패악을 최초로 굴복시킨 것은 야당이 아닌 여러분 의료진 이라며 의료진을 지지한다는 메시지를 남겼다. 홍 의원은 이날 페이스북을 통해 여러분들이 아니었으면 의료 개악이 지난번 부동산 정책 개악처럼 무대포로 국회를 통과했을 것 이라며 이같이 말했다. 전날 대한의사협회는 더불어민주당과 밤샘 협상 끝에 의대 정원 확대와 공공의대 신설 등 논의를 중단하고 원점에서 재논의하기로 합의했다. 홍 의원은 나는 여론의 역풍에도 불구하고 의료진 파업을 처음부터 옳다고 보고 적극 지지했던 사람 이라며 의협 회장단의 정부.여당과의 합의를 파기하고 다시 거리에 나가야 한다는 주장도 일리가 있습니다만 지금은 의료계가 하나로 뭉칠때라고 본다 고 말했다. 그러면서 일단 합의된 안이 지켜지지 않을 때 그때는 대대적으로 대정부 투쟁을 해도 늦지 않는다 며 한 번에 모든 것을 다 얻을 수도 없고 상대방을 완벽하게 굴복시킬 수도 없는 것이 세상사 라고 했다. 또 모두 하나로 뭉쳐 의료 개악을 저지하자 며 계속 여러분들을 지지하겠다 고 덧붙였다. 홍 의원은 전날에도 페이스북을 통해 이번 의료계 파동에 빛난 것은 최대집 의협 회장을 비롯한 의협 지도부의 지도력 이라며 의료진들을 추켜세웠다. 그는 망설이는 의료계를 하나로 뭉치게 하고 문정권의 폭정 폭주에 감연히 맞선 그들의 강단과 용기는 참으로 대단했다 고 말했다. 또 여론의 눈치나 보는 야당과 손잡지 않고 오로지 내부의 단합된 힘만으로 문정권의 폭주를 막아낸 것은 참으로 대단한 일 이라며 하나가 되면 이길 수 있다는 확신을 심어준 것도 크나큰 성과 라고 평가했다.
20200905,오후 3:08,정치,이재명 게임끝 신동근에 국민 팍팍한 삶에 진지해 달라,이재명 경기도지사 vs 친문 신동근 의원 2차 재난지원금 두고 SNS 신경전 이재명 경기도지사와 신동근 더불어민주당 최고위원이 2차 재난지원금 선별·보편 지원 논란을 두고 날선 신경전을 벌였다. 신 위원은 지난 4일 자신의 소셜미디어 SNS 를 통해 국민 1인당 재난지원금 10만원씩이라도 주자 는 이재명 지사의 절충안을 언급하며 철학으로 보나 정책으로 보나 납득이 안 가는데 왜 미련을 못 버리냐. 이미 게임 끝인데 라며 참 딱하다 고 했다. 이에 이 지사는 5일 오전 자신의 트위터에 10조원 재난지원금을 선별 소수에 현금 지급할지 지역화폐로 전국민 지급할지는 위원님에게는 게임이겠지만 국민은 생존의 문제 라고 썼다. 그는 게임 끝인지 시작인지는 시간이 말해 주겠지만 집권 여당 최고위원으로서 국민의 팍팍한 삶과 현실에 좀 더 진지해 주시면 어떨까 싶다 고 지적했다. 1인당 30만원씩 전 국민에게 재난지원금을 줘야 한다며 연일 페이스북을 통해 여론전을 펴온 이 지사는 4일 당정이 선별지원 쪽으로 가닥을 잡자 준비된 재난지원금이 8조원이라면 1인당 10만원씩 지급하고 나머지로는 선별 핀셋 지원하는 절충적 방안도 검토해 주시기 바란다 고 홍남기 경제부총리에게 마지막 제안을 하기도 했다. 정부와 여당은 2차 재난지원금을 선별 지급하는 방향으로 가닥을 잡고 지급 대상과 기준을 구상 중이다. 1인당 30만원씩 전 국민 지급을 주장해온 이 지사는 4일 홍남기 부총리에게 준비된 재난지원금이 8조원이라면 1인당 10만원씩 지급하고 나머지로는 선별 핀셋 지원하자 며 절충안을 제시했다.
20200905,오후 3:03,정치,정세균 총리 “전공의·전임의 조속히 복귀해 코로나 위기극복 동참해 달라”,정세균 국무총리가 5일 오전 서울 노원구 한국전력공사 인재개발원에 마련된 생활치료센터를 방문해 김연수 서울대학교병원 원장 왼쪽 과 함께 의료지원반을 둘러보고 있다. 출처 연합뉴스 스포츠서울 김민규기자 “전공의와 전임의들은 조속히 진료현장에 완전 복귀해 수도권 코로나19 위기극복에 동참해 달라.” 정세균 국무총리가 5일 서울 노원구 한국전력 인재개발원에 마련된 서울시 생활치료센터를 찾아 운영상황을 점검하고 이같이 촉구했다. 또한 정 총리는 이 자리에서 전날 여당과 대한의사협회 합의에 대해서도 언급했다. 그는 “정부 여당과 대한의사협회가 어제 오랜 진통 끝에 합의해 늦었지만 참 다행이다”고 말했다. 전공의와 전임의들은 전날 정부 여당과 의협이 최종합의를 이뤘음에도 아직 집단 휴진을 이어가고 있는 상황이다. 정 총리는 서울대병원 의료지원단을 비롯해 센터 관계자들을 격려하며 “서울대병원 전공의들은 사직서 제출 후에도 자원봉사 형태로 코로나19 관련 진료 현장에 참여한 것으로 알고 있다”면서 “의사들은 환자 곁에 있어야 제 역할을 올바르게 다 할 수 있다”고 강조했다. 아울러 그는 서울대병원이 지난 3월 대구·경북 지역 확진자 급증 당시 문경에 있는 연수원을 생활치료센터로 운영한 것에 대해 “사태 안정화에 결정적인 기여를 했다”며 감사의 인사를 전했다.
20200905,오후 3:02,정치,만기친람식 벗어나 역할 분담… ‘코로나 시대’ 변화하는 北 김정은 체제 한반도 인사이트,새 통치 시스템 구축 가시화 담당간부 자율성 부여 동시에 책임도 金 핵심사안 최종결정권 그대로 유지 金 대면접촉 줄이고 회의 통해 국정 고위급들이 주민들 만나고 현안 챙겨 북한식 특성 가미된 ‘21세기형’ 분석 지난 8월 19일 김정은 북한 국무위원장 주재 하에 노동당 중앙위원회 제7기 제6차 전원회의가 열렸다고 당 기관지 노동신문이 20일 보도했다. 사진 왼쪽부터 리병철 중앙군사위원회 부위원장 박봉주 국무위원회 부위원장 김 위원장 최룡해 최고인민회의 상임위원장과 김덕훈 신임 내각 총리의 모습. 뉴스1 김정은 북한 국무위원장이 집권 9년 차에 접어들며 통치방식의 변화가 가시화하고 있다. 그동안의 국정 운영 자신감을 바탕으로 만기친람식 통치를 벗어나 분야별로 역할과 책임을 일정 부분 분담하는 방식이다. 코로나19 국면을 맞아 대면접촉이 많은 현지방문 대신 회의를 자주 열어 국정을 운영하는 모습도 보이고 있다. 실로 파격의 연속이다. 대남·경제·국방 등 역할 분담 최근 북한의 ‘위임통치’라는 표현이 등장하며 관심을 끌었다. 국가정보원이 지난달 20일 국회 정보위원회 비공개 현안보고에서 김 위원장이 국정전반에서 위임통치를 하고 있다고 설명하면서부터다. 분야별로 대남·대미 전략은 김여정 제1부부장 경제 분야는 박봉주 당 중앙위원회 부위원장과 김덕훈 내각총리 군사 분야는 최부일 군정지도부장과 전략무기 개발을 전담하는 리병철 당 중앙군사위원회 부위원장 등으로 권한을 일부 이양했다는 분석이다. 정보위 미래통합당 간사인 하태경 의원은 브리핑에서 “김 위원장이 그동안 9년 통치하면서 ‘통치 스트레스’가 많이 높아졌는데 그것을 줄이는 차원”이라며 “정책실패 시 권한을 위임받은 쪽에 책임을 돌릴 수도 있다”고 설명했다. 위임통치라는 용어는 비상사태를 연상시킨다. 하지만 현재 김 위원장의 1인 지배체제는 공고하며 역할과 책임을 일정부분 분산하는 방식으로 예전부터 사용해오던 통치술에 가깝다는 게 전문가들의 평가다. 정성장 세종연구소 북한연구센터장은 위임통치를 “김 위원장이 절대권력과 핵심 사안에 대한 최종결정권을 보유하면서도 핵심 간부들에게 담당 분야에서의 정책결정에 대해 상당한 자율성을 부여하고 동시에 결정의 결과에 대해 승진이나 강등 등과 같은 방식으로 확실하게 책임을 묻는 방식”이라고 정의했다. 통일부도 지난달 25일 “김 위원장이 당·정·군을 공식적·실질적으로 장악한 상황에서 분야별 ‘역할 분담’을 한 것으로 평가한다”고 국회 외교통일위원회에 보고했다. 전면에 나선 고위 인사들 최근 북한 고위 간부들이 수해 등의 현장에서 주민들을 만나 현안을 직접 챙기는 모습이 북한 매체를 통해 자주 공개되는 것도 눈에 띈다. 지난 8월 30일 박봉주 북한 국무위원회 부위원장이 황해남도 일대를 찾아 태풍피해 복구 정형을 현지에서 료해 파악 했다 고 노동당 기관지 노동신문이 전했다. 뉴스1 북한 노동당 기관지 노동신문은 지난달 30일자 1면에 이례적으로 박봉주 부위원장과 김덕훈 총리의 황해남도 태풍 피해복구 현장 방문 사진을 실었다. 신문은 이어 1일에도 1면에 리병철 부위원장과 박봉주 부위원장을 비롯한 고위 간부들이 황해남도를 방문한 소식을 전하며 “태풍피해 복구사업을 지도했다”고 보도했다. 그동안 노동신문 1면에는 김 위원장의 동향이 주로 보도됐으며 그 외에는 김 위원장을 대리한 사람이 외국 정상과 회담을 위해 출입국하는 모습이 예외적으로 실리는 정도였다. 정 센터장은 “노동신문 1면 상단에 김 위원장이 아닌 다른 인물이 나온 것은 과거에는 상상할 수 없는 것”이라며 “기존에 김 위원장과 노동당에 대해서만 썼던 ‘지도’라는 표현을 리병철 등에게 쓰기도 했다”고 분석했다. 지도자가 현장을 방문해 점검하는 ‘현지요해’ 활동을 내각총리가 하도록 공식화시킨 것도 김 위원장의 집권 이후 달라진 점이다. 이와 관련해 분야별 책임자의 공개활동은 늘어난 반면 김 위원장의 공개활동은 줄었다. 김 위원장은 2010년대 초반 연간 200회 전후의 왕성한 공개활동을 하다가 지난해는 85회 올해는 8월까지 34회에 그쳤다. 김정은 북한 국무위원장이 지난 5월 1일 순천인비료공장 준공식에 참석해 테이프를 끊고 있다. 사진 왼쪽 뒤편에 동생인 김여정 당 제1부부장이 보인다. 세계일보 자료사진 홍민 통일연구원 북한연구실장은 “김 위원장의 집권 초기에는 모든 단위를 현장까지 가서 파악했지만 점차 핵심분야만 전략적으로 방문하는 식으로 역할분담이 세분화되고 있다”며 “전략적 핵심분야의 중간책임자 역할을 강화하고 책임도 일정부분 지우는 방식으로 부담을 더는 것”이라고 말했다. 현지방문 대신 회의 늘어 북한에서 지도자가 모든 분야를 만기친람식으로 관장하며 현지를 직접 방문하고 과업을 지시하는 전통적인 통치방식은 지난 70년 동안 이어져온 것이다. 김 위원장 집권 이후 이 같은 통치방식의 변화가 시작됐으며 최근 코로나19 정국에서 가시화됐다는 분석이 나온다. 특히 최근 김 위원장은 현지방문 대신 당 회의를 부쩍 자주 열고 있다. 올해 집권 이후 최다 수준인 13차례의 회의를 공개했다. 회의 종류도 정치국 회의 정무국 회의 전원회의 등 다양하며 당 중앙군사위 예비회의 등 집권 후 처음 등장한 형식의 회의도 있었다. 주요 사안은 국가방역사업과 태풍 피해 예방책 등 민생 현안이었다. 김정은 북한 국무위원장이 조선노동당 중앙위원회 제7기 제13차 정치국 회의를 주재하고 있다. 세계일보 자료사진 홍 실장은 “김 위원장이 코로나19 국면을 맞아 대면 현장활동을 하는 것이 물리적으로 어려워졌다”며 “대신 회의체를 주재하며 어떤 문제에 대응해 사전 조치를 취하고 계획을 발표하는 등 민생조치를 신속히 취하는 모습을 주민에게 꼼꼼하게 공개하며 코로나19 시대에 효과적으로 통치활동을 하는 것”이라고 설명했다. 이와 관련해 북한 지도부를 연구하는 켄 고스 미 해군분석센터 CNA 분석국장은 최근 미국의소리 VOA 방송에 공식 회의를 통해 북한 지도부가 정책을 토론할 기회를 얻고 있는 지금의 변화는 앞으로 더욱 두드러질 것이라며 “북한식 특성이 가미된 21세기형 통치체제가 확립되고 있다”고 말했다.
20200905,오후 3:02,정치,김여정 당 조직지도부 장악… 2인자·후계자설 무성 한반도 인사이트,존재감 드러낸 김여정 제1부부장 2018년 北 특사로 南 방문하면서 조명 2020년 들어 자신 명의의 대남·대미 메시지 남북 연락사무소 폭파 지시 나서기도 김여정 노동당 제1부부장. AFP연합뉴스 올해 김정은 북한 국무위원장의 통치체제 변화와 함께 동생 김여정 노동당 제1부부장의 특별한 역할에 대해서도 관심이 모이고 있다. 김 제1부부장이 본격적으로 조명되기 시작한 것은 2018년 북한이 비핵화 협상에 나서면서부터다. 그는 북한 특사 자격으로 남한을 방문해 김 위원장의 친서를 문재인 대통령에게 전달하고 남북 정상회담과 북·미 정상회담 등 김 위원장의 모든 대외 행보에 함께하며 존재감을 과시했다. 올해는 김 제1부부장이 대미·대남사업까지 관장하면서 역할이 커졌다. 지난 3월 김 제1부부장은 처음으로 자신 명의의 담화를 발표했다. 이후에도 그는 여러 차례의 담화를 통해 대남·대미 메시지를 발산하며 남북 연락사무소 폭파 등을 지시하는 모습을 보였다. 이 과정에서 “나는 위원장 동지와 당과 국가로부터 부여받은 나의 권한을 행사한다”고 밝혀 국가 전반의 운영과 관련한 권한을 확보한 상태라는 사실도 전했다. 김 제1부부장의 위상 변화와 관련해 국가정보원은 지난 20일 국회 정보위원회 보고를 통해 김 제1부부장에 대해 정부 기관 중 처음으로 2인자라는 표현을 썼다. 일각에서는 그가 김 위원장의 후계자로 내정됐다는 해석까지 내놨다. 하지만 이인영 통일부 장관은 지난달 25일 국회 외교통일위원회에서 “김 제1부부장이 2인자나 후계자의 위상을 확립해 전권을 행사한다고 말하는 건 무리한 해석”이라며 엇갈린 평가를 했다. 현재까지 확인된 그의 공식 직함은 당 제1부부장이며 소속은 정확히 알려져 있지 않다. 선전선동부 소속으로 출발했지만 현재는 새로운 부서를 맡았을 것이라는 관측이 나온다. 정경두 국방부 장관은 지난달 25일 국방위원회에서 김 제1부부장이 조직지도부를 장악하고 있는 것으로 판단한다고 밝혔다. 조직지도부는 당 간부 인사와 검열 등의 권한을 갖고 있는 북한의 핵심 부서로 현재 부장은 공석이다. 김 제1부부장은 지난 7월 27일 전국노병대회 참석 이후 한 달 넘게 공식 석상에 모습을 드러내지 않고 있다. 최근 열린 당 회의들이 수해나 코로나19 등을 다뤘기 때문에 대외업무를 맡은 그의 역할이 제한적이었고 2인자나 후계자로 거론되는 데 따른 부담감 때문에 활동을 자제한다는 분석이 나온다.
20200905,오후 3:02,정치,‘개점휴업’ 靑 특별감찰관 임대료·관리비만 3년간 26억원 지출,주 원내대표 “특별감찰관 어떻게 채울지 답해달라” 촉구 주호영 원내대표. 연합뉴스 대통령 측근을 감찰하는 청와대 특별감찰관실 특감 이 개점휴업한 지난 3년 동안 임대료와 관리비 등의 명목으로 26억원을 지출한 것으로 드러났다. 국민의힘 주호영 원내대표는 문재인 대통령에게 “특별감찰관을 어떻게 채울지 답해달라”고 촉구했다. 4일 국회예산정책처에 예정처 따르면 2019년 회계연도 결산자료에서 특감실은 지난해 예산액 16억8200만원 중 8억2300만원을 집행하고 8억5900만원을 불용했다. 전체 예산 중 절반 넘는 51.1%를 쓰지 못한 것이다. 청와대는 2016년 9월 이석수 전 초대 특별감찰관이 2016년 9월 사퇴한 이후 후임자를 임명하지 않고 있다. 대통령령인 ‘특별감찰관 직제’에 따르면 특감실은 특별감찰관 1 특별감찰관보 1 감찰담당관 6 및 파견공무원으로 구성해야 하지만 현재 특별감찰관·감찰담당관 등이 공석이며 파견공무원 3명만이 사무실 유지 등의 업무만 수행하고 있다. 특감실은 지난해 편성된 인건비 7억7700만원은 전액 불용했다. 특별감찰관 기본경비 3억8600만원 중 24.9% 9600만원 를 특별감찰활동비 7억2900만원 중 99.7% 7억2700만원 를 집행했다. 특별감찰활동비는 사무실 임차료와 관리비 등 사무실 유지만을 위해 사용됐다. 최근 3년 동안 사무실 유지를 위해 총 26억2000만원의 예산이 집행됐다. 예정처는 또 최초 사무실 계약 기간 2015년 7월∼2018년 7월 이후 특감실의 존속이 불투명해지면서 3개월 단위로 계약 기간을 연장한 것이 임대료 상승의 원인이 됐다고 지적했다. 지난해 사무실 임차보증금 상승 및 임차료 등의 부족 때문에 예산이 2억1000만원 증액돼 집행됐다. 나라살림연구소는 이에 대해 “사실상 개점휴업 상태에서 낭비되고 있는 사무실 운영경비는 기능에 맞게 대폭 삭감해야 할 것”이라며 “현재의 불확실성을 해소하고 유명무실한 상태로 형식적인 운영예산만 지출하고 있는 특별감찰관 제도에 대한 폐지 혹은 개선을 통해 예산 낭비 요소를 해결해야 할 것”이라고 말했다. 주 원내대표는 이날 페이스북에서 “3년이 넘도록 공석으로 두고 있는 ‘대통령 특별감찰관’ 자리에 대해서도 문 대통령은 ‘특별감찰관이 법률상 기구로 이를 적정하게 운영할 의무가 있고 대통령 친인척 비위 감찰이라는 기능에 독자성이 있으므로 공석인 특별감찰관 임명 절차를 진행하고 그 기능을 회복할 필요가 있다’고 강조했던 바 있다”며 “불리하고 곤란한 것에 대해서는 입을 닫아버리는 문재인정권이다. 3년이 넘도록 비워두고 있는 ‘특별감찰관’ 자리는 어떻게 채워갈 것인지 대통령께서 답해 주시기 바란다”고 강조했다.
