,contents
132,"BNK경남은행(은행장 황윤철)은 10일 비파괴검사 전문 기술업체인 ㈜삼영엠아이텍(대표이사 김대권)을 '유망중소기업'으로 선정했다고 밝혔다.창원시 의창구 동읍에 있는 ㈜삼영엠아이텍은 지난 2013년 설립 이후 가스시설, 발전소, 우주항공, 방위 산업, 도로 및 항만 등으로 비파괴검사 분야 사업을 확장했다.BNK경남은행은 ㈜삼영엠아이텍에 '유망중소기업' 현판과 인증서를 교부하고, 앞으로 대출금리 우대 등 금융 혜택을 제공한다.김태한 창원공단지점장은 삼영엠아이텍이 더 큰 성장을 할 수 있도록 지원을 아끼지 않겠다고 말했다.◇BNK경남은행, 설 대여금고·보호예수 무료 이용 서비스BNK경남은행은 설 명절을 앞두고 '대여금고·보호예수 무료 이용 서비스'를 오는 13일부터 2월 13일까지 한 달간 제공한다고 10일 밝혔다.고객 또는 지역민이 BNK경남은행 영업점을 통해 대여금고·보호예수 무료 이용서비스를 신청하면 유가증권, 현금, 귀금속 등 귀중품을 무료로 보관해준다.대여금고 무료 이용 서비스는 대여금고가 설치된 창원, 울산, 부산, 김해 등 79곳 영업점에서만 이용이 가능하고, 보호예수 무료 이용 서비스는 전국 159곳 전 영업점에서 이용할 수 있다.이용 방법은 주민등록증이나 운전면허증 등 신분증을 지참해 가까운 BNK경남은행 영업점을 방문하면 된다.☞공감언론 뉴시스"
133,"사천시, ‘에어로스페이스 에듀케이션 파크’ 조성사업 문체부 공모 선정사업비 180억원 들여 ,2024년까지 사남면 항공우주과학관 일원송도근 사천시장이 25일 사천항공우주교육공원 조성사업에 대해 설명하고 있다. 이선규 기자국내 항공산업의 메카, 경남 사천에 오는 2024년까지 세계 최고의 미국의 스미소니언 국립항공우주박물관 같은 ‘항공우주교육 테마공원’이 들어선다.문화체육관광부가 주관한 ‘2020년 계획공모형 지역관광개발사업’에 사천시가 응모한 ‘에어로 스페이스 에듀케이션 파크’ 조성 사업이 최종 선정됐기 때문이다.미래 항공우주 교육과 실감나는 체험, 가족 휴식 등 다기능을 가진 국내 첫 항공우주교육테마공원 탄생이 기대된다.이에맞춰 송도근 사천시장으로부터 이 사업 추진의 배경과 목적, 사업추진 기본방향, 지역산업 연관과 기대효과 등에 대해 직접 들어봤다.2024년까지 준공될 ‘사천 에어로스페이스 에듀케이션파크’ 의 야간 경관 개념도. 사천시 제공◇이 사업 추진 배경과 목적은 뭔가?-사천시는 국내 유일의 항공기 생산도시, 항공우주산업의 집적지이다. 지역 내 항공국가산업단지 등 연계 가능한 산업관광 인프라에다 한국항공우주산업(KAI) 등 관련 기업체 50여개가 있다.또 삼천포공고(항공마이스터고), 한국항공우주산업진흥협회(사천교육센터) 교육·훈련 시설기관과 사천첨단항공우주과학관, 사천에어쇼，에비에이션캠프 등도 갖춰 이미 항공우주 관광지로서 뛰어난 잠재력을 보유하고 있다.그런데 사천첨단항공우주과학관의 시설이 노후화 돼 최첨단화된 교육과 관광 트렌드를 수용할 수 있는 여건이 부족, 방문객 수가 2013년 8만 5000명선에서 2018년 4만 4000명으로 크게 줄었다．이 시설의 재활성화를 위한 개발사업이 요구됐지만, 그동안 시 자체사업으로 추진하기가 어려웠다. 항공우주 테마의 다양한 콘텐츠 리뉴얼 사업을 통해 일자리 창출과 지역경제 활성화가 필요한 싯점이기도 하다 .◇기본방향은 어떻게?-문화관광체육부 공모에 최종 선정돼 국비 90억원이 확보됐다. 올해부터 2024년까지 5년간 국비 90억원, 도비 27억원, 시비 63억원 등 모두 180억 원을 투입한다.경남도와 사전 컨설팅을 통해 전략적 협력관계를 맺어 경남도비를 보조키로하는 등 전폭적인 지원했다.한국항공우주산업(KAI), 공군 등 민·관·군이 연계 협력을 통해 다양하고, 특화된 항공우주체험 프로그램을 체험할 수 있는 공원으로 만들겠다.체험형 관광자원개발사업의 모범 사례로 만들어 주변 관광자원 연계를 통한 미래형 지역 관광산업기반으로 활용할 수 있도록 하겠다.사천에어로스페이스 에듀케이션 파크 조성 개념도. 사천시 제공◇세부적 추진 계획은?-이 사업은 핵심사업, 관리운영사업, 인프라 개선사업 등 3개 사업으로 나뉜다.핵심사업은 에어로 펀 항공우주체험 프로그램 개발과 에어로 펀 직업체험 프로그램, 에어로 스페이스 에듀케이션파크 활성화 사업 등이 포함된다．이 사업은 매년 10월 개최하는 사천에어쇼 축제 프로그램 가운데 가장 인기를 끄는 프로그램을 이곳에서 상시 운영할 계획이다.무인항공기, 에어레이싱 체험, 경비행기와 헬기 체험비행, 공군실제시뮬레이터(kt-1) 등 민·관·군을 연결한 관광코스로 사천시에서만 체험할 수 있는 항공우주체험 콘텐츠를 개발·운영하게 된다.한국항공우주산업(KAI)과 공군3훈비와의 업무협약을 통해 운영이 가능하다고 본다. 또 입체 5D 영상으로 블랙이글스와 전세계 에어쇼를 생생하게 느낄 수 있도록 가상 관람 콘텐츠 프로그램도 선뵐 예정이다.에어글라이더 만들기 체험 등 남녀노소 모두가 체험할 수 있는 에어로펀 놀이체험 프로그램도 개발·운영할 계획이다.항공우주 키즈랜드 직업체험 프로그램도 예정돼 있다. 어린이들을 대상으로 항공우주관련 직업을 체험할 수 있도록 현실체험형 프로그램을 운영하는 것이다.이를 통해 항공기 조종사, 승무원, 항공기정비, 관제사 등 항공·우주관련 직업분야를 선정해 일하는 법을 배우고, 일한 대가로 키즈랜드 화폐로 항공우주관련 상품과 먹거리 체험을 하는 현실직업 체험시스템도 갖춘다.에어로 드림 산업관광(견학)프로그램을 통해 한국항공우주산업(KAI)의 완제기 제조,생산 현장 견학도 할 수 있도록 할 방침이다.항공관련 기관과 단체 근무 경험자와 항공우주에 관심이 있는 현직교사를 지도자로 배치, 이곳을 찾아오는 유소년들에게 미래의 항공우주 관련 직업을 현장감있게 전달할 예정이다.◇준공 후 관리운영은 어떤 방식으로?-사천시와 한국항공우주산업(KAI), 민간전문기구 등으로 공동운영추진 조직을 구성해 운영할 예정이다.이를 통해 일자리 창출과 지역 퇴직자의 재 취업이라는 시너지 효과를 기대하고 있다. 또 지역 항공관련 사업체의 취업을 위한 상설 상담센터도 갖춘다.기존 KAI의 에비에이션 센터와 항공우주박물관, 사천첨단우주항공과학관으로 나뉘어진 비효율적인 관람 동선을 재구성, 연계성을 높여 하나의 교육문화공간으로 거듭나게 하겠다.항공우주박물관 야외공간의 기존 항공기와 VR을 이용한 가상체험시설을 갖춰 야간에도 이용 가능한 우주놀이터와 남녀노소 모두가 즐기는 산책형 정원인 에어로파크로 만들겠다.사천시 사남읍에 있는 기존 사천우주과학관 전경. 사천시 제공◇기대효과는?-시는 이 공원에 연간 방문객 100만명이 찾아오고, 사업 추진기간 내 200개의 새로운 일자리가 창출될 것으로 기대한다.특히 ‘항공우주산업 메카’ 사천의 산업적 특성을 살린, 지속가능한 ‘산업관광’이라는 새로운 관광 모델이 새롭게 탄생할 수 있을 것으로 전망하고 있다.기존의 항공박물관, 전시관 건물에 프로젝트 맵핑으로 우주공간의 다양한 모습을 벽면에 투사, 야간에도 별자리체험과 태양계，은하의 모습을 체험하는 야간경관도 연출할 계획이다．여기에 별빛 정원을 조성해 별과 관련된 전설과 문학을 주제로 한 테마공간으로 야간 포토존 명소로 만들 예정이다.따라서 현재 취약점으로 지적되고 있는 사천의 야간관광객 유치에도 상당한 도움이 될 것이다. 멋진 공원을 기대하고, 성원해 달라.이선규 기자 sunq17 @busan.com"
134," 제21대 국회의원 선거에 출마한 前 청와대 춘추관장 최상화 예비후보(자유한국당) 는 22일 보도자료를 통해 대표 공약을 발표했다.최 예비후보는 출마 전부터 사천읍에 있는 지역발전연구소를 운영하면서 지역민심을 훑어가며 지역 경제 활성화 위해 고심해왔다고 밝혔다. 또한 국회와 정부, 남동발전에 있으면서 지자체 관계자들과 현안사업에 대한 고민에 대한 결과로 케이블카 유치, 체육시설 유치, 버스터미널 이전사업, 남일대 해수욕장 정비사업, 재래시장 개선사업, 수해지역 숙원사업, 의료시설 등이 성과라고 말했다. 최 예비후보는 사천·남해·하동은 인근도시의 장점과 인프라를 잘 활용하고 산과 강, 섬과 바다가 어우러진 천혜의 자연환경을 가지고 있고 고속도로, 항만, 공항을 갖춘 육해공 사통팔달의 교통요지라고 강조했다. 그는 이를 토대로한 지역 경제 발전 방안을 마련했다. 먼저 사천·남해·하동 통합 공약으로는 산업 부분 ▲하동·남해·사천 지역 언론이 출자 참여하고 투자은행이 출자하는 공중파 방송국 설립 ▲신호 없는 거리 조성(지하도로 및 회전로타리 등) ▲도심내 고압선 철탑 지중화 사업 각 시군구 관내 하천, 저수지 등 복개화 및 친환경 조성 사업 ▲사천·남해 진양호(남강댐)하류 피해 상습지역 보상 및 대책 특별법 제정 ▲경남, 전남 해상경계 중간 수역 획정 추진을 내걸었다.관광 부분은 사천강, 섬진강 관광휴양단지 건설 투자 유치 ▲금오산 ~ 비토산 ~ 각산 구간 해상 케이블카 18킬로미터 투자유치 ▲사천, 남해, 하동을 순환하는 친환경 관광 시티버스 운영 ▲하동·남해·사천에 해양 휴양 관광도시지역에 크루즈 선박 부두 및 요트 마리나 건설 투자 유치 ▲사천강, 섬진강 관광휴양단지 건설 투자 유치 ▲목공예 종합 전수관 등을 공약했다.농업, 축업, 어업 부분에서는 ▲전통시장 개선사업 일환으로 쉼터,주차장 및 편의시설 확충 및 청년창업 연계를 통한 전통 시장 활성화 방안 마련 ▲태양에너지 복합 스마트 팜 빌딩형 농장, 어장, 축사 기술 자본 유치 ▲첨단기술과 자본을 가진 기업과 지역 농·어·축산민과 전략적 제휴 추진, 첨단기술기업 자본과 기술 투자 하고 농,어,축산민이 생산한 상품을 수매해 단일 브랜드로 판매 ▲농촌 고령자를 위한 농지위탁 경영제도 도입을 약속했다.복지 부분은 ▲사천시, 하동군, 남해군 각 시군에 2000실 내외 규모, 메디컬 국제병원호텔 설립 ▲메디컬 국제호텔병원에 지역 주민 의료비 30%할인 지원 협약 ▲메디컬 국제호텔병원에 지역 최저 계층 주민 무료치료지원 협약 ▲시, 군유지를 활용한 영구임대주택 3000 세대 공급 ▲농어촌 낙후지역 주민을 위한 찾아가는 의료 서비스 셔틀 버스 도입 ▲시, 군 소유 산지를 활용한 시, 군민 무료 수목장 조성 ▲1~2인 가구 임대주택, 신혼부부 행복주택, 노인복지타운 등 대상별 편의증진을 위한 주거 공급 확대 및 사회인프라 확충 ▲퇴직자, 귀촌인 등 전원주택 마을 조성 ▲대규모 종합 도서관 건립(우주항공도서관, 보물섬도서관, 섬진강도서관) ▲해양 치유 복합단지 조성사업을 내세웠다.사천시 공약으로 먼저 산업 부분은 ▲자기부상 열차 클러스트 산업도시 건설(투자비 약 8조 3천억/고용창출 일 1만명/년 365만명 계획도시인구 약 30만 ▲항공우주 부품·소재산업 연구센터 유치 ▲삼천포항(제주도 항로 개통, 크루즈 항구)인근 접경지역 활성화 방안 마련 ▲중국국제노선 및 국내노선 확충을 통한 사천공항 활성화 방안 마련 ▲늑도-신도-두응도-마도-저도 연결교 건설 ▲사천 케이블카 연계 사업 리조트, 유스호스텔 유치 ▲사천 서부권 테크노파크유치 ▲구룡저수지 등 관내저수지 둘레길 및 공원 사업 추진 ▲사천강(사주리~정동)주변 환경 및 관개 개선 사업 추진 ▲항공MRO산단 등 주변지역 가구세대 이주 지원 ▲제2사천대교(항공산업대교) 추진 ▲곤양~곤명간 국지도58호선 도로개량 사업 추진 ▲삼천포 터미널 이전 및 현대화 추진이다. 관광산업 부분은 ▲사천만(남일대-실안-광포만-남양-용현-선진-사남-정동-사천읍-서포권-곤양-곤명)을 잇는 사천12선비길(역사·문화 체험 해안둘레길, 자전거 종주길) 조성 ▲남일대 일원 세계조각대회 유치를 통한 세계조각공원 조성 ▲사천종합역사박물관 설립 ▲해양 생물 체험관 조성 ▲항일독립운동 기념비 추가 설립 ▲무지갯빛 생태탐방로 추진(실안~대방~늑도)을 공약했다.복지,교육 부분은 ▲KAIST에 위탁 운영하는 영재 유치원, 초등학교, 고등학교 유치 ▲KAIST에 위탁 운영 하는 풍력, 자기부상열차, 항공우주, 기계공학 특성화 대학교 유치▶ 항공 특성화 고등학교를 설립해 교육인프라를 구축 ▲사천읍 관내 지역응급센터 구축하겠다. 하동 공약으로 산업 부분은 ▲갈사만 풍력크러스트 산업도시 건설 투자유치 (투자비 약 12조 5천억/고용창출 일 1.5만명/년 500만명 계획도시인구 약 25만명) ▲갈사만 대송산업단지, 두우레저단지 산업 역할 강화 마련 ▲갈사산단 원유, LNG 허브터미널 조기화 추진 ▲국도2호선 하동구간 4차선화 추진 ▲경전선 진주-광양 구간 전철화 사업 조기화 추진▲ 섬진강 환경친화적 복개화 사업 추진 ▲산업활성화를 위한 국도, 지방도 신설 및 확장공사 추진(하동IC -> 산청, 단성 IC 연결 산업도로 개설, 하동 악양 동-서 연결 생활도로 개설) ▲하동 내 주요구간 택시 승강장 설치를 약속했다.농어업 부분은 ▲하동 다인박물관 건립 추진 ▲수출형 농업상품에 대한 지원 및 대책 마련하고 관광산업 부분은 ▲청학동 관광지 정비사업 추진 ▲최치원 기념관 유치사업 추진 ▲알프스하동 프로젝트 일환 친환경 산악궤도 열차 조기화 추진 ▲이병주 문학제 및 토지 문학제 규모 확대로 세계문학제로서의 면모 확립 ▲섬진강 재첩축제, 섬진강 뱃길 복원 및 수상레저 기반 조성을 위한 안정적 지원 방안 확립 ▲하동읍 너뱅이들 경전선 직선구간 제방 관광 명소화 ▲전통문화 체험형 최참판댁 조성사업 지원 ▲남해바다, 섬진강, 지리산구간 철인 3종 경기 국제대회 유치와 교육복지 부분은 ▲하동 국제학교 유치하겠다고 했다.남해 공약으로는 먼저 산업 부분은 ▲남해읍 도시재생 뉴딜사업 활성화 방안 마련 ▲해경 관할구역 지역별 추진 ▲IGCC 신재생에너지산단 조기 착공 추진 ▲서상지구 전원주택지 개발 ▲남해 전통시장內 수산관광 시장 리모델링 ▲상주, 미조, 독일마을 관광특구 지정 ▲화방사 주변, 고려대장경 및 이순신 순국 관련사업 개발 ▲국도 3호선 조기착공 추진 ▲국도 19호선 이동~미조 추진 ▲남해∼여수 한려해저터널 조기 착공 추진과 농어업 및 복지 부분은 ▲지역 폐교를 활용한 지역 주민 평생 교육 시스템 구축 ▲수출형 농업상품에 대한 지원 및 대책 마련을 내걸었다.관광 부분은 ▲해양 휴양형 레포트 단지 및 신(新)해양 레저 기반 마련 ▲5개 지구 어촌 뉴딜300 활성화 방안 마련 ▲남해 금산~상주 케이블카 설치사업 추진 ▲남해군 외식문화 단지 조성 ▲남해 고사리 산업기반 시설 확충 ▲고려대장경 판각지 복원 및 성역화 산업 추진 ▲금산 보리암 불교문화축전 활성화 방안 마련 ▲금산 선원전 정자각 건립 추진 ▲‘김만중 프로젝트’ 추진 ▲남해군 문화예술회관 건립 ▲미조 다이어트 보물섬 조성 ▲상주 농촌테마공원 조성하겠다고 밝혔다.김동수 기자(=사천) "
135,"엔싱거 테카피크(TECAPEEK) SD black엔싱거는 1966년 설립된 세계적 플라스틱 공급업체다. 항공·우주·건설·식품·기계·의료·반도체 등 산업에 활용되는 플라스틱 제품군을 갖췄다. 폴리옥시메틸렌(POM)·나일론 등 일반 플라스틱에서 이소불화비닐(PVDF)·폴리에테르에테르케톤(PEEK) 같은 엔지니어링 플라스틱, 고내열 엔지니어링 플라스틱까지 100개 이상 플라스틱 제품군을 보유했다. 판재·봉재·튜브 형태 고품질 엔지니어링 플라스틱 제품군을 주력으로 생산한다.회사는 독일에 본사를 두고 미국·영국·일본·우리나라 등 세계 주요국 28곳에서 사업을 전개하고 있다. 우리나라에는 2017년 지사를 설립, 반도체와 전·후공정 장비에 쓰이는 플라스틱을 공급하고 있다. 플라스틱은 반도체·디스플레이·우주항공 등 산업 현장에서 웨이퍼 등 소재·부품에 손상을 방지하는 용도로 많이 쓰인다.엔싱거는 '세미콘 코리아 2020'에서 고내열 엔지니어링 플라스틱 '테카피크(TECAPEEK)' 시리즈를 선보인다. 테카피크 시리즈는 엔싱거가 개발한 폴리에테르에테르케톤 제품군이다.주력 전시품 중 하나인 '엔싱거 테카피크 SD'는 뚜렷한 정전분산성을 가진 폴리에테르에테르케톤이다. 폴리에테르에테르케톤은 고내열에 견디는 내구성·내화학성을 갖춘 반결정·열가소성 플라스틱이다. 이 플라스틱을 활용해 제조된 부품은 최대 260℃ 온도에서도 작동하고, 물체가 녹는 융점도 341℃로 높다. 이 때문에 뜨거운 물이나 증기 환경에서 사용하더라도 굴곡·인장 강도 같은 물리 특성을 유지한다. 테스트 소켓 등 전자산업에서 주로 활용한다.엔싱거가 선보이는 '테카피크 ELS CF30'은 탄소를 전체 중 30% 첨가한 폴리에테르에테르케톤이다. 이 소재는 유리섬유 소재에 비해 마모가 적다. 30% 유리섬유 보강 폴리에테르에테르케톤 소재보다 밀도가 낮은 것도 장점이다. 탄소섬유 첨가로 기계 강도와 열전도율을 높였다. 탄소 보강 폴리에테르에테르케톤은 끓는 물과 과열된 증기 분해가 뛰어나다. 자동차·해양·원자력·다운홀 유전·전자제품·항공우주 산업 등 가장 핵심적인 산업 분야·의료용으로 널리 활용된다.엔싱거는 이외 세라믹 보강제를 첨가해 정밀가공에 적합하게 만든 소재인 '테카피크 CMS'와 이외 유리 전도 온도가 높은 '테카피에이아이(TECAPAI) CM XP403'도 선보일 예정이다. 우리나라 반도체·전자 장비 제조사를 주력 공략할 계획이다.엔싱거 코리아 관계자는 “엔싱거는 '압출(extruding)' 방식을 활용해 생산한 플라스틱 시장에서 세계 점유율 1~2위를 다투고 있다”며 “'세미콘 코리아 2020'에서 우리나라 전자·반도체 장비를 생산하는 고객을 대상으로 마케팅을 전개하겠다”고 밝혔다.변상근기자"
136,"-산업부‧전남도‧순천시와 228억원 투입, 고성능 첨단 고무소재 상용화 기반시설KTR(한국화학융합시험연구원, 원장 권오정)은 오는 26일 전남 순천시 해룡산업단지에 설립된 ‘첨단고무소재지원센터’ 준공식을 개최할 예정이다. 산업부, 전남도, 순천시, KTR이 사업비 228억원을 투입해 조성한 첨단고무소재지원센터는 연면적 5,415.65㎡, 연구동과 고무배합동 2개동으로 구축됐다. 지난 2016년 ‘고성능 첨단 고무소재 상용화 기반구축’ 사업이 산업통상자원부 과제로 선정된 이후 4년만에 결실을 맺게 된 것이다. 센터는 기업의 연구개발 기술지원 및 상용화를 위한 시험평가, 국내외 인증 등을 One-Stop로 제공해 기업의 첨단 고무소재 연구개발 또는 생산 과정에서 겪고 있는 기술적 어려움 극복을 지원한다. 또한, KTR의 전문인력을 활용해 고장원인 분석 등 현장 맞춤형 기술컨설팅과 산학연 협력, 해외인증 지원 등 정부지원사업을 제공하고, KTR의 글로벌 네트워크를 통한 수출지원 등으로 관련기업의 경쟁력 강화를 돕는다. 글로벌 고무산업은 자동차, 우주, 항공, 전기전자 등 다양한 분야에서 고기능, 친환경 등의 기능을 더해 첨단화, 고부가가치화가 진행 중이다. 이는 시장변화 및 기술발전에 대한 신속한 대응이 요구되지만, 기반시설 부족으로 우리나라는 세계 7위의 고무 소비국이면서도 고성능 고무산업 육성을 위한 기술력 확보에 어려움을 겪어 왔다. 특히 기능성 고무소재는 다품종 소량생산에 적합해 중소기업에 어울리지만, 고비용 시설투자 및 전문인력 확보가 필요해 중소기업의 초기 진입과 기술개발에 여러 제약이 있는 것도 사실이다.KTR 첨단고무소재지원센터는 47종의 첨단장비를 통해 ▲고무소재 배합제조지원 ▲소재특성평가 ▲고강도‧고내열‧극저온 시험 ▲물성예측 등의 시험평가를 수행할 수 있다. 이를 통해 제품 설계를 위한 소재의 고유 특성을 파악하고 인위적 제품 사용환경 구현을 통한 품질 저하 및 노화현상을 확인하는 등 기업 기술 개발과 상용화를 직접 지원한다. KTR은 광양만권 경제자유구역 및 국내 최대 석유화학단지인 여수산업단지와 시너지를 발휘해 2030년까지 우리나라가 미국, 일본, 유럽 등이 보유하고 있는 첨단 고무소재 기술의 90% 수준을 확보하고 고무소재산업 5대 강국에 진입하도록 돕는 기반시설로 운영하겠다는 계획이다. 고성능 첨단 고무소재 상용화 기반구축 사업의 경제적 파급효과를 분석한 결과 고무산업 및 연관 산업에 대한 생산유발효과는 1,746억원, 부가가치 유발효과 422억원과 약 600여명의 고용을 창출할 것으로 예상된다."
137,"11월 특별자유화구역 지정 맞춰드론 물류 특화도시 도약 설계GS칼텍스 거점 활용 시연회 열어민관 합동 융합사업 대거 추진드론이 보내준 간식 받아요 산업통상자원부와 한국전자통신연구원, GS칼텍스 등이 8일 제주도 GS칼텍스 무수천주유소에서 드론 활용 유통물류 혁신 실증 시연 행사를 열었다. 이날 행사에서는 GS 편의점 앱을 통해 주문된 상품을 GS칼텍스 주유소(드론배송거점)에서 드론에 적재하여 인근 초등학교와 펜션의 주문자에게 배송하는 서비스를 시연했다. 제주시 해안초등학교 학생들이 간식이 담긴 드론을 반기고 있다. 제주=이동근기자"
