,contents
62,"대림산업이 창사 이래 처음으로 해외 기업 경영권을 인수하며 첨단 신소재 사업에 진출했다. 대림산업은 10일 미국 석유화학 기업 크레이튼(Kraton)의 카리플렉스(Cariflex) 사업부를 5억3000만 달러(약 6200억 원)에 인수했다고 밝혔다. 대림산업은 지난해 10월 합성고무 수술용 장갑 시장에서 점유율 1위인 크레이튼의 카리플렉스 인수를 결정하고, 그동안 실사작업을 해왔다. 카리플렉스의 합성고무와 라텍스는 수술용 장갑, 우주항공 부품, 기능성 타이어 등 고부가가치 제품에 쓰인다. 대림은 카리플렉스 인수로 브라질 라텍스·합성고무 생산 공장과 네덜란드 연구·개발(R&D)센터를 포함한 원천기술을 확보하게 됐다. 또 미국과 독일, 벨기에, 일본, 싱가포르 등 글로벌 판매 조직·인력·영업권도 확보했다.대림은 이번 카리플렉스 인수를 계기로 의료 신소재 사업 육성에 적극 나설 계획이다. 우선 이번 인수를 통해 확보한 원천기술인 ‘고기능 부타디엔 고무 생산’ 기술은 지난달 기획재정부에서 선정한 신성장·원천기술 중 하나로 꼽혔다. 여기에 메탈로센 촉매 등 독자적으로 개발한 기술 등을 융합해 의료기기, 우주항공, 기능성 타이어 등 첨단 산업 분야에 적용 가능한 고부가가치 석유화학 사업 확장을 가속화한다는 전략이다.김상우 대림 부회장은 “카리플렉스 인수는 석유화학 에너지 디벨로퍼 사업을 집중 육성하고 있는 최고경영진의 전략이 만들어 낸 구체적인 성과”라며 “첨단 신소재 산업 육성을 위한 대림의 첫 발걸음이 될 것”이라고 말했다. "
63," 이번 주말에는 쎄트렉아이(099320)에 대해 알아보겠습니다. 1999년에 설립된 쎄트렉아이는 우주항공 전문기업입니다. 유인 항공기, 항공우주선 및 보조장치를 만들고 있죠. 지난 2008년 6월에 코스닥 시장에 상장했습니다. 최근 쎄트렉아이의 주가는 직전 고점 대비 40% 가까이 하락했습니다. 27일 마켓포인트에 따르면 쎄트렉아이는 지난달 23일 장중 한때 2만7450원으로 연중(52주) 최고점을 찍었을 때보다는 39.89% 빠졌습니다. 이는 신종 코로나 바이러스 감염증(코로나19) 확산으로 인한 글로벌 금융 위기 우려에 따른 것으로 풀이됩니다. 그러나 이 회사의 실적은 코로나19와 무관하다는 판단입니다. 올 1분기부터 수주 증가로 고성장이 예상됩니다. 전자 광학 위성시장 내 쎄트렉아이의 주요 고객사는 국내외 정부와 군대입니다. 이는 연간 예산과 프로젝트 일정에 따라 진행돼 글로벌 경기 둔화와 무관하다는 뜻이기도 하죠. 따라서 기수주한 제품의 납기가 지연될 우려는 적으며, 5월, 10월 해외 입찰은 정상적으로 진행될 예정입니다. 이에 올해 실적 개선도 기대됩니다. 이현동 NH투자증권 연구원은 “고도화된 제품 제작, 라인업 확대로 지나해 말 기준 이 회사의 수주잔고는 1660억원으로 전년 대비 192% 증가했다”며 “원가 투입 기준으로 매출을 인식하는 특성상 올해 1분기부터 매출이 전년 대비 증가하기 시작해 연간 매출액은 864억원으로 저년 대비 23% 증가하고, 영업이익도 116억원으로 26% 늘어날 것”이라고 전망했습니다. 쎄트렉아이는 밸류에이션(기업가치)이 글로벌 경쟁사 대비 저평가돼 있다는 분석도 나옵니다. 이 회사는 한국 우주산업과 함께 성장해왔으며, 위성시스템의 직접 개발부터 제조까지 가능한 우리나라 대표 인공위성 업체라는 평가를 받고 있습니다. 프랑스기업 에어버스, 탈레스 등과 경쟁 중이며, 글로벌 기술 경쟁력을 바탕으로 수주를 확대하고 있죠.쎄트렉아이는 또 자회사 SIIS(영상판매), SIA(항공 데이터 분석)를 통해 위성 관련 사업분야를 확대하는 등 글로벌 위성업체들을 벤치마킹하고 있습니다. 올해 실적 예상치 기준 주가수익비율(PER)은 11.8배, EV/EBITDA는 2.9배에 불과합니다. EV/EBITDA는 기업의 시장가치(EV)를 세전영업이익(EBITDA)으로 나눈 값으로, 기업의 적정 주가를 판단할 때 사용하는 수치죠. EV/EBITDA가 2배라고 한다면 해당 기업을 시장가격으로 매수했을 때 그 기업이 벌어들인 이익의 2년간 합이 투자원금과 같게 된다는 것, 즉 투자원금을 회수하는데 걸리는 기간을 의미합니다. 이 연구원은 “해외 우주 관련기업은 연구 개발비가 높고 자체 위성 보유에 따른 감가상각비 증가로 인해 대부분 적자 혹은 높은 밸류에이션을 기록 중”이라며 “해외 종동업체 평균 EV/EBITDA는 11.6배로 현저한 저평가로 판단된다”고 설명했습니다. 이어 “기존 정부 주도의 인공위성 시장이 민간위주로 상업화되며 우주 관련 기업 투자가 확대되고 있다”며 “쎄트렉아이의 광학사업도 지속 성장하고 있어 밸류에이션 상향 재평가가 기대된다”고 덧붙였습니다. 박태진 "
64,"과학기술은 역사적으로 전쟁의 승패를 가르는 군사력과 무기체계 발전의 핵심 동력이자 인류의 성장을 추동해온 가장 중요한 원동력 중 하나였다. 혁신적인 과학기술의 등장은 기존의 패러다임을 무너뜨리기에 충분했고 특히 전쟁 수행을 위한 국방과학기술은 최근까지도 민간의 영역에까지 그 영향력을 발휘했다.   미국의 민간우주기업 스페이스X는 지난달 30일 플로리다주 케네디우주센터에서 유인우주선 ‘크루드래건’을 쏘아 올렸다. 이는 미국의 첫 민간 우주선으로 역사에 기록됐다. 미래 전장은 이와 같이 새로운 기술 발전과 기술간의 융합, 그리고 나아가 민군협력을 통해 우주와 사이버 영역까지 점차 확대되고 있다.   인공지능(AI), 양자 컴퓨터, 사이버, 로봇, 5G(5세대) 이동통신 등 민군 겸용 기술과 산업 분야에서 미국과 중국이 벌이는 경쟁의 승패는 결국 21세기 패권의 주인공을 결정할 것이다. 이는 단순히 군사경쟁 수준에 머물지 않는다. 국가 경제성장을 위한 하나의 축으로 국방과 경제의 교착점에서 패권의 우위를 결정짓는 주요한 요인으로 작용할 것이다. 주요 선진국들이 미래전을 대비하고 차기 경제성장 동력으로써 국방과학기술 혁신의 중요성을 인식하고, 다방면에 걸친 노력을 기울이고 있는 건 시대적 흐름에 비추어보아 당연한 수순이다.   지금은 안보와 경제, 기술이 융합하는 이른바 ‘뉴디펜스(New Defense)’ 시대이다. 뉴디펜스 시대에 눈에 띄는 글로벌 변화는 크게 세 가지로 압축된다. 첫째, 국방과학기술 발전에서 민간 특히 스타트업, 엑셀러레이터 및 벤처투자자 등 새로운 행위자의 등장이다. 더이상 국방과학기술개발을 정부, 군 및 대기업만이 주도하는 시기의 한계가 도래했음을 의미한다. 국방과학기술 발전을 위한 민·관·군·산·학·연 협업의 중요성이 그만큼 더욱 커지고 있음을 방증한다.    과학기술은 정부와 군이 주도하기에는 너무나 광범위한 영역에서 촌각을 다투며 변화하고 있기 때문이다. 미 국방부와 우주군이 최근 앞다퉈 실리콘밸리의 스타트업들에 투자하기 위한 다양한 프로그램을 추진하는 이유는 지금과 같은 방식으로는 중국과의 기술경쟁에서 우위를 차지하기 어렵다는 현실적인 판단에 기인한다. 스타트업의 신속하고 유연한 기술을 획득함으로써 우주와 사이버 영역을 포함한 다영역(multi domain)에서 활용할 수 있는 기술과 혁신적인 무기체계를 개발하고자 함이다.    그리고 미 행정부와 군의 이런 혁신적인 투자는 미국의 우주항공 및 방위산업(A&D) 분야에 대한 민간 벤처투자를 이끌고 있다. 미 국방부가 투자하는 스타트업만큼 안전한 투자처도 없다고 보는 것이다. 특히 전세계적으로 코로나19로 위축된 경제 상황에서 최근 일론 머스크의 스페이스X라는 민간기업이 이뤄낸 기술적 경제적 안보적 놀라운 성과는 스타트업에 대한 평가를 새롭게 하고 있다. 정부와 대기업 위주로 내수시장만을 바라보고 있는 국내 우주항공 및 방위산업과 사뭇 대조적인 모습이다.    그 다음으로 감지되는 변화는 기술들 간의 융복합 추세이다. 글로벌 방산업체들이 변화하고 있는 시장의 흐름에 대응하기 위한 전략은 바로 융합에 있다. 프랑스의 세계적인 방산업체 탈레스는 2017년 보안용 반도체 칩을 생산하는 세계 최대 업체 `젬알토`를 48억유로(약 6조1739억원)에 인수하는 `빅딜`을 성사시켰다. 당시 방산업체가 정보기술(IT)  업체를 인수한다는 사실에 ""놀랍다""는 시장 반응이 대거 나왔다. 탈레스는 6개월 전에는 암호화 솔루션업체 보메트릭을 3억7500만유로(약 4823억원)에 인수하는 등 미래 전쟁의 핵심축인 사이버전 관련 역량을 꾸준히 키운 것으로 알려져있다. 탈레스뿐만이 아니다. 영국과 미국의 방산업체 BAE시스템스와 레이시언도 IT업체 인수를 통해 `방산전자`라는 융복합 추세를 따라가고 있다.  마지막으로 감지되는 글로벌한 변화는 국방과학기술 발전을 위한 플랫폼이 다변화하고 있다는 점이다. 아직까지 국내 국방과학기술에 관련된 전시회, 세미나 등은 일반인이 이해하기 어렵거나 관심을 갖기 어려운 주제나 참가대상이 군인, 방산 관련 업체 종사자 등 전문가로 한정돼 있다. 우주항공 및 방위산업 자체가 기술적으로나 운용적인 측면에서 접근이 용이하지 않은 탓도 있지만 제도적으로 외부의 인풋(input) 자체가 어려운 측면이 있었다. 또 그만큼 진입장벽이 높을 수밖에 없는 영역으로 인식된 것이 사실이다. 반면 최근 글로벌 방산전시회의 모습은 이런 기존의 장벽을 허무는 방향으로 발전하고 있고 이를 최대한 활용하고 있다.   한 예로 매년 봄 미국 텍사스 오스틴에서 열리는 사우스바이사우스웨스트(SXSW) 행사는 일련의 영화, 인터랙티브, 음악 페스티벌, 컨퍼런스이다. 1987년에 시작해 매년 규모가 커져왔으며 평균 50여 개국 2만여 명의 음악관계자들과 2000개가 넘는 가수와 밴드가 참여하고 있다. 이 행사에 텍사스주 오스틴에 주둔한 미 육군 미래사령부가 참여해 별도 행사를 열고 일반인을 초청하는 모습은 더는 낯설지 않다. 미래사령부가 처음부터 이곳에 주둔하게 된 것도 우연은 아니다. 코로나19로 올해 최초 행사가 취소되기 전까지 미 육군 미래사령부는 SXSW의 스타트업과 함께 국방과학기술 획득을 위한 행사를 준비했다. 단순히 군 또는 방산업체를 위한 행사가 아닌 일반인이 자연스럽게 참석하고 즐기고 배우는 기회를 마련해 민군 협력과 소통의 장을 마련하기 위해서다.    오는 9월 16일부터 19일까지 경기도 고양시 킨텍스에서 열리는 DX코리아 2020은 국내 우주항공 및 방위산업을 바라보는 시각과 문제의식을 해소하고 방산전시회가 실질적인 비즈니스를 창출하는 플랫폼으로 발돋움하기 위한 다양한 방향과 목표를 구체화하고 있다. 이제 '뉴디펜스 시대'에 걸맞게 우주항공 및 방위산업은 투자와 첨단기술의 융복합 및 정부와 재계, 군과 민, 대기업과 중소기업, 스타트업간의 협력 생태계 구축을 통해 새로운 경쟁력 원천이 가능한 미래형 산업으로 거듭나야 한다. 이런 변화는 한두개 기관의 노력으로 가능하지 않다. 기업, 스타트업 등 민간 중심의 우주항공 및 방위 산업 발전에 실질적 도움이 되는 공간을 만들고 이들 산업이 국제적 경쟁력을 키워나갈 수 있는 플랫폼이 활발히 성장해야 하는 이유다. 이런 자리를 통해 우주항공 및 방위산업에 뛰어들고자 하는 국내외 스타트업들을 발굴하고 이들을 위한 협업 생태계 조성을 위해 민·관·군·산·학·연의 협력이 필수적이다. DX코리아 2020는 국가과학기술연구회와 함께 국가 차원에서 국방과 경제에 도움이 되는 방안을 모색하는 세미나를 마련했다. 또 뉴스페이스 코리아 컨퍼런스와 같은 국제 행사와 함께 연계한 것도 이런 노력의 시작이다.    한국의 안보환경과 유사한 이스라엘의 경우 방위산업 총생산액 대비 수출비중이 75~80%에 이른다. 이스라엘은 우주항공 및 방위산업을 국가 5대 수출주력 산업 중 하나로 키웠다. 한국의 뛰어난 IT기술을 바탕으로 우주항공 및 방위산업에서 경제적으로 성장 및 지속가능하면서도 안보와 같은 가치를 구현하는 새 비즈니스 모델을 어떻게 구현할 것인지를 모색할 시기다. 이번 DX코리아2020이 그런 계기가 되길 간절히 바라며 한국의 우주항공 및 방위산업이 코로나19로 위축된 국내 경제에 새로운 활력과 신성장 동력이 되기를 희망한다.   ※필자소개  조동연 서경대 미래국방기술창업센터장(예비역 육군소령). 육군사관학교를 60기로 졸업하고 이라크 자이툰사단, 한미연합사령부, 외교부 정책기획관실, 육군본부 정책실에서 17년간 복무했다.  미국 하버드대 케네디스쿨에서 공공행정학 석사를 마치고 예일대 월드펠로우, 메릴랜드대 컬리지파크 국제개발 및 분쟁관리센터 방문학자를 거쳤다. 한미동맹재단 자문위원과 DX코리아2020 추진위원으로 일하고 있다. 공저로 《빅피처(2017)》를 썼다.[조동연 서경대 미래국방기술창업센터장·DX코리아 2020 추진위원 ]"
65,"“세 번째 달 착륙 시도 나선다”…성공시 네 번째 성공 국가 등극1981년 인도에서 우마차에 위성을 싣고 돌아다니며 안테나 범위 테스트를 하는 모습.‘저비용 고효율’ 우주기술 강국을 꿈꾸는 인도가 새해를 맞아 세 번째 달 착륙 임무에 돌입하겠다고 천명했다. 지난해 무인 달 탐사선 찬드라얀 2호가 달 착륙에 실패했지만 도전을 이어가는 것이다. 올해 임무에 성공할 경우 인도는 러시아, 미국, 중국에 이어 달 표면에 우주선을 착륙시킨 네 번째 국가가 된다.인도 우주연구기구(ISRO)는 1일(현지시간) 벵갈루루에 있는 본사에서 기자회견을 열어 찬드라얀 3호 발사 계획을 일부 공개했다. 탐사선 개발 총책임자인 카일라사바디부 시반 ISRO 국장은 “2020년은 찬드라얀 3호의 해가 될 것”이라며 “올해 발사를 목표로 두고 있다. 다만 내년으로 넘어갈 수도 있다”고 말했다. 오는 11월 발사될 전망인 찬드라얀 3호는 달 남극에 착륙해 일대를 탐사할 계획이다. 현재까지 달 남극에 탐사선을 보낸 국가는 없다.인도는 앞선 두 번의 달 착륙 시도에서 모두 실패했다. 찬드라얀 1호는 2008년 레이더를 활용해 달 표면에서 물 흔적을 찾으려고 시도했지만 달 궤도를 도는 데 그쳤다. 지난해 9월 발사된 찬드라얀 2호는 달 궤도에는 성공적으로 진입했지만 달 남극 부근에서 착륙을 시도하다 충돌해 교신이 끊겼다.인도는 50년 전 빈국이 왜 우주 개발에 나서느냐는 비아냥을 들으면서도 저비용 개발 전략을 내세우며 우주 산업에 뛰어들었다. 당시 1인당 국민소득은 81달러에 불과했지만 인도 정부는 우주 개발이 인류의 발전에 도움이 된다는 철학 하에 개발을 밀어붙였다. 1979년 여름 인공위성 탑재 장거리 로켓 발사시험에는 경탄과 조소가 함께 쏟아졌다. 세계 최빈국 중 하나인 인도가 인공위성 발사체를 독자 개발해 시험에 나섰다는 점에 세계가 놀랐지만 정작 세계인의 이목이 집중된 것은 따로 있었다. 인공위성과 발사체를 발사 장소까지 옮긴 운반 도구가 우마차였기 때문이었다.우마차로 위성을 끌고 다니던 인도였지만 지속적 투자와 연구 덕에 2014년 망갈라얀호를 화성 궤도에 안착시키는 데 성공했다. 단 한 번의 시도로 화성 탐사에 성공하며 명실상부한 우주 강국의 대열에 오른 것이다.인도의 우주강국 도전이 주목받는 이유는 특유의 저비용 개발 방식 때문이다. 적은 비용으로 높은 성과를 내기 위해 인도는 재활용 전략을 택했다. 로켓을 발사하고 난 뒤 바다에 떨어진 추진체는 건져서 수차례 재활용했고, 달 탐사선에 썼던 장비를 화성 탐사선에 이식해 쓰기도 했다. 찬드라얀 2호의 경우 비용을 절감하기 위해 달까지 거리는 더 길지만 연료 효율은 더 높은 경로로 발사됐다.실제 인도의 우주개발 예산은 다른 국가들에 비해 매우 적은 수준이다. ISRO의 2017년 예산은 12억 달러로 미국 우주항공국(NASA)의 예산 210억 달러의 5.7%에 불과했다. 지난해 찬드라얀 2호에 투입된 예산은 영화 ‘어벤져스 엔드게임’ 제작 비용의 절반 수준인 3억5600만 달러(약 4252억원)였다. 시반 국장은 “찬드라얀 3호는 2호와 비슷한 구성으로 만들어질 것”이라며 “동일한 착륙선, 탐사선, 추진 모듈을 활용할 예정”이라고 밝혔다. 지텐드라 싱 인도 우주부 차관도 3호가 2호에 비해 더 경제적인 예산으로 운용될 것이라고 말했다.이형민 기자"
66,"美 나사 우주여행 프로젝트에태웅, 핵심부품 납품기업 선정내달 벡스코선 '드론쇼 코리아'작년 벡스코에서 열린 '드론쇼 코리아'.   벡스코  제공부산이 첨단 항공산업 중심도시 도약에 시동을 걸었다. 부산의 중견기업 태웅이 미국 우주항공 핵심 부품업체로 선정됐다. 드론쇼를 열어 새로운 4차 산업혁명 시대를 준비하고 있다.부산 금속가공 업체인 태웅은 글로벌 기술 기업인 아마존과 테슬라, 미국 항공우주국(NASA)이 추진 중인 우주여행 프로젝트의 핵심 부품 납품 기업으로 선정됐다고 27일 밝혔다. 허용도 태웅 회장은 “아마존 최고경영자(CEO)인 제프 베이조스가 세운 캐나다 B사를 지난 17일 찾아 개당 70t 크기의 단조 제품 16개를 부산에서 제작해 공급하기로 협약을 맺었다”고 밝혔다.태웅이 생산하는 단조 제품은 우주선을 지구 밖으로 올려보낼 때 사용하는 발사대의 핵심 부품이다. 이 발사대 하나를 제작하는 데 태웅이 제공할 16개 제품이 필요하다. 태웅은 특수강을 녹여 이 부품을 만드는 테스트를 하고 있다. 오는 6월부터 완제품을 순차적으로 납품할 계획이다. 허 회장은 “항공우주 분야 부품은 가격이 높은 소재가 쓰이고 한 개 부품의 흠이 제품 전체에 악영향을 끼쳐 발생하는 손실이 매우 크기 때문에 기술력이 좋은 기업에만 부품 제작을 맡긴다”며 “태웅의 아마존 우주사업 수주 쾌거는 부산 단조기업의 기술력을 세계에서 인정받았다는 뜻”이라고 설명했다.부산상공회의소 회장을 맡고 있는 허 회장은 “이달 초 미국 항공업체를 방문해 항공산업과 부산 기업을 접목하는 방안을 모색했다”고 말했다.부산시와 벡스코도 부산을 첨단 항공산업도시로 조성하는 데 나섰다. ‘2020 드론쇼 코리아’를 오는 2월 20~22일 벡스코에서 연다. 드론으로 확장하는 4차 산업혁명의 현재와 미래를 확인하고 통신, 자율주행, 가상현실, 인공지능, 사물인터넷 산업과의 접목을 살펴볼 수 있도록 하기 위해서다. 국내외 드론 전문가들이 참가하는 콘퍼런스도 연다.부산=김태현 기자"
67,[사천=뉴시스] ◇4급 전보 ▲행정복지국장 신현경◇4급 승진▲안전도시국장 직무대리 유재기▲의회사무국장 직무대리 강점종◇5급 전보▲기획예산담당관 정대웅▲행정복지국 세무과장 문창훈▲문화관광국 문화체육과장 김성조▲문화관광국 민원교통과장 이인구▲안전도시국 재난안전과장 박영수 ▲항공경제국 우주항공과장 조현숙▲항공경제국 녹지공원과장 김기룡▲보건소 보건위생과장 권남석◇5급 직급승진 ▲문화관광국 관광진흥과장 박창민▲의회사무국 전문위원 문영춘▲보건소 치매관리과장 김용만▲농업기술센터 농축산과장 송혜경▲서포면장 박주봉▲동서금동장 정현영 ▲남양동장 전영묘◇5급 승진▲항공경제국 산업입지과장 직무대리 강장영 ▲향촌동장 직무대리 전흥국 ▲행정복지국 노인장애인과 노인복지팀장(5급요원) 차우정▲문화관광국 환경보호과 환경관리팀장(5급요원) 권순옥▲항공경제국 우주항공과 우주항공산업팀장(5급요원) 곽정란☞공감언론 뉴시스
68," 이해욱 대림산업 회장은 글로벌 디벨로퍼 사업을 적극 육성하고 있다. 디벨로퍼는 프로젝트의 발굴·기획·지분투자·금융조달·건설·운영·관리 등 사업의 전 과정에 참여하는 개발 사업자를 의미한다. 건설 분야에서는 국내 최고 수준의 시공 능력을 바탕으로 광화문 D타워와 아크로서울 포레스트 사업을 성공적으로 추진하며 능력을 인정받았다.2017년 3조5000억원 규모의 사업권을 따낸 터키 차나칼레 프로젝트는 세계 최장 규모의 현수교로 건설되며 민간 투자 방식으로 진행된다. 또한 자체 개발한 호텔 브랜드인 GLAD를 앞세워 여의도·마포·제주 등에서 호텔 개발 사업을 진행하고 있다.대림산업은 미국 크레이튼의 카리플렉스 사업부 인수를 발표하며 글로벌 석유화학 사업 확장 계획을 알렸다. 올해 1분기 5억3000만 달러(약 6200억원)에 인수를 마무리했다.대림산업은 크레이튼의 브라질 생산 공장과 네덜란드 연구·개발(R&D)센터를 포함한 원천 기술과 함께 미국·독일·벨기에·일본·싱가포르 등의 글로벌 판매 조직과 인력·영업권도 확보하게 됐다.카리플렉스 사업부가 생산하는 라텍스는 글로벌 합성고무 수술용 장갑 시장의 1위 제품이다. 미국뿐만 아니라 유럽과 아시아에서도 합성고무 수술용 장갑 사용 비율이 점차 높아질 것으로 예상된다. 이에 따라 합성고무 수술용 장갑 시장은 매년 8% 수준의 높은 성장이 기대된다. 특히 의료용 제품은 차별적 기술력을 필요로 할 뿐만 아니라 다른 석유화학 제품에 비해 경기 변동에 민감하지 않기 때문에 안정적인 고수익을 창출할 수 있다.또한 대림이 자체 개발한 메탈로센 촉매 기술과 크레이튼사가 개발한 세계 유일의 음이온 촉매 기반의 합성고무 제조 기술, 라텍스 제조 기술이 더해져 상당한 시너지가 기대된다.대림은 이를 바탕으로 의료기기, 우주항공, 기능성 타이어 등 첨단 산업 분야에 적용할 수 있는 첨단 신소재 사업 확장을 가속화한다는 전략이다.이 회장은 동남아·인도·중남미 등 신흥 시장 중심으로 대규모 에너지 프로젝트가 발주될 것으로 전망하고 에너지 사업을 회사의 중·장기적 전략으로 잡았다. 이를 위해 2013년 에너지 사업을 전담하는 대림에너지를 설립해 에너지 디벨로퍼 사업을 시작했다.2013년 호주 밀머란 석탄화력발전소를 시작으로 현재까지 한국을 포함해 칠레·파키스탄·요르단 등 총 7개국에서 에너지 디벨로퍼로 사업을 진행 중이다. 석탄화력·액화천연가스(LNG)·풍력·태양광·바이오매스 발전소까지 총 4GW의 발전용량을 확보하고 있다.대림에너지는 프로젝트 개발부터 금융 주선, 시운전과 O&M까지 자체 수행하고 있다. 대림은 직접 발전소를 운영하면서 노하우를 습득하고 있다"
