,contents
893,"  서대문구 홍제천 변에서 주민이 자전거를 즐기고 있다. 서대문구 제공. 서대문구(구청장 문석진)는 모든 구민이 보장받을 수 있는 자전거 보험에 가입했다고 밝혔다.   보험기간은 ‘2020년 4월 10일부터 2021년 4월 9일’까지로, 앞선 1년간에 이어 이번이 두 해째다.   관내 주민등록된 구민과 체류지가 서대문구로 돼 있는 외국인 등록자가 별도 가입절차 없이 모두 피보험자로 자동 가입됐다.   국내에서 자전거를 직접 운전한 경우, 보행 중 자전거와 충돌한 경우, 자전거에 동승한 경우 모두 해당되며, 보험 기간 중 발생한 사고에 대해 발생일로부터 3년간 보험금 청구를 할 수 있다.   단, 자전거를 타고 가다 다른 사람을 다치게 한 경우, 타인의 신체나 물건에 대한 배상은 보장 대상에 포함되지 않는다.   세부 보장 내용을 보면 △상해위로금이 진단 기간(4∼8주 이상)에 따라 30∼70만원(6일 이상 입원 시 추가 20만원 지급) △후유장해 1000만원 한도 △사망 1000만원(만 15세 미만자 제외)이다. (상법상, 만 15세 미만자를 피보험자로 하는 사망보험 계약 금지)   또한 △자전거사고 벌금 2000만원 한도 △변호사 선임비용 200만원 한도 △자전거 교통사고 처리지원금(자전거 운전 중 타인을 사상케 해 형사합의 시) 3000만원 한도 등이다.   문석진 서대문구청장은 “안전한 자전거 이용이 우선이지만 불가피하게 사고가 났을 경우에 대비해 이 같은 내용을 홈페이지와 SNS, 구정 소식지 등을 통해 적극 홍보할 계획”이라고 밝혔다.   ‘서대문구민 자전거보험 가입’에 관한 자세한 내용은 서대문구청 교통행정과로 문의하면 된다.   "
894," 노원구(구청장 오승록)가 지역내 주민들의 자전거 안전 사고에 대비해 전 구민을 대상으로 ‘자전거보험’을 가입했다.자전거보험은 구에 주민등록을 둔 주민이면 누구나 가입 절차 없이 자동으로 보험수혜자가 된다. 전국 어디에서 사고를 당하더라도 보험 혜택을 받을 수 있다. 노원구에 거주하지 않지만 노원구 공공자전거 대여소에서 자전거를 빌려 타는 사람도 보험 혜택을 받을 수 있다. 자전거보험 보장기간은 1년으로 2021년2월28일까지다.보장 범위는 ▲자전거 운전(탑승) 중 일어난 사고 ▲운행 중인 자전거와 충돌해 피해를 입은 경우다. 피보험자가 자전거사고로 사망과 사고로 후유장해가 발생한 경우 1000만원 한도로 보장 받는다. 4주 이상의 치료를 요하는 진단을 받은 경우 30만원(4주)에서 70만원(8주)까지 진단위로금을 받을 수 있다.주민이 자전거 사고로 ‘벌금을 부담’하는 경우 2000만원 한도에서, 타인(가족제외, 동승자 포함)을 사망또는 중상해를 입혀 형사합의를 봐야할 경우에도 3000만원 한도에서 보장받을 수 있다. 변호사 선임 비용도 200만원 내에서 지원된다.노원구 자전거 대여소 이용자가 자전거 교통사고로 입원 시 1일 당 1만5000원의 입원위로금(180일 한도)도 보장된다. 공공자전거 파손 및 도난의 경우 1대 당 10만원까지 보상받는다.보험금 신청은 피보험자 또는 법정상속인이며 보험사로 보험금청구서에 관련 증빙서류를 첨부해 제출하면 된다.구는 구민들이 안심하고 자전거를 즐길 수 있도록 2015년부터 자전거 보험을 가입하고 있다. 지난해까지 자전거 사고를 당한 구민 1480명에게 10억6000만원의 보험금을 지급했다.이와 함께 구는 지난해 7월부터 자연재해와 사회재난 피해 시 보상을 받을 수 있도록 ‘구민 안심보험’을 가입하고 있다. 안심보험은 노원구민이 각종 사고 등을 당했을 때 구청과 계약한 보험사가 보험금을 지급하는 제도로 1인 당 최고 1000만 원을 보상받을 수 있다. 자전거보험과 같이 노원구에 주민등록을 둔 구민은 별도 가입절차 없이 자동가입 된다.오승록 구청장은 “자전거를 안전하게 탈 수 있는 환경을 만들기 위해 지속적으로 노력할 것”이라며 “교통비 절약과 환경 보호는 물론 건강증진에도 도움이 되는 자전거 문화 확산으로 100세 건강도시 노원을 만들어가겠다”고 말했다.교통지도과 2116-0631박종일 기자"
895,   
896,"페달을 있는 힘껏 밟으면 시원한 바람이 `따닥!' 양 뺨에 `봄'이 일렁인다 붉은 빛 아름다운 석양 따라 강내음에 코끝이 `간질'자전거 위에 설렘 가득한 봄기운을 먼저 실어 봅니다. 물론 제가 앉을 자리는 마련해 두고 말이죠.페달을 힘껏 누릅니다. 얼기설기 바큇살이 서서히 움직입니다. 쌍둥이처럼 닮아 있는 두 바퀴가 시나브로 땅 위를 흐르기 시작합니다. 오르막. 한 줄기 땀방울이 흘러내립니다. 두 줄기, 세 줄기. 이놈들이 꼬리 물기로 떨어집니다.언덕배기 끄트머리. `휴~' 이제는 중력을 느끼는 일만 남았군요. 페달에서 발을 떼어냅니다. 시원한 바람이 `따닥!' 하고 이마를 때립니다. 말 그대로 바람을 가르고 있네요. 양 뺨이 일렁일 정도로 속도가 차오릅니다.바로 이 맛 때문에 자전거를 타는 게 아니겠습니까. 뜨끈했던 몸에는 금세 상쾌함이 몰려옵니다. 이쯤 되니 주변이 눈으로 들어옵니다. 그런데 이게 웬일입니까. `부웅~' 강 위를 날고 있는 게 아닙니까.그러고 보니 강내음이 코끝을 간지럽히며 퍼지고 있네요. 아니 봄내음인가요. 입하(立夏)도 지났으니 여름내음이라는 표현이 맞을까요. 뭐 아무려면 어떻습니까. 이 어여쁜 풍경들은 이미 `내 마음속 저장'입니다. 햇살이 강 위에 살포시 내려앉더니 바람이 만들어 놓은 파문(波紋)을 타고 이리저리 퍼집니다. 자연의 사이키 조명이라 명하겠습니다. `쿵짝 쿵짝~' 리듬에 맞춰 엉덩이도 들썩 들썩입니다. 이제 잠깐 쉬어볼까요. 곁눈질로 보던 봄꽃들이 알록달록, 흐드러지게 피었습니다. 강을 타고 `쭈~~욱' 입니다. 저쪽에서 유유자적 자전거를 탄 한 무리가 다가오고 있습니다. 눈인사를 건넵니다. 그대로 `자전거를 탄 풍경'입니다. 글="
897,삼천리자전거 차트 분석◆ 기업개요삼천리자전거는 자전거 전문업체로 알려져 있다.한경로보뉴스이 기사는 한국경제신문과 금융 AI 전문기업 씽크풀이 공동 개발한 기사 자동생성 알고리즘에 의해 실시간으로 작성된 것입니다.
898,"안장 높이 맞추고 페달링은 가볍게안장 높으면 무릎 뒤쪽에 통증간식 챙겨 탈수·탈진 등 예방추월 땐 반드시 미리 알려야신종 코로나바이러스 감염증(코로나19) 대응이 지난 6일부터 생활 속 거리두기(생활방역)로 바뀌면서 야외활동에 대한 관심이 증가하고 있습니다. 기온이 올라가면서 한강 자전거도로에는 신선한 바깥 공기를 마시려는 시민들도 부쩍 늘어난 것을 볼 수 있었습니다.자전거는 걷기나 등산처럼 많은 사람이 두루 즐기는 건강 취미인데요, 최근 코로나19 영향으로 자전거족이 날로 늘어나고 있다고 합니다. 서울 신길동에 있는 자전거 전문점 타라바이크를 운영하는 양동각 대표는 “지난 1~4월 매출이 지난해 같은 기간에 비해 60%가량 늘었다”며 “입문형 모델을 구입하는 사람이 다수”라고 설명했습니다.자전거 운동의 장점은 근력과 심폐기능을 동시에 향상시키고 자신의 수준에 맞춰 강도를 조절할 수 있다는 것입니다. 속도를 낮추고 오랫동안 달리면 심폐기능이 강해집니다. 고속으로 달리거나 가파른 오르막길을 오르면 다리 근육에 힘이 붙는 것을 느낄 수 있지요. 혼자 여유롭게 자전거길을 다녀도 좋고 성향과 실력이 비슷한 사람들끼리 100㎞ 이상의 장거리 여행을 떠날 수도 있습니다.자전거를 처음 타거나 새롭게 구입하려는 사람들은 먼저 어떤 종류의 자전거를 골라야 하는지 난관에 부딪힙니다. 보통 자전거는 도로용(로드)과 산악용(MTB)으로 구분됩니다. 입문형 모델은 제조사마다 조금씩 다르지만 40만원대 후반에서 70만원대 초반까지 다양합니다. 속도감을 느끼고 싶다면 도로용, 두꺼운 타이어로 편안한 주행감을 느끼고 싶다면 MTB를 고르는 식이지요. 다만 저가형 유사 MTB는 산길 주행은 어렵습니다. 두 자전거의 장점을 결합한 하이브리드 자전거도 있지요.자신이 탈 자전거를 결정했다면 올바른 자전거 타기를 배워야 합니다. 안장과 손잡이(핸들바)의 거리가 너무 멀면 팔꿈치가 펴지면서 충격 흡수가 어려워집니다. 안장 높이가 높다면 무릎 뒤쪽 근육에 통증이, 반대로 낮다면 앞쪽 근육에 부담을 줄 우려가 있습니다. 잘못된 자세로 자전거를 오래 타면 손목이나 무릎, 엉덩이에 통증을 느낍니다. 심할 경우 무릎 쪽의 장경인대염이 발생할 수 있어 주의해야 합니다.자전거는 도로교통법상 차로 분류되기 때문에 주행에 각별한 주의를 기울여야 합니다. 특히 자전거 도로가 설치되지 않은 보도나 횡단보도에서 주행해선 안 됩니다. 자전거 전용도로 또한 일정한 속도로 달릴 때는 진행방향 우측에 붙어 뒤에서 추월하는 자전거의 공간을 확보해주는 것이 좋습니다. 추월할 때는 앞 자전거 주행자에게 추월하겠다고 알린 뒤 조심히 달려야 합니다. 자전거를 잘 타는 사람은 안전하게 타는 사람입니다.자전거와 함께 구입해야 하는 필수품은 헬멧입니다. 자전거 도로에서는 시속이 평균 20~30㎞쯤 됩니다. 순간 속도로는 그 이상까지 낼 수 있죠. 불의의 사고로 넘어졌을 때 머리 손상을 막기 위해 꼭 헬멧을 착용해야 합니다. 자외선과 이물질로부터 눈을 보호하기 위한 고글, 자전거용 장갑도 착용하면 좋습니다.처음 자전거를 탈 때의 페달링은 자신이 느끼는 것보다 가볍게 놓고 타는 것이 좋습니다. 기어를 무리하게 높여서 페달을 밟으면 다리 근육이 빨리 지치기 때문입니다. 물과 초코바 등 간단한 간식을 챙겨 탈수나 탈진이 일어나지 않도록 합니다"
899," 자전거 등록제 현실화가 한층 가능해졌다.서울시의회 정지권 의원(더불어민주당, 성동2)은 자전거 등록제 현실화를 통해 도심 속 자전거 주차시설의 주기적인 관리와 방치된 폐자전거에 대한 심각성을 인식하고 이를 개선하기 위해 '서울특별시 자전거이용 활성화에 관한 조례 일부개정조례안'을 발의, 4월 개최된 소관 상임위원회를 통과했다고 밝혔다.이번 개정안은 그동안 자전거 등록에 무관심했던 서울시가 자전거를 체계적으로 관리하도록 하기 위함이며 서울시는 자전거 등록과 관련한 계획을 수립, 등록 시스템 구축을 위해 노력하도록 하는 한편 자전거 주차시설의 점검 및 보수 주기를 년 1회 이상 실시하도록 명시했다.우리나라 국민 대부분은 공공자전거(따릉이)가 아닌 내가 보유하고 있는 자전거를 시나, 자치구에 등록할 수 있다는 것을 모르고 있는 것이 현실, 그나마 서울시 자치구중 등록제를 운영하는 곳은 강동구, 양천구, 노원구 등 3곳에 불과, 이마저도 형식적이다.자전거 등록이 필요한 가장 큰 이유는 도시미관을 해치고 보행권을 침해하는 자전거 주차시설에 버려진 폐 자전거 처리 문제다.주차시설에 버려진 폐 자전거를 처리하기 위해서는 법적으로 자전거 주인에게 폐기한다고 문서로 통보하여야 하나 버려진 자전거의 대부분이 등록되지 않은 자전거로 주인에게 통보할 수 없어 폐기가 불가한 실정이다.서울시는 이번 조례 개정을 통해 자전거 주차시설의 개선과 자전거 등록에 필요한 예산을 반영할 수 있는 근거를 마련, 이를 토대로 자전거 등록을 활성화함으로써 자전거 방치 및 도난 등에 효율적으로 대처, 체계적인 관리에 기여 할 수 있을 것으로 기대된다.정지권 의원은 “이번 조례 개정으로 자전거 등록을 현실화함으로써 자전거 방치 및 도난 등에 효율적으로 대처할 수 있는 토대를 마련했다. 서울시는 빠른 시일 내 관련 계획을 수립하고 시행해 줄 것과 함께 더불어 도시 미관을 해치고 시민들의 보행에 불편을 초래하고 있는 폐자전거도 일제히 정리해 줄 것을 당부했다.소관 상임위원회를 통과한 서울특별시 자전거 이용 활성화에 관한 조례 일부개정조례안은 4월29일 개최되는 서울시의회 본회의 의결을 앞두고 있으며, 이송 후 조례규칙심의회를 거쳐 공개될 예정이다.박종일 기자"
900,현대자동차의 고성능 브랜드인 N에서 프리미엄 자전거를 판매한다.현대차는 운동 용구 제조업체인 윈엔윈과 협업해 제작한 'N 스페셜 에디션 자전거'를 26일 공개했다. 윈엔윈은 박경래 전 양궁 국가대표 감독이 2011년 3월 설립한 회사다. 양궁 및 자전거 브랜드인 위아위스를 통해 국가 대표 선수를 위한 프리미엄 자전거를 판매하고 있다.N 스페셜 에디션 자전거는 로드바이크 '와스 프로 N'과 산악자전거(MTB) '헥시온 N' 등 2가지 모델로 구성됐다. 위아위스 자전거와 마찬가지로 양궁 활 소재로 쓰이는 그래핀 나노카본이 프레임에 적용된다. 전면에는 N 브랜드 로고가 부착됐으며 윈엔윈 최상급 모델과 동일한 구동계 부품이 탑재됐다.N 스페셜 에디션 자전거는 위아위스 매장에서 판매될 예정이다. 서울 논현동과 경기 고양 대화동 현대모터스튜디오에도 전시된다.박상용 기자
901,"삼천리자전거가 2020년 퍼스널모빌리티 브랜드 ‘팬텀(PHANTOM)’의 전기자전거 라인업을 기존 10종에서 15종으로 확대 공개했다.   13일 삼천리자전거는 2020년 신제 전기자전라인업을 다양하게 구성했다. 인기 차종인 ‘미니벨로’ 전기자전거와 중년에게 인기 많은 ‘MTB형’ 전기자전거, 도심에서 남녀노소 부담 없이 편하게 즐길 수 있는 ‘시티형’ 전기자전거를 비롯해 ‘2인승 전기자전거’와 ‘삼륜 전기자전거’ 등 내놓았다.   삼천리자전거 관계자는“전기자전거가 대중화됨에 따라 보다 많은 사람들이 전기자전거를 부담 없이 즐겨 전기자전거의 이용 활성화를 이끌 수 있도록 다양하고 안전한 제품을 선보이기 위해 지속적인 노력을 기울일 것“이라고 말했다. "
902,"연내에 전동 킥보드를 타고 자전거도로를 달리는 것이 가능해집니다. 만 13세 미만의 어린이는 전동 킥보드를 운전할 수 없습니다.일반 자동차 등으로 운전하면서 도로에 규정된 제한 속도를 시속 80㎞ 넘게 달리다가 적발되면 과태료 부과가 아닌 형사 처벌(벌금·징역 등)을 받습니다.경찰청은 이런 내용을 담은 도로교통법 개정안이 어제(20일) 국회 본회의에서 의결됐다고 오늘(21일) 밝혔습니다.개정안은 전동 킥보드 등 원동기 장치 자전거 중 전기 자전거처럼 최고 속도 시속 25㎞, 총 중량 30㎏ 미만인 이동수단을 새롭게 '개인형 이동장치'로 규정하고 자전거도로 통행을 허용했습니다.다만, 안전하고 원활한 통행을 위해 당국이 자전거도로의 일부를 '개인형 이동장치' 통행 금지·제한 구간으로 지정할 수 있습니다.'개인형 이동장치'는 전기 자전거처럼 운전면허 없이 이용할 수 있지만, 만 13세 미만 어린이는 운전하면 안 됩니다.'개인형 이동장치'에 승차 정원을 초과해 동승자를 태우고 운전하는 행위는 금지됩니다. 운전자가 음주운전을 하면 범칙금이 부과됩니다. 운전자는 안전모 등 보호장구를 의무적으로 착용해야 합니다.일반 자동차 등이 각 도로 제한속도를 한참 초과해 달리는 경우 처벌도 강화됐습니다.지금까지는 속도위반을 하면 그 정도에 따라 다른 금액의 과태료가 부과됐지만, 앞으로는 제한속도를 시속 80㎞ 이상 초과하면 30만 원 이하 벌금, 시속 100㎞ 이상 초과하면 100만 원 이하 벌금을 내야 합니다.예를 들어 제한속도가 시속 100km인 고속도로에서 시속 180km로 운전하다 적발되면 30만 원 이하의 벌금 처벌을 받습니다.3회 이상 제한속도를 시속 100㎞ 초과해 운전하면 1년 이하의 징역 또는 500만 원 이하의 벌금이 부과됩니다.벌금은 과태료, 범칙금과 달리 전과 기록이 남는 금전적 형사 처벌입니다.개정된 법안은 국무회의를 거쳐 공포된 날로부터 6개월이 지난 날부터 시행됩니다.[MBN 온라인뉴스팀]"
903," 경기도 수원시는 모든 시민에게 보험 혜택을 주는 '시민안전보험'과 자전거 사고가 났을 때 보상을 받을 수 있는 '수원시민 자전거 보험'이 '수원시민안전보험'으로 통합 운영된다고 13일 밝혔다.   이에 앞서 시는 지난해 4월 수원시에 주민등록을 한 모든 시민(등록 외국인 포함)이 별도 보험 가입 없이 무료로 보험 혜택을 받을 수 있는 시민안전보험에 가입했다.   비슷한 성격의 수원시민 자전거 보험은 지난 2012년부터 매년 가입하고 있다.   이에 따라 시민들이 더 편리하게 보험을 활용할 수 있도록, 올해 1월부터 자전거 보험을 시민안전보험에 통합했다.   1월 1일 새로운 시민안전보험에 가입했고, 보장 기간은 올해 12월 31일까지다.   보험 혜택 항목은 △자연재해 사망 △폭발·화재·붕괴·산사태로 인한 사망·후유 장해 △대중교통 이용 중 상해 사망·후유 장해 △강도 상해사망·후유장해 △사고로 인한 상해 치료비 △테러에 의한 사망·후유장해 △자전거 사고 재물적 배상책임 △자전거 사고 진단위로금·입원위로금·형사합의금 지원 등이다.   보상한도는 사망 시 최대 1500만원이고, 상해 후유 장해는 장해 등급에 따라 차등 지급한다.   수원시가 전국 최초로 도입한 ‘사고로 인한 상해 치료비 지원’은 시민이 수원시에서 관리하는 시설물(도로·공원·건물 등)에서 사고를 당하면 치료비를 지급하는 것으로, 1인당 500만원 한도로 실손보상을 받을 수 있다.   원동기 장치 이륜자동차(단 상업용이 아닌 가정용 오토바이 125㏄ 이하) 사고 상해 치료비도 지원한다.   수원시에 주민등록이 된 시민은 별도 보험 가입 절차 없이 누구나 혜택을 받을 수 있으며, 상법 제732조에 따라 만 15세 미만 시민은 사망 담보가 제외된다.   개인보험에 가입한 시민은 중복보장을 받을 수 있으며, 보험수익자는 본인이고, 사망하면 법정 상속인에게 보험금을 지급한다.   보험금은 사고 발생일부터 3년 이내에 청구해야 보상받을 수 있다.   삼성화재컨소시엄 보상센터 문의한 후 안내에 따라 증빙서류를 준비해 직접 보험금을 청구하면 된다.   의료비를 청구할 때는 수원시가 발급한 확인서를 첨부해 청구해야 한다.   수원시 시민안전과 관계자는 “시민안전보험 가입으로 재난, 안전사고를 당한 시민들이 경제적인 도움을 받을 수 있을 것”이라며 ”보상 내용을 꼼꼼하게 확인하시고, 해당 사항이 있으면 꼭 보상금을 청구하시길 바란다”고 말했다.   "
904,삼천리자전거 외국인/기관 매매동향한경로보뉴스이 기사는 한국경제신문과 금융 AI 전문기업 씽크풀이 공동 개발한 기사 자동생성 알고리즘에 의해 실시간으로 작성된 것입니다.
905,"전남 구례군은 군민들이 안심하고 자전거를 탈 수 있도록 전 군민을 대상으로 ‘단체자전거공제 보험’에 가입했다고 5일 밝혔다.구례군에 따르면 주민등록상 군민은 전국 어디서나 자전거로 인한 사고를 당할 경우 보험 혜택을 받을 수 있다. 보장 기간은 내년 1월 29일까지다.군민이 자전거 상해 사망 시 1000만원(만15세 미만 제외), 자전거 사고로 인한 후유장해 시 최대 1000만원까지 보상받을 수 있다. 자전거 사고로 4주 이상의 치료가 필요한 진단을 받을 경우 10만원에서 30만원까지 위로금이 지급된다.자전거 사고 시 벌금은 2000만원, 변호사 선임 비용은 200만원, 교통사고 처리지원금은 피해자 1인당 최대 3000만원까지 보장받을 수 있다. 보험금 청구와 관련 문의는 봉성새마을금고에서 할 수 있다.김순호 구례군수는""자전거 사용 활성화로 군민 건강이 증진될 수 있도록 자전거공제 보험을 가입했다""면서 ""자전거 도로 관리에도 지속적으로 노력하겠다""고 말했다.☞공감언론 뉴시스"
906," 광명시민 615명이 오는 6월15일 라이딩으로 한반도 평화시대 정착을 염원하며 광명에서 도라산평화공원을 다녀올 예정이다.   광명시는 6.15 남북공동선언 20주년을 기념하고 한반도 평화를 기원하기 위해 오는 6월13일 ‘자전거 타고 개성으로 소풍가자!’를 주제로 시민과 함께 라이딩 행사를 개최한다.   이번 라이딩 행사는 KTX광명역 남북평화철도 출발역 지정과 한반도 평화, 남북 공동번영에 대한 공감대를 확산하고자 진행된다. 특히 6.15 남북공동선언 20주년을 기념하는 의미를 담아 615명의 시민이 라이딩 행사에 참여한다.   시민 라이더는 KTX광명역을 출발해 광명경륜장, 임진각 평화누리공원, 판문점, 도라산 평화공원을 다녀올 예정이다. 광명시는 라이딩과 함께 한반도 평화를 바라는 메시지를 담은 바람개비를 만들어 평화누리공원에 꽂는 행사도 함께 추진한다.   박승원 광명시장은 23일 “이번 행사가 얼어붙은 남북관계에 마중물이 되어 적극적인 협력과 교류가 이어지기를 바란다”며 “광명시는 KTX광명역과 개성, 평양을 잇는 평화철도 신설을 위해 끊임없이 노력하겠다”고 말했다.    광명시 평화기원 도라산 열차여행에 참여한 시민. 사진제공=광명시 라이딩 행사는 대북제재 대상에 해당되지 않는 민간 차원의 스포츠 교류사업으로, 광명시는 통일부와 국방부, 파주시 등 관계기관에 ‘자전거 타고 개성으로 소풍가자!’ 의미와 가치를 전달하고 협조를 적극 요청할 계획이다.   한편 광명시는 작년 5월 시민 270명과 함께 남북평화통일을 기원하며 도라산 열차여행을 다녀왔으며 KTX광명역마라톤 대회도 개최했다. 또한 광명의 기형도-북한의 백석 시인을 기리는 문화교류, KTX광명역과 북한 고산군 소재 광명역 간 교류, 농마국수로 유명한 함흥의 신흥관 유치 등을 통해 한반도 평화시대를 차근차근 준비해 나갈 계획이다.   "
