,contents
269," 자전거 이용환경 개선 전후. /사진=행정안전부 제공행정안전부는 '자전거도로 사고위험지역 안전개선사업' 지원 대상 18개 지자체를 선정하고 재난안전 특교세 30억원을 지원한다고 10일 밝혔다.'자전거도로 사고위험지역 안전개선사업'에 최종 선정된 18개 지자체는 △서울 양천 △부산 연제 △인천 연수 △광주 동구 △대전 중구 △경기 고양 △경기 광주 △충북 청주 △충남 태안 △충남 논산 △전북 전주 △전북 익산 △전북 남원 △전남 순천 △전남 해남 △경북 영천 △경남 의령 △제주 제주시이다.이 사업은 범정부적으로 추진하고 있는 '국민생명 지키기 프로젝트'와 연계한 것으로 2016년 258명을 기록했던 자전거 교통사고 사망자를 2022년까지 50%(129명) 감소시키는 것을 목표로 하고 있다.특히, 사업대상지는 자전거 사고다발지역을 우선 선정해 자전거도로의 사고원인 해소를 통해 자전거 교통사고를 사전에 예방하겠다는 계획이다.행안부는 2016년부터 매년 공모를 통해 선정된 10~28개 지자체의 자전거도로 안전개선과 안전시설 확충사업에 현재까지 130억원을 지원했다.이를 통해 2016년 258명이었던 자전거 교통사고 사망자수가 2018년말 기준 209명으로 49명이 줄어드는 데 기여했다는 평가다.이재관 행안부 지방자치분권실장은 ""이 사업은 자전거 교통사고를 예방하고 사망자를 줄이는데 기여하고 있다""면서 ""앞으로, 전국 자전거도로 사고위험지역에 대한 지속적인 지원을 통해 안전한 자전거 이용 환경이 조성될 수 있도록 지자체와 함께 노력하겠다""고 말했다.한편, 최종 선정된 18개 지자체에는 향후, 도로교통공단, 한국교통연구원, 대전세종연구원 등 교통안전 전문기관의 협조를 통해 선정 지자체의 계획 수립과 사업 추진을 자문·지원할 방침이다.오세중 기자"
270,"출퇴근시간대 빼고 9, 10월 시범운영평일 지하철 7호선 열차에 자전거를 갖고 탈 수 있게 된다. 서울교통공사는 올 9, 10월 평일 오전 10시부터 오후 4시까지 자전거 휴대 승차를 시범 운영한다고 10일 밝혔다. 탑승객이 많은 출퇴근 시간대는 허용 시간에서 제외됐다. 또 모든 열차 칸에 탑승할 수 있는 게 아니라 자전거 거치대가 설치된 열차 맨 앞뒤 칸에만 탑승할 수 있다. 다른 호선으로 갈아탈 때는 자전거를 휴대한 채 열차에 탈 수 없다. 공사는 자전거 이용자를 배려해 이달 말부터 8월 중순까지 7호선 2, 3정거장당 1개역을 자전거 탑승 거점역으로 지정하고 경사로, 거치대 등을 보강한다. 자전거 휴대 승차를 시범 운영한 뒤 여론 수렴과 서울시와의 협의 등을 거쳐 다른 지하철 노선 등으로 확대 적용할지 검토할 계획이다.김하경 기자"
271,"평일 지하철 7호선 열차에 자전거를 갖고 탈 수 있게 된다. 서울교통공사는 올 9, 10월 평일 오전 10시부터 오후 4시까지 자전거 휴대 승차를 시범 운영한다고 10일 밝혔다. 탑승객이 많은 출퇴근시간대는 허용 시간에서 제외됐다. 또 모든 열차 칸에 탑승할 수 있는 게 아니라 자전거 거치대가 설치된 열차 맨 앞뒤 칸에만 탑승할 수 있다. 다른 호선으로 갈아탈 때는 자전거를 휴대한 채 열차에 탈 수 없다. 공사는 자전거 이용자를 배려해 이달 말부터 8월 중순까지 7호선 2, 3정거장당 1개역을 자전거 탑승 거점역으로 지정하고 경사로, 거치대 등을 보강한다. 자전거 휴대 승차를 시범 운영한 뒤 여론 수렴과 서울시와의 협의 등을 거쳐 다른 지하철 노선 등으로 확대 적용할지 검토할 계획이다.　김하경 기자"
272,"순천시 덕연동 일대 자전거 정원. (사진=순천시 제공)전남 순천시 덕연동에 폐자전거를 활용한 자전거정원이 조성돼 눈길을 끌고 있다.덕연동에서는 지역의 문제가 되고 있는 쓰레기 무단투기를 예방하기 위해 정원로드 사업을 추진하고 있다.재활용품을 활용해 정원을 조성하는 것으로, 올해는 마을기업 덕연온정과 업사이클센터와 협업해 폐자전거를 활용한 자전거정원 3개소를 시범 설치하고 있다.자전거정원 3개소는 쓰레기 무단투기가 심각하고 주민들이 많이 이용하는 생목동 야외주차장, 덕암동 교차로, 연향제1근린공원에 조성 중이다.주민들과 함께 가꾸는 정원으로 만들어갈 계획이다.지난 9일 통장과 주민들이 함께 참여한 가운데 꽃과 나무를 식재하고 쓰레기 무단투기 예방에 대해 논의하기도 했다.덕연동 관계자는 ""정원로드 조성으로 쓰레기 무단투기를 예방해 깨끗한 동네를 만들어가겠다""며 ""무엇보다 주민들이 함께 가꾸는 정원로드로, 지역의 문제를 스스로 해결하겠다""고 말했다."
273,"울산지역 사회적기업 ㈜거마가 중구내 취약계층에게 희망의 자전거를 지원하고 나섰다.거마는 지난 5일 오전 중구청장실에서 열린 '희망나눔 재생자전거 전달식'에서 재생자건거 30대 200만원 상당을 저소득층에 지원했다.이날 전달된 자전거는 무단방치된 자전거를 수거해 부품 등을 수리한 뒤 새것으로 탈바꿈한 것으로 성인용 28대와 아동용 2대 등이며, 중구지역 취약계층 가운데 희망자에게 선별 지원된다. 자전거 재활용 사업을 위해 2012년 4월 설립된 거마는 같은해 8월 사회적기업으로 지정된 이후 70세 이상 고령자와 장애인 4명을 고용해 취약계층 일자리를 제공하고 있다. 또 자전거 판매와 아파트 단지 폐자전거 수거, 출장수리, 무료점검 등의 사회환원사업에도 힘쓰고 있다. 지난 2016년에도 재생자전거 100대를 지원한 바 있으며 2018년부터는 UNIST와 업무협약을 체결해 매주 수요일마다 학생들의 자전거 수리 서비스도 제공하고 있다"
274,"하나카드 3월 소비데이터 비대면 이동 선호로 69% ↑ 수입차·성형외과 등도 늘어신종 코로나바이러스 감염증(코로나19)으로 인해 여행 관련 소비가 급감하고 집에 머무는 시간이 늘면서 식재료뿐 아니라 자전거와 수입차 구입 및 성형외과 시술이 증가한 것으로 나타났다.하나은행 소속 하나금융경영연구소는 21일 하나카드 매출 데이터를 기반으로 최근 코로나19가 가져온 소비 행태의 변화를 분석해 발표한 보고서에서 이같이 밝혔다. 국내 여행사의 1분기 카드 매출액은 전년 동기 대비 59% 감소했으며 면세점은 52%, 항공사는 50% 감소한 것으로 분석됐다. 특히 코로나19 신규 확진자 수가 절정에 달했던 3월 실적은 전년 동월 대비 면세점이 88%, 여행사 85%, 항공사가 74% 감소하는 등 기록적인 실적 악화를 나타냈다. 또 실내에서 주로 서비스되는 피부관리, 미용실 역시 각각 전년 동기 대비 32%, 30% 급감했다. 이외에 한식(-32%), 중식(-30%), 일식(-38%), 양식(-38%) 등 음식점 업종의 3월 매출 역시 감소한 것으로 나타났다. 영화관의 3월 매출은 전년 동월 대비 84% 감소했으며 이 밖에 테마파크·놀이공원의 실적 증감률은 -83%, 사우나·찜질방이 -59%, 헬스클럽은 -54%를 나타냈다. 아울렛 매장(-31%), 가전제품 전문매장(-29%), 백화점(-23%), 대형마트(-17%) 등 대부분의 오프라인 쇼핑 매출은 급감했다. 반면 비대면 쇼핑은 매출이 급증했다. 인터넷 쇼핑 이용액은 41% 급증했으며 홈쇼핑 매출도 19%가량 늘었다. 비교적 집에서 가까운 거리에 있는 편의점(6%)과 슈퍼마켓(12%)의 매출은 증가해 생필품을 근거리에서 쇼핑하는 현상이 확산한 것으로 나타났다. 또한 외식 대신 집에서 식사를 하면서 식재료 판매가 늘어 3월 정육점 매출은 26%, 농산물매장은 10% 증가했다. 주점 매출이 감소한 반면 주류전문 판매점의 매출은 20% 증가했다.1분기 국산 신차(-23%)와 중고차(-22%)를 신용카드로 구매한 금액은 감소한 가운데, 수입 신차 매출액은 11% 증가해 코로나19에도 불구하고 견조한 성장세를 이어갔다. 특히 자전거의 지난 3월 매출이 전년 동월 대비 무려 69% 증가해 눈길을 끌었다. 이는 대중교통을 대신할 근거리·친환경 이동 수단으로 선택받았기 때문으로 보인다. 이 밖에 대부분의 의료 업종 매출이 급감한 가운데 약국(12%)과 성형외과(9%), 안과(6%)의 3월 매출이 전년 동월 대비 증가한 것으로 나타났다. 보고서는 “집에 있는 시간이 늘어나면서 시술을 받는 경우가 는 것으로 보인다”고 분석했다.   박세영 기자"
275,"코로나19 여파 매출 감소.증가 TOP10 (그래프=하나금융연구소 제공)코로나19 확산으로 인해 면세점, 여행사, 영화관, 항공사 등의 매출 피해가 가장 심각했던 것으로 나타났다. 반면 자전거판매점, 인터넷쇼핑, 정육점, 홈쇼핑 등의 매출은 크게 늘었다. 하나은행 소속 하나금융연구소는 21일 하나카드(개인 신용카드 기준) 매출 데이터를 분석해 이같은 내용의 '코로나19가 가져온 소비 행태의 변화' 보고서를 발표했다. 보고서에 따르면 국내 여행사의 1분기 카드 매출액은 전년 동기 대비 –59%를 기록했으며, 면세점은 -52%, 항공사는 –50%로 나타났다. 특히 코로나19 신규 확진자 수가 절정에 달했던 3월 실적은 전년 동월 대비 면세점 –88%, 여행사 -85%, 항공사가 –74%를 기록하는 등 유례없는 실적 악화를 나타냈다. 레저/문화/취미 관련 업종의 매출은 모두 크게 감소하였는데, 영화관의 3월 매출이 –84%를 기록했고, 테마파크/놀이공원 –83%, 사우나/찜질방 –59%, 헬스클럽은 –54%를 각각 나타냈다. 또 비교적 집에서 즐길 수 있는 비디오/음반(-77%), 서적(-49%)의 매출 역시 감소해 재택 기간이 늘어나도 취미 생활에 쓰는 소비는 증가하지 않은 것으로 분석됐다.이어 실내 밀집도가 높아 휴원 권고를 받은 학원 업종과 영업 규제를 받은 유흥업도 사상 최악의 실적 감소를 보인 것으로 나타났다.무술도장/학원의 3월 매출이 전년 동월 대비 –85%, 예체능 학원 –67%, 외국어 학원 –62%, 입시/보습학원이 –42%를 각각 기록했다. 노래방과 유흥주점은 각각 –50%, –39%를 기록했고, 실내에서 주로 서비스되는 안마시술소(–39%), 피부관리(-32%), 미용실(-30%)의 매출 역시 크게 감소했다. 그밖에 한식(–32%), 중식(-30%), 일식(-38%), 양식(-38%) 등 자영업자 비중이 상대적으로 높은 음식점 업종의 3월 매출 역시 감소한 것으로 나타났다.아울렛 매장(-31%), 가전제품 전문매장(-29%), 백화점(-23%), 대형마트(-17%) 등 대부분의 오프라인 쇼핑 매출도 급감했다.반면, 코로나19로 인해 1분기 비대면 쇼핑 매출이 예상대로 크게 증가하였는데, 인터넷 쇼핑 이용액은 무려 41% 증가한 것으로 나타났다. 홈쇼핑 매출도 19% 가량 증가했다. 또, 비교적 집에서 가까운 거리에 있는 편의점(6%)과 수퍼마켓(12%)의 매출은 증가해 생필품을 근거리에서 쇼핑하는 현상이 확산된 것으로 분석되었다. 더불어 정육점의 3월 매출은 26%, 농산물매장은 10% 증가하는 등, 식재료를 직접 구입해 집에서 조리해 먹는 이른바 '홈쿡' 현상이 확산된 것으로 나타났다. 또 주점 매출이 감소한 반면, 주류전문 판매점의 매출은 오히려 20%나 증가해 술을 사와 집에서 마시는 '홈술' 현상이 늘어난 것도 확인됐다.의료 업종에서는 소아과(-46%), 이비인후과(-42%), 한의원(-27%) 등 대부분의 병의원 3월 매출이 급감하였으나, 성형외과(9%)와 안과(6%) 매출은 오히려 증가해 집에 있는 시간이 늘어남에 따라 성형이나 안과 시술을 받는 경우가 많아진 것으로 분석됐다. 또 공적 마스크 판매 등 약국 방문이 급증함에 따라 1분기 약국 매출도 15% 가량 증가한 것으로 나타났다. 한편 1분기 국산 신차(-23%)와 중고차(-22%)를 신용카드로 구매한 금액은 감소한 가운데, 수입 신차 매출액은 11% 증가해 코로나19에도 불구하고 견조한 성장세를 이어갔다. 특히, 대중교통을 대신할 근거리/친환경 이동 수단으로서 자전거 매출이 크게 늘었는데, 올 3월 매출이 전년 동월 대비 무려 69% 증가해 눈길을 끌었다.보고서는 2004년 이후 매년 성장해온 신용카드 이용액의 평균 성장률을 고려할 때, 1분기 신용카드 매출의 순감소 폭은 16~18조원 내외로 추산(체크카드 및 법인카드 제외)된다고 밝혔다. 다만 지역별 피해 규모에는 다소 편차가 있는데 대구시의 1분기 카드 매출 감소율이 –17.9%로 가장 컸으며, 다음 부산(-16.8%), 인천(-15.7%), 제주(-14.6%), 서울(-13.5%), 경기(-12.5%), 경북(-11.9%) 순으로 나타났다. 하나금융경영연구소 정훈 연구위원은 ""소비 심리가 위축되어 있고 긴급재난 지원금도 식재료 등 주로 생필품 구입에 사용될 것으로 보여 업종 전반의 매출 정상화는 당분간 쉽지 않으며, 특히 여행, 항공, 숙박, 레저, 유흥업은 올해 마이너스 성장이 예상된다""고 내다봤다."
276,"        ▲  하나금융경영연구소가 발표한 '코로나19가 가져온 소비 행태의 변화' 내용.            ⓒ 하나금융경영연구소   코로나19 확산 여파로 면세점과 여행사, 무술도장 등 매출은 급격하게 떨어진 반면 자전거, 인터넷쇼핑, 정육점 등 매출은 크게 늘었다는 조사 결과가 나왔다. 21일 하나은행 소속 하나금융경영연구소는 '코로나19가 가져온 소비 행태의 변화' 보고서를 통해 이 같은 내용을 발표했다. 연구진은 하나카드의 개인 신용카드 매출 자료를 지난해와 비교해 업종별로 분석한 결과를 이번 보고서에 담았다. 보고서를 보면 국내 여행사의 올해 1분기(1~3월) 카드 매출액은 전년 같은 때에 비해 59% 감소했다. 또 같은 기간 면세점은 52%, 항공사는 50% 줄었다. 특히 코로나19 국내 신규확진자 수가 약 9700명으로 절정에 달했던 지난 3월 실적은 전년동월대비 면세점은 88%, 여행사 85%, 항공사는 74% 감소한 것으로 나타났다.실내 밀집도가 높아 휴원 권고를 받은 학원업종과 영업 규제를 받은 유흥업의 실적도 크게 감소했다. 무술도장·학원의 3월 매출은 전년동월대비 85%, 예체능학원은 67%, 외국어학원과 입시·보습학원은 각각 62%, 42% 줄었고, 노래방 -50%, 유흥주점 -39%, 안마시술소 -39% 등으로 집계됐다. 여행사·면세점 매출 반토막... 학원 매출은 85%나 줄어또 실내에서 주로 서비스되는 피부관리(-32%), 미용실(-30%)의 3월 매출 역시 감소한 것으로 조사됐다. 그 밖에 한식(–32%), 중식(-30%), 일식(-38%), 양식(-38%) 등 자영업 비중이 상대적으로 높은 음식점 업종의 3월 매출 역시 감소한 것으로 나타났다.레저·문화·취미 관련 업종의 매출도 모두 크게 줄었는데, 영화관의 3월 매출은 84%나 감소했다. 이어 테마파크·놀이공원 –83%, 사우나·찜질방 –59%, 헬스클럽 –54% 등으로 집계됐다. 더불어 지난 1분기 아울렛 매장(-31%), 가전제품 전문매장(-29%), 백화점(-23%), 대형마트(-17%) 등 대부분의 오프라인 쇼핑 매출도 급감했다. 반면 비대면 쇼핑 매출은 크게 증가했다. 올해 1분기 인터넷쇼핑 이용액은 전년보다 41% 늘었고, 홈쇼핑 매출도 19% 가량 증가한 것으로 집계됐다. 이와 함께 비교적 집에서 가까운 거리에 있는 편의점과 슈퍼마켓의 매출은 각각 6%, 12% 늘었다. ""매출 정상화 쉽지 않아... 여행 등 역성장할 듯""또 코로나19 여파로 집에서 조리하고, 먹고 마시는 이른바 '홈쿡' 현상이 확산했다는 것이 연구진 쪽 분석이다. 정육점의 3월 매출은 26%, 농산물매장은 10% 증가했고, 주류전문판매점의 매출도 20% 늘었다는 것이다. 의료 업종에서는 소아과(-46%), 이비인후과(-42%), 한의원(-27%) 등 대부분의 병·의원 3월 매출이 급감했지만, 성형외과와 안과 매출은 각각 9%, 6% 증가했다. 한편 1분기 국산 신차와 중고차를 신용카드로 구매한 금액은 각각 23%, 22% 감소한 가운데 수입 신차 매출액은 11% 늘어난 것으로 나타났다. 특히 올해 3월 자전거의 매출은 전년동월대비 69% 증가한 것으로 집계됐다. 하나금융경영연구소 정훈 연구위원은 ""소비심리가 위축돼있고 긴급재난 지원금도 식재료 등 주로 생필품 구입에 사용될 것으로 보여 업종 전반의 매출 정상화는 당분간 쉽지 않다""며 ""특히 여행, 항공, 숙박, 레저, 유흥업은 올해 마이너스(-) 성장이 예상된다""고 전망했다.저작권자(c) 오마이뉴스(시민기자), 무단 전재 및 재배포 금지"
277," 베르살리에르(Bersagliere)_중1. 제1차 세계대전과 베르살리에르가. 접이식 자전거를 작전에 사용한 최초의 부대  제1차 세계대전이 발발했을 때 베르살리에르는 자전거를 이동수단으로 사용했다. 자전거는 은밀히 기동하여 적을 기습한 후 사방으로 재빨리 흩어지는 히트 앤드 런 전술에 안성맞춤이었다. 베르살리에르는 접이식 자전거를 정식으로 장비표에 포함시킨 최초의 부대로 알려져 있다. 그리고 도입했던 자전거는 이탈리아 비앙키(BIANCHI)사의 '접이식 1912'로 알려져 있다.  비앙키 사의 ‘접이식 1912’ 자전거를 운용한 베르살리에르의 전투 군장 /출처= ⓒditsong.org.za   2020년 현재 판매되고 있는 비앙키 사의 접이식 자전거. 모델명은 프레타(fretta; 신속) /출처= ⓒ비앙키홈페이지  제1차 세계대전 당시 베르살리에르 대원들의 모습. 들고 멜 수 있는 접이식 자전거를 개발하여 운용했다. 대원들은 역시나 모자와 헬멧에 깃털 장식을 하고 있다. /출처= ⓒbikeradar.com  제1차 세계대전 당시 베르살리에르 대원의 복장을 잘 알 수 있는 사진 /출처= ⓒbikeradar.com  제1차 세계대전 당시 여러 나라 군대가 자전거를 기동 수단으로 운용했다. 사진 속 부대는 영국 경보병 /출처= ⓒbikeradar.com 나. '최초 부대' 논쟁 프랑스, 영국, 독일 등은 베르살리에르가 접이식 자전거를 정식 도입한 최초 부대가 아니라고 주장한다(결국은 자신의 군대가 최초라는 얘기다). 대표적으로 프랑스는 자전거 부대의 본산이 프랑스군이라고 한다. 아래 사진은 '클레멘트-글래디에이터'라는 프랑스 자전거 회사가 1896년 촬영한 홍보용 사진이다. 핵심 아이디어는 '경보병 부대+접이식 자전거'이다. 실제 일부 부대가 접이식 자전거를 작전에 운용한 기록이 있다. 그러나 베르살리에르처럼 본격적인 시도는 아니었다. 즉, 훈련, 편제, 장비를 모두 갖춘 '접이식 자전거 부대'가 존재하지는 않았다는 것이다. 영국과 독일도 사정은 비슷하다. 그러므로 '접이식 자전거를 작전에 사용한 최초의 부대' 타이틀은 이탈리아 베르살리에르에게 주어지는 것이 맞는다.  한 프랑스 자전거 제조업체가 촬영한 홍보용 사진 /출처 =ⓒ위키미디어커먼즈 다. '최초 자전거' 논쟁  비앙키사의 '접이식 1912'가 베르살리에르의 최초 모델이 아니라는 문제 제기도 있었다. 이는 맞기도 하고 틀리기도 하다. 베르살리에르가 작전에 자전거를 운용할 생각을 한 것은 1800년대 말부터였다. 초기에는 아래 사진과 같은 나무 자전거로 실험하기도 했다. 또 미국산 접이식 자전거 시제품을 도입한 적도 있다. 그러나 말 그대로 실험 차원의 시제품 사용이었다. 본격적으로 부대 편제, 작전 시행에 활용한 자전거는 '접이식 1912'가 맞는다.   1800년대 말 베르살리에르가 시험 운용했던 나무 자전거. 한 눈에 보고 알 수 있겠지만, 실제 작전에 사용하진 못했다. /출처 =ⓒditsong.org.za  베르살리에르가 시험적으로 운용했던 미국산 접이식 자전거 /출처= ⓒtheworldwar.org 2. 제2차 세계대전과 베르살리에르가. 모터사이클 부대의 등장 제2차 세계대전이 발발하자 베르살리에르는 일부 예하 부대에 접이식 자전거 대신 모터사이클을 지급했다. 이들이 지급받은 것은 모토 구찌(500㏄)와 베넬리(350㏄) 개량형이었는데 다음 사진에 그 모습이 잘 나타나 있다.  출동 전 사열 받는 베르살리에르 모터사이클 부대(상). 출동 직전의 모습(하) /출처= ⓒridingvintage.com  제2차 세계대전 당시 베르살리에르 모터사이클 부대. 주로 1인 1조로 짝을 이루고 있다. /출처= ⓒridingvintage.com  제2차 세계대전기의 모습을 간직한 2인용 모토 구찌. 뒤쪽에 안장과 작은 손잡이가 있다. /출처= ⓒww2italianreenactment.com [남보람 군사편찬연구소 연구원]"
278,춘천시는 이번 달부터 '찾아가는 자전거 안전교육'을 진행한다.'찾아가는 자전거 안전교육'은 안전한 자전거문화 조성을 위한 '춘천 자전거 시민학교'의 1단계 사업이다. 이번 교육은 지역 내 6개 학교를 직접 방문해 1개 학교당 4회에 걸쳐 자전거 교육을 실시하게 된다. 1회당 교육인원은 20명으로 올해 대상자는 총 480명이다. 대상학교는 춘천교육지원청과의 협약을 통해 선정할 예정이다.
