,contents
440,"기상청 제공(서울=연합뉴스) 15일 오후 8시 3분 26초(한국시간) 미국 네바다주 토노파 서북서쪽 57km 지역에서 규모 6.4의 지진이 발생했다고 기상청이 외국 관측 기관 등을 인용해 전했다.    진앙은 북위 38.17도, 서경 117.88도이며 지진 발생 깊이는 8km다.※ 이 기사는 기상청 데이터를 토대로 알고리즘에 의해 자동 작성돼 편집자의 데스킹을 거쳤습니다. 지진 정보는 기상청 홈페이지(http://www.weather.go.kr/weather/earthquake_volcano/internationallist.jsp)에서도 확인할 수 있습니다."
441,"정부가 2017년 11월 발생한 5.4 규모 포항지진 원인으로 지목된 지열발전 사업을 부실히 관리하고 유발지진 발생 가능성을 제대로 조사하지 않았다는 감사원 감사결과가 1일 나왔다.    특히 포항지진 본진의 '전조'격인 2017년 4월 발생한 규모 3.1 지진에 대해 시행사와 정부가 별도의 분석을 하지 않고 넘기는 바람에 대처할 기회를 놓쳤다는 점이 지적돼 결국 포항지진은 '인재'였다는 비판이 제기된다.     감사원은 이 같은 내용을 담은 '포항 지열발전 기술개발사업 추진실태' 감사보고서를 이날 공개했다.    앞서 포항주민 등은 지난 2018년 11월 지열발전소 건설 과정에서 산업통상자원부 등 관련 기관의 위법·부당행위가 있었는지 확인해 달라며 국민감사를 청구한 바 있다.    산업부도 작년 3월 정부조사연구단이 '포항지진은 인근 지열발전소가 촉발했다'는 결론을 발표하자 곧바로 산업부를 비롯한 관련 기관의 대처가 적정했는지 점검해달라며 공익감사를 청구했다.     감사원은 청구된 두 사안을 병합해 지난해 9월 18일부터 10월 31일까지 산업부, 포항시, 한국에너지기술평가원(에기평), 한국지질자원연구원(지자연)등에 대해 감사를 실시했다.    산업부는 연구개발(R&D) 사업 과제를 총괄하고 있으며 에기평은 국가 에너지 연구개발 과제 전담기관으로 주관기관과 협약을 체결해 기획과 중간평가(연차·단계평가), 과제기간 연장 승인 등의 업무를 담당한다.     감사원은 감사 결과 부실한 안전관리 방안 수립, 관리감독 소홀 등 모두 20건의 위법하거나 부당한 사항을 확인했으며 관련 기관에 관련자 징계·문책, 주의 등을 요구했다고 밝혔다.◇ 지열발전 따른 '유발지진' 대비 관리방안 부실     감사결과 우선 포항지열발전 사업 컨소시엄을 주관한 넥스지오와 에기평, 산업부는 지열발전으로 인한 유발지진 가능성과 관련해 마련한 '미소진동 관리방안'을 부실 수립·관리했다.     컨소시엄은 2014년 3월 산업부와 에기평에 2009년 스위스 바젤에서 규모 3.4 지진 발생으로 지열발전 사업이 중단된 사례와 함께, 수리자극 전까지 '미소진동 관리방안'을 세우겠다고 보고했다.    수리자극이란 물을 암반 내에 고압으로 주입해 틈을 만들거나 넓혀 암반의 투수율을 증가시키는 작업으로 이 과정에서 크고 작은 규모의 유발지진이 발생한다.    컨소시엄은 2016년 1월부터 2017년 9월까지 총 5차례의 수리자극을 실시했다.     이 중 2차 수리자극 때인 2016년 12월 규모 2.2과 2.3의 지진이, 3차 수리자극 중인 이듬해 4월 규모 3.1과 2.0 지진 등 총 4번의 지진이 발생했다.    컨소시엄은 수리자극에 따른 유발지진 규모를 관측해 녹색·황색·적색으로 구분해 물주입 압력과 유량을 조절하도록 하는 안전수칙인 '신호등체계'를 만들면서 세부내용을 산업부·에기평 등과 협의하지 않았고, 산업부와 에기평도 이를 확인하지 않았다.     신호등체계에는 적색단계에 해당하는 지진 발생 시 수리자극을 중단하고 정부기관 승인을 받은 후 수리자극을 재개하도록 하는 내용이 포함됐어야 하지만 반영되지 않았다고 감사원은 지적했다.     또한 신호등체계에 따라 수리자극 중 발생한 지진에 대해 산업부, 에기평, 포항시, 기상청 등 4개 기관에 이를 보고해야 했지만 2016년 지진 발생 때 에기평에만 보고하고 웹사이트에도 이를 공개하지 않았다.     컨소시엄은 2016년 지진 발생 후 슬그머니 신호등체계를 손봐 포항시와 기상청은 연구개발 관리 기관이 아니라며 보고대상에서 빼고, 웹사이트 방문자가 적다면서 발생 사실을 웹사이트에 게재하지 않기로 했다.    산업부도 지열발전에 따른 지진 발생 가능성과 관리 필요성을 담은 미국 에너지부의 '유발지진 관리 프로토콜'을 확인하고도 직접 안전수칙을 만들려 하거나 컨소시엄의 수칙 수립 여부를 확인하지 않았다.     ◇ '전조' 4월 지진 위험도 조사 안해…11월 5.4 규모 지진 발생    2017년 11월 발생한 5.4 규모 지진의 '전조' 격인 지진을 소홀히 넘겼다는 지적도 제기됐다.     사업을 주관한 넥스지오는 3차 수리자극 중이었던 2017년 4월 신호등체계 최고단계인 적색등급(규모 2.5 이상)에 해당하는 3.1 규모 지진이 발생했지만, 지열발전과 관련한 지진이라는 점을 산업부·에기평에 보고하지 않았다.     또한 2차 수리자극 때인 2016년 12월 발생한 1∼2차 지진과 발생위치가 다른데도 이유를 분석하지 않아 새로운 단층의 존재를 확인할 기회를 놓쳤다.    7개월 뒤인 11월 발생한 5.4 규모 지진은 바로 이 3차 수리자극 중 지진이 발생했던 단층과 같은 면이라고 작년 정부조사연구단이 분석한 바 있다.     컨소시엄은 1∼3차 수리자극에서 물 주입량 대비 지진 규모가 가파르게 커져 지진 발생 가능성이 높아졌는데도 별도의 위험도 분석 없이 같은해 8∼9월에 4·5차 수리자극을 강행했다. 또 5차 때는 당초 계획한 양(320㎥)보다 5배가 넘는 양(1천722㎥)을 주입하기도 했다.     여기에 산업부는 규모 3.1 지진 발생을 보고받아 유발지진 발생 가능성을 알았지만 유발지진 여부를 확인하거나 지진 위험도 분석을 하지 않았고, 에기평도 이런 과정 없이 컨소시엄의 사업 기간을 연장해줬다.    특히 에기평은 연장승인 검토 수리자극 당시 4차례 발생했던 지진의 위치가 수리자극에 따른 미소진동(지각의 약한 흔들림 현상) 위치와 비슷하다는 점을 보고받은 것으로 나타났다.     감사원은 사업 시행사와 산업부, 에기평의 업무 소홀로 규모 3.1 지진이 발생한 후에도 수리자극이 계속돼 5차 수리자극(2017년 9월) 후 2달 후인 11월 규모 5.4 지진이 발생했다고 지적했다.     감사원은 산업부 담당자에게 경징계 이상의 징계처분을 하고, 에기평 관계자는 문책 하라고 각 기관에 통보했다. ◇ 사업 시행사 선정·사업 관리 총체적 부실    정부의 사업자 선정 과정에서도 문제점이 드러났다.     넥스지오는 당초 정부가 추진하려고 했던  200㎾(킬로와트)급 지열발전 사업에서 영세한 규모와 주요 기술을 해외에서 도입했다는 이유로 탈락했지만 이후 오히려 규모가 큰 ㎿(메가와트)급 지열발전 과제에서 사업자로 선정된 것으로 드러났다.    또, 산업부는 사업비 규모를 예비타당성 조사를 거치지 않도록 500억원 이내로 하도록 무리하게 지시해 사업자인 넥스지오가 자금부족 등으로 중국 업체에 시추·물 주입 등을 일괄발주하게 만들었다고 보고서는 지적했다.     또한 에기평은 컨소시엄이 사업과제 수행 중 허위 보고서를 제출하거나 시추 목표를 달성하지 못했는데도 중간평가에서 면밀한 검토없이 4차례나 사업 기간을 연장해줬다.    아울러 넥스지오는 인적·물적 구분이 불명확한 자회사와 장비 임대차 계약을 체결하는 방식으로 모두 96억원의 임차비를 부당 집행, 감사원은 에기평에 임차비 회수방안을 마련하라고 통보했다.    "
442,"지난 2017년 11월 발생한 진도 5.4 규모의 포항 지진과 관련해, 정부가 지열발전 사업을 부실하게 관리하고 특히 '전조' 격인 유발지진의 발생 가능성을 제대로 조사하지 않았다는 감사원 감사 결과가 나왔습니다.감사원은 오늘 이같은 내용을 담은 '포항 지열발전 기술개발사업 추진실태' 감사보고서를 공개했습니다.감사원에 따르면 포항 지열발전 사업을 주관한 컨소시엄 측은 지하 암반에 물을 주입해 틈을 만드는 '수리자극'을 시행하는 과정에서 포항지진 7개월 전 규모 3.1의 지진이 발생했는데도 이를 유발지진으로  보고하지 않았습니다.산업부 역시 유발지진 관리의 중요성을 인지하고 있었음에도 수리자극 시행 중지 등 필요한 조치를 하지 않았습니다.또 컨소시엄 측이 유발지진 가능성에 대비한 관리방안을 세워놓고도 이를 부실하게 운영했고 관리 감독해야 할 산업부 등은 이같은 관리방안이 수립돼 있는지 여부조차 확인하지 않은 것으로 조사됐습니다.감사원은 이같이 포항 지열발전 사업 과정에서 모두 20건의 위법과 부당사항을 확인하고, 징계와 문책 그리고 주의요구 등의 조치를 취했다고 밝혔습니다.임경아 기자 "
443," LG유플러스는 인기 애니메이션 '최강전사 미니특공대'가 진행하는 안전교육 가상현실(VR) 콘텐츠 '미니특공대 안전체험VR'을 U+VR 앱에서 제공한다고 10일 밝혔다.   LG유플러스는 비대면 교육에 대한 사회적 관심이 높아진 상황을 고려해 미니특공대의 지식재산권(IP)과 VR을 이용한 어린이 대상 안전교육 콘텐츠 '미니특공대 안전체험VR'을 기획했다.   VR콘텐츠기업인 스토익엔터테인먼트는 초등학교 수업에 활용되는 '안전한 생활' 교과서를 기반으로 △화재예방 및 대처 △지진대피 △약물의 필요성과 위험성 △금연 등의 내용을 담은 VR 교육 콘텐츠를 개발했다.   '미니특공대 안전체험VR'은 원작 애니메이션의 에피소드 중 화재, 지진 등 주제에 관련된 부분을 활용해 제작됐다. 이용자가 가상현실 속에서 애니메이션 캐릭터들과 상호작용해 문제를 해결하고, OX퀴즈 등 일련의 교육 과정을 수행한다. 향후 미니특공대의 주인공인 볼트, 새미, 루시, 맥스와 이용자들이 증강현실(AR) 사진을 찍을 수 있는 콘텐츠도 U+AR 앱을 통해 제공할 계획이다.   최윤화 스토익엔터테인먼트 대표는 ""전 세계에서 사랑 받는 미니특공대 애니메이션을 활용해 어린이들에게 꼭 필요한 생활 안전 체험 가상현실 콘텐츠를 서비스하게 돼 기쁘다""며, ""U+VR에서 5화를 먼저 공개하고 추가로 5화를 제작해 총 10화 분량을 서비스할 계획이다""라고 말했다.   최윤호 LG유플러스 AR·VR서비스담당 상무는 ""온라인·비대면 교육이 확산되는 가운데 3D·AR 기술을 활용해 어린이들의 호기심을 유발하고 학습효과를 높일 수 있는 콘텐츠의 수요가 늘고 있다""며, ""인기 애니메이션 시리즈를 VR, AR과 같은 미래형 실감 교육콘텐츠로 확장해 이용자의 일상에 자리매김할 수 있도록 노력하겠다""고 말했다.   "
444,"나가노 중부를 진원으로 하는 최근의 유감지진은 지난 22일 5차례를 비롯해 23일 16차례, 24일 10차례, 25일 8차례, 26일 13차례, 27일 6차례 발생했다.    28일 새벽에도 1차례 관측됐다.    특히 지난 23일 새벽에는 규모 5.5의 지진으로 나가노현 마쓰모토(松本)시에서 진도 4(전등줄이 크게 흔들리고 대부분의 사람이 놀라는 수준)가 관측됐다.    이들 지진의 진원은 모두 깊이가 수 킬로미터에서 10㎞ 정도로 얕은 편이어서 규모가 크지 않아도 땅의 흔들림이 강한 경향을 보였다.    최근 빈발하는 유감 지진이 큰 지진의 전조일 수 있다는 점에서 불안감을 키우고 있다.    이와 관련, 일본 기상청은 당분간 이 정도의 지진이 계속될 가능성이 있다며 주의를 당부하고 있다.    하지만 최근 빈발하는 지진의 정확한 원인을 파악하지 못하고 있다.    다만 지진이 빈발하는 지역의 주변에서 확인된 여러 개의 활성단층과 연관된 것으로 추정하고 있다.    교도통신은 일본 기상청을 인용해 지진 빈발은 화산 활동에서 비롯된 것일 수 있는데, 현재 나가노현 주변에서는 눈에 띄는 화산활동을 확인할 수 없는 상태라고 전했다.2016년 4월 일본 구마모토(熊本)현 지진 당시의 이재민들이 체육관 시설에서 피난 생활을 하는 모습. [UPI=연합뉴스 자료사진]한편 일본 일각에선 신종 코로나바이러스 감염증(코로나19)이 확산하는 상황에서 닥칠 수 있는 지진 등 대규모 자연재해에 대응하기 위한 특별 대책을 마련해야 한다는 지적이 나오고 있다.    재해가 닥치면 이재민이 생길 수밖에 없고, 피난소 등에 이재민을 집단으로 수용할 경우 코로나19 확산 사태로 이어질 수 있기 때문이다.    마이니치신문은 28일 코로나19가 확산하는 가운데 재해 시의 피난소 운영 문제를 놓고 지자체들이 대책 마련에 부심하고 있다고 전했다.    일본 전문가들은 불시에 닥칠 수 있는 재해에 대비해 코로나19 감염 예방을 위한 이재민 보호 대책을 마련해 놓아야 한다고 제언하고 있다.   "
445,"28일 낮 12시 6분 53초 충남 금산군 북서쪽 8km 지역에서 규모 2.4의 지진이 발생했다고 기상청이 밝혔다.    진앙은 북위 36.16도, 동경 127.43도이며 지진 발생 깊이는 10km이다.    계기 진도상 최대 진도는 대전, 전북, 충남, 충북에서 2로 기록됐다.     진도 2 규모의 지진은 조용한 상태에 있거나 건물 위층에 있는 소수의 사람만 느끼는 정도다.     지진이 발생한 것은 전날 오전 11시 7분께 전북 장수군 북쪽 17㎞에서 2.8 지진이 일어난 이후 이틀 연속이다.     해역을 제외한 충남지역에서는 2018년 10월 17일 규모 2 지진 이후 1년 6개월 만에 지진이 기록됐다.     기상청 관계자는 ""어제 지진과 관련된 지진은 아니다""라며 ""이번 지진이 일어난 곳은 인근 지역에서도 종종 지진이 발생하던 곳""이라고 설명했다.    이어 ""지진피해는 없을 것""이라고 내다봤다.   "
446," 28일 낮 12시6분53초 충남 금산군 북서쪽 8km 지역에서 규모 2.4의 지진이 발생했다. 또 12시52분1초에는 전남 목포시 남쪽 17km 해역에서 규모 2.1의 지진이 났다. 기상청 발표에 따르면 먼저 충남 금산 북서쪽 지진의 진앙은 북위 36.16도, 동경 127.43도다. 지진 발생 깊이는 10km로 관측됐다. 계기 진도상 최대 진도는 대전, 전북, 충남, 충북에서 2를 기록했다. 이어 전남 목포시 남쪽에서 발생한 지진의 진앙은 북위 34.66도, 동경 126.41도다. 지진 발생 깊이는 22km이다./연합뉴스진도 2 규모의 지진은 조용한 상태에 있거나 건물 위층에 있는 소수의 사람만 느끼는 정도다.한편 해역을 제외한 충남지역에서 지진이 발생한 것은 지난 2018년 10월17일 규모 2 지진 이후 1년 6개월 만이다. 이번 지진과 관련, 기상청 관계자는 “지진피해는 없을 것”이라고 설명했다.  /김경훈기자"
447," 경상북도 포항시는 4일 지진트라우마센터에서 유관기관 실무자 36명을 대상으로 재난 관련 심리적 응급처치의 전문인력 양성을 위한 교육을 실시했다고 밝혔다.'심리적 응급처치'(Psycholoical Fist Aid) 프로그램은 재난 발생 시 신속하고 체계적 개입을 위한 네트워크 구축 및 재난 심리지원 전문가 양성을 위한 교육이다.이번 교육은 최근 신종 코로나바이러스감염증(코로나19)와 지진·화재 등 대규모 재난상황 발생에 따른 건강 취약계층의 고립감·우울감 등 '코로나 블루' 현상을 감안, 취약계층 유관기관 상담 실무자의 역량 강화 차원에서 이뤄졌다.트라우마센터는 이번 교육을 시작으로 '코로나19' '지진' 등 예측할 수 없는 각종 재난에 대응할 수 있도록 연내 100여 명의 재난심리지원 전문인력을 양성할 방침이다. 향후 교육 세부일정 등 자세한 사항은 포항지진트라우마센터 인터넷 홈페이지를 참조하면 된다. 이영렬 포항지진트라우마센터장은 ""심리적응급처치는 재난 경험자들에게 즉각적으로 제공되는 대표개입으로 심리적 충격을 완화하고 외상 후 스트레스를 극복하도록 돕는데 필수적인 역할을 한다""며 ""재난심리지원에 투입될 수 있는 전문가 양성과 심리교육 등 다각적인 재난대응역량 강화에 힘쓰겠다""고 전했다. 영남취재본부 박동욱 기자"
448,"전남 해남 지진 현황최근 지진이 잇따르는 전남 해남에서 조선 시대에 지진이 발생했다는 기록이 나왔다. 이 지역에 지진을 일으킬 만한 단층이 있고, 이 단층이 최근 재활성한 것 아니냐는 추론이 나온다.5일 기상청이 조선왕조실록 등 문헌을 토대로 발간한 ‘한반도 역사지진 기록’을 보면 세종 18년인 1436년 2월 8일 전라도 해진(海珍)과 강진현에 규모 4의 지진이 발생했다. 해진은 현재 해남과 진도를 합친 고을 명이다. 당시 지진 발생 위치는 위도 34.6, 경도 126.7로 기록됐다. 최근 지진이 발생한 전남 해남군 서북서쪽 21㎞ 지역은 위도 34.66∼34.67, 경도 126.39∼126.41로, 오차를 고려하면 비슷한 지점에서 발생한 지진으로 추정된다.이 지역은 지난달 26일 규모 1.8 지진을 시작으로 4일 오후 4시까지 모두 55차례 지진이 발생했다. 그 중에는 기상청이 통보하는 규모 2.0 이상의 지진도 지난달 28일(규모 2.1), 30일(규모 2.4), 이달 2일(규모 2.3), 3일(규모 3.1) 등 4건 포함됐다.1978년 기상청이 계기 관측을 시작한 이래 이 지역에서는 한 번도 지진이 발생하지 않다가 최근 지진이 이어지자 기상청은 4일 진앙에 실시간 임시 관측소를 설치해 원인 조사에 착수했다.해남 지역에 조사된 단층이 없었기에 초반에는 원인 모를 지진이라고 보는 분위기가 강했으나 전문가들 사이에선 해남에도 인지하지 못한 단층이 있다는 관측에 점차 무게가 실리는 모양새다. 김광희 부산대 교수는 “1436년에 이 지역에서 규모 4 지진 발생 이후에도 규모6 지진이 발생하는 등 여러 차례 지진이 났다는 역사적인 기록이 있다”며 “지진 발생 위치나 규모 등이 일부 부정확할 수 있지만 당시 상당히 큰 흔들림이 있었다는 뜻”이라고 말했다. 이어 “역사 기록을 보면 결국 이 지역에 단층이 있었다는 것”이라며 “최근 알 수 없는 이유로 단층이 재활성된 것 같다”고 말했다. 4일 오전 최근 잇따라 지진이 발생한 전남 해남군 서북서쪽 21㎞ 지역 간척지 보리밭이 평온한 모습이다. 이곳에서는 지난달 26일 규모 1.8 지진을 시작으로 이날 오전 11시까지 원인을 알 수 없는 54차례 지진이 발생했다. 해남=연합뉴스기상청 관계자는 “당시 연구자들이 합리적으로 위치를 추정했겠지만 (문헌 속) 지진 발생 지점은 대략적인 위치일 것”이라면서도 “최근 지진이 계속되는 것을 보면 인지하지 못한 단층이 존재한다는 개연성은 있다”고 말했다. 한 지역에서 이처럼 연속으로 지진이 발생하는 ‘군(群) 지진’, ‘연속 지진’은 한반도에서 자주 나타나는 현상은 아니다. 해남 이전에는 2013년 6∼9월 보령에서 98회, 2019년 4∼10월 백령도에서 102차례 지진이 발생한 바 있다. 보령 지진의 경우 대부분 규모 2.0∼3.0이었고, 최대 규모는 3.5로 기록됐다. 백령도 지진은 대다수가 규모 1.0 미만이었고, 가장 강한 지진은 규모 2.7이었다. 기상청 관계자는 “주민들은 지진이 발생할 가능성에 대비해야 한다”며 “단층 분석 작업에는 시간이 걸릴 것”이라고 내다봤다.박소영기자"
449,"어제(11일) 오후 7시 45분경 북한 강원도 평강에서 규모 3.8의 지진이 발생했습니다.이번 지진은 올해 발생한 지진 중 가장 큰 규모로, 우리나라는 강원과 경기도 부근에서 최대 진도 2가 감지됐습니다.기상청은 이번 지진이 자연 지진이고, 북한의 인위적인 활동과는 관련이 없다고 밝혔습니다.  김정연 기자"
450," 11일 오후 7시 45분 6초 북한 강원 평강 북북서쪽 32㎞ 지역에서 규모 3.8의 지진이 발생했다. 기상청은 이번 지진이 지하 폭발, 핵실험 등으로 인한 '인공지진'이 아닌, '자연지진'이라고 분석했다.이날 기상청 관계자는 ""자연지진으로 보인다""며 ""국내 피해를 우려할 만한 수준은 아니다""라고 밝혔다. 진앙은 북위 38.68도, 동경 127.18도이다. [기상청 제공]그러면서 ""이번 지진은 자연지진으로 분석된다""며 ""지진파의 상하 진동폭(S파)이 좌우 진동폭(P파)보다 큰 형태로, 자연지진의 파형""이라고 설명했다.당초 기상청은 이동속도가 빠른 지진파(P파)만을 이용해 이날 오후 7시 45분 규모 4.0의 지진이 발생했다고 발표했으나 6분 뒤 규모를 3.8로 하향 조정하고 발생 위치도 수정했다.지역별 관측 장비에서 기록된 최대 진도는 강원, 경기, 서울, 인천에서 2로 기록됐다. 진도 2는 조용한 상태나 건물 위층에 있는 소수의 사람이 진동을 느낄 수 있는 수준이다.이번 지진은 올해 한반도와 주변 해역에서 난 지진 중 가장 강력한 것이다. 지난해 7월 21일 경북 상주에서 발생한 규모 3.9 지진 이후 가장 규모가 크다.북한과 인접한 강원 횡성, 속초 등과 경기지역은 물론 서울에서도 진동을 느꼈다는 신고들이 잇따랐다. 전문가들은 “지진이 발생한 평강과 서울, 충청도 해안으로 추가령단층대가 이어진다""고 수도권 지역의 진동에 대해 설명했다.권준영기자"
451,"사진 기상청           통일부가 북한 강원 평강 지역에서 11일 발생한 지진은 핵실험 등에 따른 '인공지진'이 아니라고 밝혔다.      통일부 당국자는 12일 기자들과 만나 ""지난 11일 발생한 강원 평강 지역 지진과 관련해 기상청이 '인공지진'이 아닌 '자연지진'이라고 밝혔다""고 말했다. 이어 ""북한 매체들도 이번 지진과 관련한 특별한 언급이 없었다""고 덧붙였다.      기상청에 따르면 11일 오후 7시 45분 북한 강원 평강 북북서쪽 32㎞ 지점 깊이 16㎞에서 규모 3.8의 지진이 발생했다. 국내 지역별 관측 장비에 기록된 최대 진도는 강원, 경기, 서울, 인천에서 2로 기록됐다. 진도 2는 조용한 상태나 건물 위층에 있는 소수의 사람이 진동을 느낄 수 있는 수준이다. 실제 지진 발생 직후 수도권과 강원도 등 일부 지역에서는 진동을 느꼈다는 신고전화가 접수됐다.        김은빈 기자 kim"
