,contents
818,"게티이미지뱅크건강에 신경쓰는 중장년층이라면 새해에는 '콜레스테롤 계획'을 세워보자. 콜레스테롤은 중년에게 핵심 관리 대상이다. 콜레스테롤은 한국인 주요 사망원인인 심혈관질환뿐 아니라 치매와도 관련이 있다. 그러나 중장년의 콜레스테롤 관리는 부실한 편이다. 실제로 한국지질동맥경화학회 자료에 따르면 국내 60대 이상 남성은 4명 중 1명, 여성은 10명 중 4명 꼴로 저밀도 지질단백질(LDL) 콜레스테롤 수치가 건강하지 못하다(130㎎/㎗ 초과). 국내 성인의 콜레스테롤 실태는 어떨까. 콜레스테롤은 왜 관리해야 하며, 어떻게 수치를 개선할 수 있는지 알아보자.◇LDL 수치는 낮추고 HDL 수치는 높아야이상적인 콜레스테롤 수치는 고밀도 지질단백질(HDL) 50㎎/㎗ 이상, LDL 130㎎/㎗ 이하다. LDL 콜레스테롤은 세포 등 우리 몸속 필요한 곳에 콜레스테롤을 실어나르는 트럭 역할을 하지만, 쉽게 산화된다. 산화된 LDL콜레스테롤은 혈관 벽에 쌓이고 혈관 내부로 침투하는 성질이 있다. 이렇게 되면 혈관이 좁아지고 막혀, 협심증·심근경색·뇌졸중 같은 혈관질환이 생길 위험이 커진다. 반대로 HDL콜레스테롤은 혈관 벽에 쌓인 콜레스테롤을 간으로 되돌려 보내거나, 몸 밖으로 배출하는 청소부 역할을 한다. 그런데 나이가 들수록 HDL 수치는 낮아질 가능성이 커진다. 특히 여성이 그렇다. 국내 건강검진통계 연보에 따르면 50대 기준으로 저(低) HDL콜레스테롤혈증 진단을 받은 남성은 19.5%였지만, 여성은 28.7%였다. 60대는 남성 22.9%, 여성 41.4%로 격차가 더 컸다. 70대는 남성 25.7%·여성 48.1%, 80대는 남성 26%·여성 50.4%였다.중년 이후 여성 HDL 수치가 나빠지는 이유는 폐경과 관련 있다. 폐경으로 여성호르몬인 에스트로겐이 급격히 줄어들기 때문이다. 에스트로겐은 체내에서 혈관을 부드럽게 이완시키고, LDL 수치는 낮추며, HDL 수치를 높이는 역할을 한다. 갱년기에 각종 혈관질환 위험이 커지는 것도 에스트로겐 수치가 낮아지기 때문이다.◇혈관 질환 외에 치매도 관련콜레스테롤 관리는 흔히 혈관 건강 때문에 해야 한다고 생각하지만, 한 가지 이유가 또 있다. 바로 '뇌 건강'이다. 최근 중국 텐진대 연구팀이 2011년부터 2017년까지 치매환자 117명과 건강한 사람 117명을 대상으로 콜레스테롤 수치와 치매 발병률의 상관관계를 분석, 발표했다. 그 결과 총 콜레스테롤 수치와 LDL 수치가 높을수록 치매 발병 위험은 높았다. 반면 HDL 수치는 높을수록 치매 발병 위험이 낮았다. 치매 환자의 평균 콜레스테롤 수치는 214㎎/㎗로 건강한 사람 수치 192㎎/㎗보다 약 10% 높았다. LDL 수치 역시 치매 환자는 131㎎/㎗로 건강한 사람 수치 95㎎/㎗보다 약 27% 높았다.HDL콜레스테롤의 경우, 치매 환자의 평균치는 54㎎/㎗로 건강한 사람 평균인 60㎎/㎗보다 낮았다. 연구팀은 HDL콜레스테롤이 치매를 유발하는 독성 단백질 베타아밀로이드의 뇌 축적을 막으며, HDL콜레스테롤 자체의 항염증 효과가 뇌 퇴화로 생기는 염증을 완화해 치매에 긍정적인 영향을 준다고 분석했다. 연구팀은 ""HDL 수치를 높이면 치매 증상 완화도 가능할 것""이라고 덧붙였다. 그 외에도 일본 대규모 연구에서 HDL 수치가 높으면 치매 발병률이 낮다는 결과가 나온 바 있다.◇식습관·운동습관 교정 필수이상지질혈증 판단을 받을 정도로 콜레스테롤 수치가 나쁘면 병원에서 약물치료를 시작해야 한다. 식습관·운동습관 교정도 필수다. 케이크, 팝콘, 튀김 등 트랜스지방이 많은 음식은 피한다. 트랜스지방 섭취가 많아지면 LDL 수치가 높아지고 HDL 수치가 낮아지는 경향이 있다. 실제로 혈중 트랜스지방 농도가 높은 집단은 그렇지 않은 집단에 비해 치매 발병 위험이 50% 높다는 일본 규슈대 연구가 있다. 과도한 탄수화물 섭취는 피한다. 에너지로 쓰이지 못한 탄수화물은 중성지방 형태로 몸에 저장되는데, 중성지방은 HDL콜레스테롤 분해를 촉진한다. HDL 수치를 높인다고 알려진 건강기능식품 섭취도 고려할 만 하다. 운동은 일주일에 5일, 한 번에 30분 이상 한다. 이렇게 꾸준히 운동하면 혈액 내 지질 분해 효소가 활발해지면서 HDL 수치도 높아진다.  / 김수진 헬스조선 기자"
819,"노인성 질환 중 하나인 치매환자가 급속도로 증가하면서 지난해 상반기 신규 치매보험 가입건수가 크게 증가한 것으로 나타났다. 치매보험이란 치매로 진단받았을 때 진단비와 간병비 형태로 보험금을 지급받는 상품으로 생·손보사에서 모두 판매되고 있다.한국신용정보원이 15일 발표한 '치매보험 가입현황을 통해 본 고령층 보험시장의 시사점' 보고서에 따르면 지난해 상반기 치매보험 신규 가입 건수는 136만2000건으로 전기 대비 214% 증가했다. 특히 경증 치매진단을 보장하는 치매보험 상품 가입건수는 전기 대비 455% 늘어났다. 최근 보험업계에서 치매를 단독으로 보장하는 상품을 연이어 출시하면서 치매담보를 전용으로 하는 단독형 상품의 비중도 2017년 8%에서 2018년 52%, 지난해엔 78%까지 급증했다. 단독형 상품의 경증진단 보장비중은 79.1%로 종합형(28.5%)보다 높았고, 평균 보장 기간도 89.9세로 종합형(83.0세)보다 길었다. 단독형 치매보험의 가입자는 종합형에 비해 여성과 고령자에 집중됐다. 단독형 상품의 여성 가입자 비중은 68%로 종합형(60.2%)보다 높았다. 또 단독형 가입자의 연령별 분포는 50대(41%), 60대(27%), 40대(21%) 순인데 비해 종합형은 50대(25%), 40대(25%), 60대(10%) 순이었다.  김현경 신용정보원 조사역은 ""치매보험과 같은 장기 보장성 상품 가입시 은퇴 후의 불안정한 소득을 예상하고 현재 보유한 보험 포트폴리오와 보험료를 부담할 재정능력을 고려해 신중하게 가입해야 한다""고 밝혔다.  특히 ""고령층이 치매 보험에 가입 시 금융이해력이 낮아 불완전 판매 등의 문제에 노출될 가능성이 높으므로 본인에게 적합한 상품인지 주의해 판단할 필요가 있다""고 조언했다"
820,"            신종 코로나바이러스 감염증(코로나19) 사태로 센터가 지난 2월 24일 문을 닫자 김씨의 치매 검사 대기 시간도 길어졌다. 센터엔 ""치매 검사를 대기 중인 어르신 상황이 급격히 안 좋아진다""는 주민 전화가 걸려오기 시작했다. 직원들은 ""화상 회의하듯 검사해보자""고 아이디어를 냈다. 원격진료의 시작이었다.        원격진료는 우선 사전 전화 상담으로 일정을 잡는다. 그 뒤엔 간호사가 방문해 1차 진단검사와 보호자 심층 상담을 한다. 2차 방문 땐 원격진료를 하는데, 직원들이 노트북과 스피커 설치와 같은 진료 준비를 돕는다. 김씨는 이달 초 1차 방문 검사에 응했다. 검사 결과 인지저하로 2차 의료진 원격진료를 통해 의사로부터 치매 임상검사를 받아야 했다. 12일 김씨 집에 도착한 치매안심센터 직원이 노트북을 설치하고 카메라를 켰다. 노트북 화면엔 하얀 가운을 입은 의사가 나타났다. 30여 분에 걸린 원격 진료 끝에 할머니는 '치매' 진단을 받았다. 센터에선 가족에게 연계병원인 강동성심병원에서 치매 원인을 밝힐 뇌 촬영, 혈액검사 예약 안내를 했다.        심용숙 강동구 치매안심센터 총괄팀장은 ""코로나19로 치매 검사를 대기 중인 어르신은 30명 정도이며, 지난주엔 4명에 이어 이번 주 3명이 원격 검사를 받을 예정""이라고 말했다. 이정훈 강동구청장은 ""코로나19 여파로 비대면 서비스 필요성이 커지고 있다""며 ""치매 고위험군 어르신들이 건강하게 이 시기를 이겨낼 수 있도록 적극적으로 지원해 나가겠다""고 말했다.      성동구는 위치추적 장치가 내장된 신발인 '꼬까신'을 치매를 앓고 있는 어르신들에게 전달했다. [사진 성동구]        코로나19로 치매 어르신 돌봄 길이 막히자 또 다른 아이디어를 낸 곳도 있다. 서울 성동구는 신발에 위치추적 장치를 탑재한 어르신용 신발 '꼬까신'을 만들었다. 성동구는 ""치매를 앓고 계신 어르신은 다른 물건은 놓고 밖에 나가더라도 신발은 신고 외출한다""는 데 착안해 만들었다. 어르신이 외출해 집을 찾지 못하고 배회하면 보호자와 치매안심센터·구청이 운영하는 스마트도시 통합운영센터에 긴급 신호가 간다.        관제센터에선 3066대 CCTV(폐쇄회로 TV)를 동원해 어르신 위치를 찾아낸다. 이탈을 확인하면 위치추적과 경찰관 출동이 바로 이뤄져 어르신이 안전하게 집으로 돌아올 수 있도록 한다. 성동구는 지난 3월 어르신 5명을 대상으로 시범 운영을 했고, 4월부터 20명의 어르신에게 '꼬까신'을 전달했다.        성동구는 사전 신청을 통해 신발은 어르신에게 무료로 제공하고, 1년까지 위치추적을 위한 통신비를 지원할 예정이다. 정원오 성동구청장은 ""꼬까신을 이용하는 어르신과 치매 환자 가족 모두에게 안심할 수 있는 '성동형 배회예방시스템'을 마련해 장애인 등 다양한 기관으로 확대해 운영할 수 있도록 하겠다""고 말했다.      김현예 기자"
821,"노년기에 인지기능은 정상인 상태에서 성격과 행동에 변화가 나타나 지속되는 경도 행동장애(MBI: mild behavioral impairment)가 알츠하이머 치매를 조기 진단할 수 있는 도구가 될 수 있다는 연구 결과가 나왔다.    경도 행동장애는 치매의 전 단계인 경도 인지장애(MCI: mild cognitive impairment)가 나타나기 이전에 발생할 수 있는 일시적이 아닌 성격과 행동 변화를 말한다.    캐나다 맥길(McGill)대학 노화연구센터 치매 연구실의 피로자 루시어 박사 연구팀은 경도 행동장애가 나타난 노인의 뇌 신경세포에서 치매의 원인으로 지목되고 있는 비정상 단백질인 베타 아밀로이드 플라크가 발견됐다는 연구 결과를 발표했다고 사이언스 데일리(Science Daily)가 8일 보도했다.     '노화-치매 중개 생물표지'(TRIAD: translational biomarkers in aging and dementia) 코호트 연구 참가 노인 약 100명을 대상으로 진행된 조사와 검사 자료를 분석한 결과 이 같은 사실이 확인됐다고 연구팀은 밝혔다.    이 노인들은 모두 인지기능은 정상이었지만 정도가 다른 경도 행동 장애가 있었다.    뇌 조영 결과 경도 행동장애와 그 중증도(severity)는 뇌 신경세포의 베타 아밀로이드 플라크와 강력한 연관이 있는 것으로 나타났다고 연구팀은 밝혔다.    경도 행동장애와 베타 아밀로이드 플라크 사이에 연관이 있다는 사실이 밝혀지기는 처음이다.    이는 경도 행동장애 체크리스트(MBI-C)가 증상이 나타나기 전에 치매를 조기 진단하는 데 유용한 도구가 될 수 있음을 보여주는 것이라고 연구팀은 설명했다.    경도 행동장애는 분노 폭발, 강박, 불안 등 평소와는 다른 성격과 행동이 일시적이 아니고 최소한 6개월 이상 지속되는 것으로 전문가들은 다음과 같은 5가지 유형의 체크리스트를 제시하고 있다.    ▲ 동기 감소 - 평소 즐기던 것에 흥미를 잃거나 무관심하다. (평소 귀여워하던 손자에 대한 관심이 사라지는 것이 한 예일 수 있다)    ▲ 감정 변화 - 우울, 불안, 분노 등이 자주 나타난다.    ▲ 사회성 위축 - 사회 적응성이 줄어들어 사람들과 어울리지 않고 타인에 대한 감정이입(공감)이 없어진다.    ▲ 충동 억제 결여 - 흥분, 강박 행동이 나타나며 도박에 빠질 수도 있다.    ▲ 지각과 사고의 변화 - 망상을 하고 환각에 빠지기도 한다.    이 연구 결과는 '알츠하이머병과 치매'(Alzheimer's and Dementia) 최신호에 발표됐다.치매[제작 이태호] 일러스트       "
822,"'집을 더럽힌다'며 중증 치매에 걸린 70대 아버지를 쇠사슬로 묶은 장남이 징역형의 집행유예를 선고받았습니다.서울북부지법 형사6단독 최상수 판사는 존속학대 혐의로 기소된 양 모(57) 씨에게 징역 1년에 집행유예 2년을 선고했다고 밝혔습니다.양 씨는 2015∼2017년 서울 노원구에 있는 자신의 집에서 치매에 걸린 아버지(73)가 소변줄이나 성인용 기저귀를 잡아떼어내고 오물로 집을 더럽힌다는 이유로 쇠사슬로 양 손목을 침대에 묶거나 자전거 열쇠 줄로 아버지의 목을 묶어놓는 등 학대한 혐의를 받습니다.최 판사는 ""학대의 정도가 중하고, 피해자가 느꼈을 고통이 상당했을 것으로 보인다""면서도 ""(양 씨가) 음주 습관이 있던 아버지로부터 제대로 보살핌을 받지 못하며 성장했고, 장남으로서 아버지를 부양하는 과정에서 빚어진 일인 점, 범행을 반성하는 태도 등을 고려했다""고 말했습니다.(사진=연합뉴스TV 제공, 연합뉴스)  유영규 기자"
823,"    성윤모 산업통상자원부 장관이 12일 국가 공인 참조표준데이터를 활용해 치매예방 솔루션을 개발한 산업지능화 선도 기업인 아이메디신을 방문해 뇌파 측정 기기를 시연해 보고 있다.  뇌파를 측정해 기존보다 더 적은 비용과 시간으로 치매 가능성을 조기 진단할 수 있는 기술이 이르면 올 상반기부터 상용화 된다. 이는 정부가 공인해 주는 표준 데이터인 '참조표준'을 활용해 산업화에 성공한 것으로 향후 '데이터 3법' 통과로 데이터 활용 신산업 개발이 더 활발해질 전망이다.   성윤모 산업통상자원부 장관은 12일 오후 서울 강남구에 있는 신생 벤처기업인 '아이메디신'을 방문해 뇌파 측정을 통한 치매 조기 진단 프로그램을 시연했다.   아이메디신은 서울대 간호대 교수이자 서울대 한국인뇌파데이터센터 센터장인 강승완 대표가 창업한 회사다. 뇌파를 분석해 치매 전 단계인 경도인지장애 가능성을 판별하는 '아이싱크브레인'을 개발했다. 지난해 10월 식약처 임상을 통과해 이르면 올 상반기 의료기기에 적용될 예정이다.   기존에는 경도인지장애를 판별하기 위해서는 MRI나 지필 시험 형태인 모카(MoCA) 테스트를 해야 했으나 비용과 시간이 오래걸렸다. 아이싱크브레인은 환자의 뇌파를 측정하고 정상인의 뇌파 빅데이터와 비교하는 방식으로 2~3만원의 저렴한 비용으로 검사가 가능하다. 임상 결과 경도인지장애 판별 정확도가 91%로 모카 테스트(81%)보다 높은 것으로 나타났다.   기존에도 뇌파를 통한 치매 측정 기술은 있었으나 건강한 사람의 뇌파 데이터를 활용할 수 없어서 기술 개발이 어려웠다. 하지만 산업부 국가기술표준원이 2011년부터 10년에 걸쳐 건강한 사람 1300여명의 뇌파 데이터를 축적했고, 2018년 아이메디신과 데이터 거래를 통해 이를 이전받아 신기술 개발이 가능했다.   성윤모 장관은 ""데이터 3법 통과로 가명정보 개념이 도입돼 개인정보 활용 범위가 확장됐다""며 ""향후 데이터, 인공지능을 활용한 신제품과 서비스 발굴을 적극 지원할 것""이라고 말했다.   "
824,"치매를 앓고 있는 70대 노모를 모시고 살던 50대 아들이 자택에서 숨진 채 발견됐다.시신은 부패가 꽤 진행된 상태지만 타살 혐의점과 극단적 선택의 정황은 없는 것으로 알려졌다.10일 경기 용인동부경찰서에 따르면 지난 5일 오후 5시30분께 용인시 처인구 포곡읍 소재 한 다세대주택에서 신모씨(54)가 숨진 채 발견됐다.치매를 앓고 있는 신씨의 어머니 박모씨(77)는 아들의 시신 곁에서 함께 생활했던 것으로 전해졌다.경찰은 신씨의 사인을 밝히기 위해 국립과학수사연구원에 부검을 의뢰했으며, 국과수로부터 ""외상 등 타살 혐의점과 극단적인 선택의 정황이 없다""는 1차 구두소견을 전달받았다고 말했다.신씨의 시신은 집주인에 의해 발견됐다. 집주인은 경찰에게 ""월세를 빠짐없이 잘 내다가 두달여 전부터 입금이 안돼 확인차 들렸다 이같이 목격했다""고 진술했다.신씨는 기초생활수급자 대상도 아니었고 어머니 박씨 외에 추가로 확인된 가족은 없는 것으로 조사됐다.신씨가 숨지고 집주인에 의해 발견되기 전까지 자택에 음식이 마련돼 있어 박씨가 틈틈히 음식을 섭취한 것으로 보인다고 경찰은 전했다.경찰 관계자는 ""현재 박씨는 용인시 소재 한 요양병원으로 옮겨 치료를 받도록 조치했다""고 말했다"
825,징역 1년에 집행유예 2년을 선고한 원심을 깨고 무죄      전화금융사기(보이스피싱) 조직의 인출책으로 활동한 60대 남성이 항소심 재판에서 치매라는 이유로 무죄를 선고받았다.   4일 법조계에 따르면 서울중앙지법 형사항소9부(최한돈 부장판사)는 사기방조 혐의로 기소된 A(68)씨에게 징역 1년에 집행유예 2년을 선고한 원심을 깨고 무죄를 선고했다.   A씨는 ‘대출을 해주겠다’는 보이스피싱 조직의 문자메시지를 받고 연락해 590만원 상당의 보이스피싱 범행 인출책으로 활동한 혐의로 재판에 넘겨졌다.   1심 재판부는 A씨의 혐의사실을 인정했지만 범행이 미수에 그친 점 등을 이유로 집행유예를 선고했다. 2심에서 검찰은 A씨의 혐의를 사기미수에서 사기방조로 변경했다.   A씨 측은 “A씨가 뇌경색으로 인한 경도인지장애(건망증) 내지 치매 증세를 갖고 있어 자신의 행위가 보이스피싱 범행에 가담하는 것인 줄 알지 못했다”고 항변했다. 실제로 A씨는 2005년 뇌경색 진단을 받았고 2016년 치매 검사에서는 인지장애 판정을 받은 것으로 조사됐다.   항소심 재판부는 A씨의 주장을 받아들여 무죄를 선고했다. 재판부는 “정상적인 인지능력을 갖춘 사람도 대출을 빙자한 보이스피싱 범행에 속아 본의 아니게 인출책 역할을 하게 되는 경우가 종종 있는 것이 현실”이라며 “피고인의 나이와 정신건강 상태에 비춰 볼 때 그가 자신의 행동이 범죄행위에 해당한다는 점을 의심하지 못한 것이 범행에 가담하거나 이를 용이하게 하려는 고의에 해당한다고 단정하기 어렵다”고 밝혔다.   김경호 기자
826,남해전통시장과 남해읍 일원에서 치매에 대한 부정적 인식 개선 위해남해군 치매안심센터는 22일 남해전통시장 등 남해읍 일원에서 치매에 대한 인식 개선을 위한 설맞이 캠페인을 폈다. 남해군 제공경남 남해군 치매안심센터는 지난 22일 설 명절을 맞아 남해전통시장을 비롯한 남해읍 일원에서 치매극복 캠페인을 폈다.이 캠페인은 치매에 대한 부정적 인식을 개선해 치매극복에 모든 군민이 동참하는 사회적 분위기를 만들려고 진행됐다.남해군 치매안심센터는 이 치매극복 캠페인을 통해 치매예방과 조기검진의 중요성을 널리 알렸다. 또 군민 모두가 치매에서 안전한 지역환경 조성에 동참해 줄 것을 호소했다.군 치매안심센터는 앞으로도 군민을 대상으로 하는 다양한 치매예방과 인식개선 프로그램을 추진하는 등 치매극복 활동에 더욱 힘쓸 방침이라고 밝혔다. 치매에 관한 문의는 남해군 치매안심센터(전화 055-860-8791). 이선규 기자
827,"경북에서 치매 등을 앓던 신종 코로나바이러스 감염증(코로나19) 확진자 1명이 숨졌다.코로나19 사망자가 경북 32명, 전국에는 130명으로 늘었다.25일 경북도에 따르면 이날 오전 9시26분 안동의료원에서 치료를 받던 79세 남성이 폐렴과 호흡부전으로 사망했다.올해 1월 경산 서요양병원에 입원한 이 남성은 지난 17일 열이 나기 시작했고 요양병원 전수검사로 지난 20일 코로나19에 감염된 사실이 확인돼 안동의료원으로 이송돼 치료를 받아왔다"
828,"25일 광주 북구 치매안심센터에서 센터 직원들이 관내 치매 노인과 고위험군 세대에 지원할 치매 안심 물품(치매 예방 교구와 건강 기능식품, 손소독제 등)을 기억보따리에 담고 있다. 북구 치매안심센터는 코로나19로 인한 센터 휴관 장기화로 노인들의 인지기능 향상에 도움을 주고자 700세대에 치매안심 기억보따리를 지원한다. (사진 = 광주 북구 제공) 2020.05.25."
829,"박건우(사진) 고려대학교 안암병원 신경과 교수가 이달 7일 대한치매학회 이사장으로 취임했다. 임기는 2년간이다. 박 신임 이사장은 고려대 안암병원 신경과 교수, 고려대학교 노인건강연구소장, 서울 강북구 치매안심센터장, 대한신경과학회 부이사장, 대한노인신경의학회 총무이사, 인지중재치료학회 이사장 등 왕성한 활동을 펼치고 있다.대한치매학회는 1996년 치매연구회로 태동한 후 2002년 학회로 창립했다. 디지털타임스 채널 구독 / 뉴스스탠드 구독디지털타임스 홈페이지 바로가기"
830,"혈압 변동성이 클수록 치매 위험이 높다는 연구결과가 발표됐다. 혈압을 낮추는 것 뿐 아니라 혈압을 일정하게 유지하는 것이 치매 예방에 중요하다. 서울대병원 강남센터 유정은·삼성서울병원 신동욱·숭실대 한경도 교수팀은 2005년부터 2012년까지 국가 건강검진을 3회 이상 받은 40세 이상 성인 784만4814명을 대상으로 2016년까지 치매 발생 여부를 추적 관찰했다. 연구팀은 대상자의 이완기 및 수축기 혈압 변동성 정도에 따라 네 그룹으로 나누고, 각 그룹의 치매 위험도를 측정했다. 이를 통해 혈압 변동성이 치매 발생에 미치는 영향을 분석했다.그 결과 혈압 변동성이 높을수록 치매 발생이 증가하는 것으로 나타났다. 특히 이완기와 수축기 혈압 변동성이 모두 높은 경우 치매 발생위험도가 18%까지 증가했다. 구체적으로 알츠하이머 치매 발생위험도는 17%, 혈관성 치매 발생위험도는 최대 22%까지 증가하는 것으로 나타났다.혈압 변동성이 크면 뇌혈류의 감소 및 뇌의 허혈성 변화에 영향을 미칠 수 있는데, 이는 알츠하이머 치매의 원인 물질로 알려진 아밀로이드의 생성 증가와 관련이 있다. 또한 혈압변동성으로 인한 혈류역학적 불안정성이 염증과 산화스트레스, 혈관 내피 기능장애 등을 유발함으로써 치매 발병에 관여했다는 것이 연구팀의 분석이다.현재 전 세계 치매 환자는 약 3500만명으로 파악되고 있다. 인구 고령화에 따라 치매 인구 2030년 두 배, 2050년에는 세 배에 이를 것으로 예상된다. 그러나 아직까지 치매의 완치법이 없어 위험 인자를 미리 관리해 예방하는 것이 강조되고 있다, 유정은 서울대병원 가정의학과 교수는 “이번 연구를 통해 일반 인구 집단에서 ‘혈압 변동성과 치매 위험도 증가의 연관성’에 관한 의미 있는 결과를 도출했다”며 “고령 등 치매 고위험군의 경우 안정적인 혈압 유지가 필요하고, 고혈압이 동반되어 있는 경우에는 혈압 변동성을 낮추기 위한 약제 선택을 필수적으로 고려해야 한다”고 말했다. 이번 연구 결과는 미국심장협회(American Heart Association)에서 발간하는 ‘Hypertension’ 저널 최근호에 게재됐다."
