,contents
543,"가공육, 전분, 단 간식에 치우친 식습관은 알츠하이머 치매 위험을 높일 수 있다는 연구 결과가 나왔다.    프랑스 보르도(Bordeaux)대학의 세실리아 사미에리 역학 교수 연구팀이 노인 627명(평균연령 78세)을 대상으로 식습관을 조사하고 이후 5년간 추적 관찰한 결과 이 같은 사실이 밝혀졌다고 헬스데이 뉴스(HealthDay News)가 23일 보도했다.    이 중 209명이 관찰 기간에 치매 진단을 받았다.    전체적으로 치매가 발생한 노인은 다른 노인에 비해 식습관이 확연히 달랐다고 연구팀은 밝혔다.    치매가 발생한 노인들의 식습관 특징은 소시지, 햄, 베이컨, 살라미 같은 가공육에 전분이 많은 감자와 과자 같은 당분이 많은 간식이 '핵심'을 이루었다고 연구팀은 설명했다.    식사량은 치매 위험 증가와 연관이 없었고 건강에 좋은 식품을 외면하는 것이 문제로 지적됐다.    치매가 나타나지 않은 노인들의 식단은 과일, 야채, 해산물, 닭고기 등 음식의 종류가 다양한 것이 특색이었다.    건강에 좋지 않은 음식을 얼마나 많이 먹느냐보다는 얼마나 자주 먹느냐가 치매 위험에 영향을 미치는 것으로 보인다고 연구팀은 설명했다.    이에 대해 미국 알츠하이머병 학회의 키스 파고 연구실장은 치매는 증상이 나타나기 오래전부터 시작되기 때문에 장기적인 식습관이 영향을 미칠 수 있다고 논평했다.    이 연구 결과는 미국 신경학회(American Academy of Neurology) 학술지 '신경학'(Neurology) 온라인판(4월 22일 자)에 실렸다.치매[제작 이태호] 일러스트      "
544,"헤르페스 바이러스가 알츠하이머 치매를 유발할 수 있다는 연구 결과가 나왔다./사진=클립아트코리아헤르페스 바이러스가 알츠하이머 치매를 유발할 수 있다는 연구 결과가 나왔다.미국 터프스대 연구팀은 헤르페스 바이러스와 알츠하이머 치매 간의 연관성을 연구하기 위해 뇌의 구성 요소와 조건을 반영한 3차원 모델을 만들어 연구를 진행했다. 연구팀은 뇌 모델 속 뉴런을 헤르페스 바이러스에 감염시킨 후 아밀로이드 플라크, 뉴런 손실도, 신경 염증, 신경 기능 저하 등 알츠하이머 치매와 관련된 현상을 관찰했다.연구 결과, 뇌 모델이 헤르페스 바이러스에 감염된 지 3일 후 베타 아밀로이드 단백질에 플라크가 생성되고, 플라크 생성과 관련된 일부 효소가 증가한 것으로 나타났다. 감염된 뇌 모델에 헤르페스 바이러스 치료제로 사용되는 '발라시클로버(Valacyclovir)'를 투약했더니, 알츠하이머 치매에서 나타나는 특징들이 완화됐다.헤르페스 바이러스(Herpes Simplex Virus, HSV)란 급성 염증성 피부질환을 유발하는 바이러스를 말한다. 입 주위에 병변을 만드는 HSV 1형과 성기 주위 병변을 만드는 HSV 2형이 대표적이다. 헤르페스는 전 세계 인구 60% 이상이 보유하고 있을 정도로 매우 흔하다. 한번 감염되면 치료 후에도 바이러스가 신경세포 속에 계속 남아있다가 면역력이 약해졌을 때 재발한다연구를 주도한 다나 케언즈 박사는 ""기존 연구들은 뉴런의 유전자 돌연변이를 사용해 연구하는 것에 의존했다""며 ""우리의 연구는 정상적인 뉴런을 사용했고, 헤르페스 바이러스만으로도 알츠하이머 변형을 유도하기에 충분했다는 것을 보여줬다""고 말했다.이번 연구는 '사이언스 어드벤스(Science Advances)'에 최근 게재됐다./ 전혜영 헬스조선 기자"
545,"처브라이프생명은 중증 치매 진단 시 진단금과 매월 간병비를 동시에 보장하는 '처브(Chubb) 치매보험 깜빡 무배당'을 출시했다고 19일 밝혔다.이 상품은 가족들의 집중 케어가 필요한 중증도 치매에 보장을 집중한 상품으로 중증치매 진단 시 진단금과 매월 간병 생활 자금 지급을 통해 가족생활에 부담을 덜어준다.가입금액 1000만원 기준, 중증치매상태로 진단 시 진단자금 2000만원이 일시금으로 지급되고 매월 100만원씩 간병생활자금으로 36개월 간 총 3600만원이 추가 지급된다. 단 중등도치매로 진단돼 진단급여금이 지급된 후에 중증치매상태로 최종 진단시에는 기 지급한 중등도 치매 진단금을 뺀 차액을 지급한다. 중등도, 중증치매 상태는 치매관련 전문의가 실시하는 인지기능(AI) 및 사회기능정도를 측정하는 CDR척도 검사 점수에 따라 나눠진다.이 상품은 표준형과 납입 기간 중 해지환급금이 없는 대신 보험료 부담을 줄인 해지환급금 미지급형 중 선택이 가능하다. 주계약 가입금액 1000만원 기준 85세 만기 10년납 표준형의 경우 40세 남성 보험료는 월 4만9800원이며 해지환급금 미지급형의 경우 월 4만3700원이다. 납입기간은 10년, 15년, 20년납으로 다양하며 가입나이는 30세에서 최대 65세까지이다.박윤호기자"
546,"처브라이프생명이 중증 치매 진단 시 진단금과 매월 간병생활자금을 동시 보장하는 ‘Chubb 치매보험 ‘깜빡’ 무배당‘을 출시했다.이 상품은 중증 치매를 집중 보장하는 상품으로 중증 치매 진단 시 진단금과 매월 간병비를 지급해 가족들의 부담을 덜어준다.가입금액 1,000만원 기준, ‘중증 치매 상태’로 진단 시 진단자금 2,000만원이 일시금으로 지급되고, 매월 100만원씩 간병생활자금으로 36개월 간 총 3,600만원이 추가 지급된다.또 치매보장개시일 이후 ‘중등도 치매상태’로 최종 진단이 확정됐을 경우, 다음회 이후의 보험료 납입면제 혜택을 받을 수 있다.처브라이프 상품개발팀장은 “치매는 본인과 가족 모두에게 힘든 질병""이라며,""중등도 이상의 치매 보장에 집중해 가족들에게 지원이 꼭 필요한 시기에 실질적인 도움을 드려 부담을 덜어주는 것에 집중했다”고 말했다.강미선기자"
547,"치매를 앓고 있다가 코로나19 확진 판정을 받았던 인천 지역 최고령 환자인 93세 여성이 약 한달 만에 무사히 퇴원했다. 가천대 길병원은 지역 내 최고령 코로나19 환자로, 전혀 거동이 불가능했던 김모씨(93)가 3월 31일 퇴원했다고 밝혔다. 수년 전부터 치매를 앓던 김씨는 평소 살고 있던 안동에서 코로나19로 확진됐다. 현지에서 입원 치료를 시행했지만 거동이 불가능한 중증 치매로 인해 치료가 쉽지 않은 환자였다. 또 현지의 중증환자를 치료할 수 있는 병원이 부족함에 따라, 지난 3월 9일 국가지정병상이 있는 가천대 길병원으로 이송돼 음압병동에서 치료를 받아왔었다. 특히 김씨는 현지에서 코로나19 확진 당시 산소포화도 저하 판정까지 받았었다. 높은 발열로 인한 호흡곤란에 따른 저산소증이 동반됐었고 현지 의료기관에서 산소 치료를 시행했음에도 정상적으로 회복되지 않아 기관삽관 등의 치료가 필요했었다. 긴급으로 가천대 길병원 음압병동으로 옮겨진 김씨는 고령임이 고려돼 기관삽관 없이 치료가 이뤄졌고, 다행히도 산소 포화도가 호전됐었다. 하지만 지속되는 섬망과 고령에 따른 낮은 면역력과 체력은 치료의 큰 걸림돌로 작용했다. 추가로 요로감염증까지 발견돼 코로나19와 더불어 항생제 치료가 병행해야 했다. 거동이 전혀 불가능한 환자이고 고령의 치매 환자라는 특성으로 한번 치료를 시도할 때 여러 가지의 치료를 병행해야 해서, 의료진들의 지속적인 헌신이 아니었으면 치료가 어려운 환자였다. 의료진들의 헌신 덕분에 환자의 상태는 차츰 좋아졌고, 요로감염증도 완치됐다. 산소포화도도 정상으로 회복됐다. 환자는 이후 코로나19 검사에서 지속적인 양성상태로 입원 치료를 받던 중 지난 3월 30일과 3월 31일 두 차례의 코로나19 검사에 모두 음성 판정을 받았다. 의료진은 김씨의 상태를 감안해 최대한 빠르게 가족들의 품으로 돌려보내기로 결정하고, 퇴원을 진행했다.담당 교수인 감염내과 시혜진 교수는 ""90세 이상 초고령의 치매 환자였고, 산소 포화도 저하 및 낮은 치료 순응도로 인해, 처음 입원 당시 치료가 매우 어려운 환자로 분류됐다. 섬망과 요로 감염 등이 동반돼 어려움이 있었으나 다행히 잘 회복돼 산소투여 없이도 건강히 퇴원하게 됐다""며 ""너무 늦지 않은 시기에 전원이 진행됐고, 국가지정병상 의료진들의 수십일 간의 노력이 헛되지 않았던 것 같아 기쁘다""고 말했다. 이어 그는 ""전국 모든 의료인분들이 매우 힘들게 노력하고 있다. 앞으로도 추가 확진자 감소와 완치자 증가가 있기를 기대한다""고 덧붙였다. 한편, 가천대 길병원은 만성신부전으로 25년간 신장투석을 받다가 코로나19 확진에 걸려 중증 폐렴 증상을 보이던 50대 남성에게도 헌신적인 치료를 제공해 3월 24일 퇴원시킨 바 있다. 이 남성은 기저질환으로 만성신부전을 앓고 중증 폐렴이 발생해 최대 사망률 100배에 달할 정도로 위급한 상황이었지만 완치돼, 기저질환을 가진 중증환자도 치료될 수 있다는 희망을 전한 바 있다.  장종호 기자"
548,"저용량 아스피린을 먹는다고 해서, 치매를 예방하는데 도움이 되지 않는다는 연구결과가 나왔습니다.저용량 아스피린은 염증을 막아주기 때문에, 뇌혈관에 작은 혈전이 생기는걸 막아서, 심장과 뇌 건강에 도움이 된다는 일부 연구결과가 있었습니다.그러나 호주 모나쉬 대학 연구팀은 노인 만 9천 114명을 대상으로 평균 4.7년 동안 임상시험을 벌인 결과, 치매 예방 효과는 없는 것으로 나타났다고 밝혔습니다.임상시험 참가자들은 대부분 70살 이상이었고, 처음엔 치매나 심장병 증상이 없었습니다.연구팀은 이 사람들을 두 그룹으로 나워서, 한 그룹엔 저용량 아스피린을, 다른 그룹엔 가짜약을 매일 먹도록 했습니다.임상시험이 진행되는 동안 575명이 알츠하이머와 여러 형태의 치매 진단을 받았는데, 두 그룹 사이에 발생률에 차이가 없는 것으로 나타났습니다.또 시간이 가면서 인지기능이 떨어지는 속도에도 차이가 없었습니다.연구팀은 5년으로는 아스피린의 치매 예방 효과를 평가하기엔 시간이 너무 짧을 수 있다면서, 임상시험 참가자들을 앞으로도 계속 지켜볼 것이라고 밝혔습니다.이 연구결과는 미국 신경학회 학술지 '신경학' 온라인판 3월 25일 자에 실렸습니다.(사진=게티이미지코리아) 김범주 기자"
549,"충북 증평군보건소는 신종코로나바이러스 감염증(코로나19) 확산으로 치매안심센터가 휴관, 돌봄 공백이 생긴 치매 노인들에게 도시락을 제공한다고 10일 밝혔다.[진천군 제공. 재판매 및 DB 금지]    거동이 불편한 65세 이상 치매 노인 20여명이 지원 대상이다.    증평군보건소는 매주 3차례 밥과 반찬, 국으로 구성된 도시락을 치매 노인들에게 제공하고, 건강 상태도 살핀다.    도시락은 노인들의 영양을 고려해 짠 식단에 따라 자원봉사자들이 마련한다.    연영미 증평군보건소장은 ""코로나19 장기화로 돌봄이 필요한 치매 노인들이 영양 결핍이나 건강이 악화할 우려가 있다""며 ""코로나19가 종식될 때까지 자원봉사자들이 정성껏 만든 도시락을 배달하고 건강도 살피겠다""고 말했다.    "
550,"[헤럴드경제=구본혁 기자] 머릿속 치매 원인물질을 초기 단계부터 정밀 관찰할 수 있는 새로운 치매 플랫폼 기술이 국내 연구진에 의해 개발됐다.한국과학기술연구원(KIST) 치매DTC융합연구단 김윤경·임성수 박사 연구팀은 치매 유발 원인으로 알려진 타우 단백질의 응집을 초기 단계부터 관찰할 수 있는 동물 모델을 개발했다고 21일 밝혔다. 이 신규 플랫폼을 활용하면 치료제 개발 연구를 가속화하고, 새로운 치매 기전을 규명할 수 있을 것으로 기대된다.가장 흔한 퇴행성 뇌 질환인 알츠하이머성 치매는 뇌 속 베타-아밀로이드 단백질이나 타우 단백질이 응집되는 것이 주요 원인으로 여겨지고 있다. 베타-아밀로이드 응집은 뇌 기능이 손상되는 데에 길게는 10년 이상이 걸리기도 하며 심지어 병변이 나타나지 않는 때도 있다.타우 단백질이 응집되기 시작하면 단백질이 뭉친 형태인 올리고머 형태가 되는데, 이는 신경세포 독성을 일으키고 알츠하이머성 치매를 비롯한 다양한 퇴행성 뇌 질환을 전이시키는 매개체로 작용한다. 이에 타우 올리고머를 표적으로 한 치매 치료제 개발이 화두에 오르고 있지만, 신경세포 내 과량으로 존재하는 정상 타우 단백질로부터 응집 초기에 소량으로 존재하는 타우 올리고머를 구분해낼 실험 방법은 없었다.연구팀은 세포에서 타우 올리고머의 형성을 관찰할 수 있는 플랫폼인 ‘타우-BiFC 플랫폼’을 확립하고 이를 동물 모델로 확장한 ‘타우-BiFC 생쥐 모델’을 개발했다. 이 플랫폼은 신경세포 내에서 타우 단백질이 응집해 올리고머가 형성되면 형광이 켜지는 시스템으로 타우 응집 초기 올리고머 단계부터 정량적으로 관찰할 수 있다는 장점이 있다.연구팀이 개발한 ‘타우-BiFC 생쥐’를 통해 단계별로 정량적인 모니터링이 가능했다. 생쥐가 어린 나이일 때 타우 올리고머가 생성돼도 세포 자체적으로 분해·제거하는 시스템이 가동되지만, 생쥐가 나이가 들수록 그 기능이 떨어져 타우의 응집이 가속되고 신경이 퇴화하는 특성을 보이는 것을 관찰할 수 있었다.김윤경 박사는 “이번 기술 개발로 외국에서 개발된 생쥐 모델에 의존하던 기존 치매 연구를 탈피할 수 있을 것”이라며 “신경세포 독성 및 전이성을 보이는 타우 응집체의 형성을 파악하고 관찰하는 연구는 알츠하이머성 치매를 포함한 타우 병증 치료제 개발에 있어 중요한 시작점이라 할 수 있다”고 말했다.이번 연구 성과는 신경과학 분야 국제학술지 ‘Progress in Neurobiology’ 최신호에 게재됐다"
551, 서울 성동구 위치추적 꼬까신. (사진=성동구 제공) 2020.04.27
552," 안산시(시장 윤화섭) 단원보건소 치매안심센터는 어버이날을 맞아 센터 등록 치매 환자 중 독거노인 맞춤형 사례관리 대상자와 쉼터·가족 프로그램 참여자에게 ‘카네이션 바구니와 치매 건강꾸러미’를 전달했다고 8일 밝혔다.단원보건소 치매안심센터는 코로나바이러스감염증-19 확산 방지와 감염 예방을 위해 센터 휴관이 장기화됨에 따라 치매 노인의 돌봄 공백을 최소화하기 위해 치매 건강꾸러미를 마련했다. 어버이날을 맞아 특별히 마련된 카네이션 바구니와 함께 전날부터 전달된 치매 건강꾸러미는 코로나19와 황사 예방에 도움이 되는 면 마스크, 물티슈 등 개인위생 물품으로 구성됐다.안산시 단원보건소는 어버이날 맞아 치매 건강꾸러미를 전달했다. [안산시 제공]단원보건소 치매안심센터 전문 인력들은 생활 속 거리두기 예방수칙 안내문과 ‘어버이날’ 기념 감사와 존경의 마음을 담은 편지도 함께 준비해 70여 가구에 방문, 현관문 앞 비대면 배달 등을 통해 전달했다.단원보건소 치매안심센터는 등록된 치매 노인을 대상으로 주기적 안부 전화와 상담을 통해 코로나19 예방수칙 안내, 투약 관리와 일상생활 안전관리는 물론 치매 노인들 불안감 해소와 심리적 안정에 주력하고 있다.단원보건소 관계자는 “코로나19 사태로 심리적 불안이 가중되는 상황에서 정상적인 생활을 하게 될 때까지 지속적으로 서비스를 제공해 치매 노인들의 돌봄 공백을 최소화하기 위해 최선을 다하겠다”고 했다"
553," ABL생명은 사망과 암, 중증치매를 동시 보장하는 'ABL암치매걱정없는종신보험'을 1일 출시했다고 밝혔다.사망보장을 제공하는 종신보험이지만 암(소액암 제외) 또는 중증치매 진단시 보험가입금액의 100%를 선지급금으로 받을 수 있다. 주계약보험료는 갱신없이 처음 계약 보험료 그대로 납입완료시점까지 유지된다.암 또는 중증치매로 진단받아 보험가입금액의 100%를 선지급 받고, 사망했을 때 사망보험금으로 보험가입금액의 20%를 받는다.또 특약을 선택하면 경도치매에서 중등도치매까지 치매 단계별 진단자금, 중등도치매에서 중증치매까지 치매 단계별 간병 생활자금, 암·뇌출혈·급성심근경색증·말기신부전증 등 중대질병 진단자금, 자녀 관련 자금 보장을 추가로 설계할 수 있다.고액계약의 경우 할인혜택이 주어진다. 보험가입금액 1억원 이상 2억원 미만 계약은 주계약 보험료의 3%를, 2억원은 4%를 할인 받는다. 가입나이는 15세부터 최대 68세까지이며, 보험가입금액은 3000만원에서 2억원까지다.30세 남성과 여성이 주계약 보험가입금액 1억원, 20년납으로 해지환급금 미지급형에 가입하면 월납입보험료는 각각 16만8780원과 15만8110원이다.은재경 ABL생명 상품&마케팅실장은 ""생존율이 높고 투병생활이 긴 암과 중증치매로 인한 금전적, 정신적 피해가 나날이 커짐에 따라 사망과 생존 위험을 동시에 보장할 수 있는 상품을 출시하게 됐다""고 말했다.오현길 기자"
554,"ABL생명 모델이 (무)ABL암치매걱정없는종신보험 출시 소식을 전하고 있다.ⓒABL생명ABL생명은 1일 사망과 암·중증치매를 동시 보장하는 (무)ABL암치매걱정없는종신보험(해지환급금 미지급형)을 출시했다고 밝혔다.이 상품은 사망보장을 제공하는 종신보험이지만 암 또는 중증치매 진단 시 보험가입금액의 100%를 선지급금으로 받을 수 있어 살아있는 동안 질병 위험까지 보장한다. 주계약보험료는 갱신 없이 처음 계약 보험료 그대로 납입완료시점까지 유지된다.암 또는 중증치매로 진단받아 보험가입금액의 100%를 선지급 받고 이후 사망했을 때 사망보험금으로 보험가입금액의 20%를 추가적으로 받는다. 다양한 선택특약을 부가해 경도치매에서 중등도치매까지 치매 단계별 진단자금, 중등도치매에서 중증치매까지 치매 단계별 간병 생활자금, 암·뇌출혈·급성심근경색증·말기신부전증 등 중대질병 진단자금, 자녀 관련 자금에 대한 보장을 추가로 설계할 수 있다.고액계약의 경우 할인혜택이 주어진다. 보험가입금액 1억원 이상 2억원 미만 계약은 주계약 보험료의 3%를, 2억원은 4%를 할인 받는다. 가입나이는 15세부터 최대 68세까지며, 보험가입금액은 3000만원에서 2억원까지다.해지환급금 미지급형을 선택하면 보험료 납입기간 중 계약 해지시 해지환급금이 지급되지 않는 대신 기본형보다 저렴한 보험료로 가입할 수 있다. 30세 남성과 여성이 주계약 보험가입금액 1억원, 20년납으로 해지환급금 미지급형에 가입하면 월납입보험료는 각각 16만8780원과 15만8110원으로 기본형 대비 최대 26.6% 저렴하다.은재경 ABL생명 상품&마케팅실장은 ""생존율이 높고 투병생활이 긴 암과 중증치매로 인한 금전적, 정신적 피해가 나날이 커짐에 따라 사망과 생존 위험을 동시에 보장할 수 있는 상품을 출시하게 됐다""고 말했다.데일리안 부광우 기자 "
555,"김윤덕 더불어민주당 전주갑 국회의원 예비후보는 24일 자신의 SNS를 통해 “전주 평화1동에 조성된 ‘치매안심마을’을 더욱 확대하겠다”면서 “어르신을 위한 통합 돌봄서비스를 확대하기 위해 ‘치매관리법’도 개정하겠다”고 공약했다.최근 우리나라는 고령화와 함께 치매를 앓는 환자들의 비율도 높아져 가고 있다. 보건복지부 집계 결과 2009년 약 21만7000여명이 치매치료를 받았으나 2013년에 약 40만5000명, 2018년에는 약 75만여명이 치료를 받은 것으로 조사됐다.치매에 걸리면 본인의 인격이 무너지고 생명의 위협까지 받을 수 있다. 또 가정에 치매환자가 생기면 온 가족 모두가 고통을 감내해야 하는 무서운 질환이어서 문재인 정부는 ‘치매국가책임제’를 제시한 바 있다.김윤덕 후보는 “치매 초기단계에 방치되는 경우가 없도록 치매관리 서비스의 접근성을 더욱 높여 나가겠다”면서 “치매환자를 지역사회가 함께 돌보는 시스템의 정착이 필요함에 따라 ‘치매안심마을’을 더욱 확대할 필요성이 많아졌다”고 말했다. 그러면서 “어르신들이 보다 쉽게 이용할 수 있도록 ‘찾아가는 치매예방교실’도 확대하겠다”며 “치매는 지역사회가 함께해야 할 문제로 ‘치매 친화적 환경’ 조성을 목표로 행복한 전주를 반드시 만들겠다”고 약속했다"
556,"고려대 안암병원 신경과 박건우 교수(사진)가 최근 대한치매학회 이사장으로 선출돼 지난 7일 취임했다. 임기는 2년 간이다.박건우 신임 이사장은 고려대 안암병원 신경과 교수, 고려대학교 노인건강연구소장, 서울 강북구 치매안심센터장, 대한신경과학회 부이사장, 대한노인신경의학회 총무이사, 인지중재치료학회 이사장 등 왕성한 활동을 펼치고 있다.박건우 교수는 “학회가 20주년을 맞이하는 중요한 시점에 중책을 맡게됐다”며 “치매에 대한 국가 정책의 브레인 뱅크로써의 역할을 수행하고, 국민과 함께 동행하는 학회가 되도록 노력할 것”이라고 포부를 밝혔다.한편, 대한치매학회는 1996년 치매연구회로 태동한 후 2002년 학회로 창립했다. 지난 20여년동안 다양한 연구 학술 활동을 통해 국내 치매분야 발전에 이바지해왔으며, 치매환자와 가족을 위한 사회적활동 및 치매의 올바른 이해를 위한 대국민강좌를 진행하는 등 다각도의 노력을 펼치고 있다.이순용 "
