,contents
283," 윤미향 전 정의기억연대 이사장에 대한 2차 기자회견 이후 배후가 있다는 의혹을 받은데 대해 이용수 할머니가 “누구에게 물을 필요도 없고 거들어 달라 한 것도 없다”며 배후설을 단호하게 일축했다. 또 윤미향 당선인에 대해서도 “이런 사람을 어떻게 국회의원을 시키냐”며 죄를 받아야 한다고 재차 목소리를 높였다.일본군 위안부 피해자 이용수(92) 할머니가 지난 25일 오후 대구 수성구 만촌동 인터불고 호텔에서 기자회견을 하고 있다 (사진=연합뉴스)이 할머니는 28일 CBS 라디오 ‘김현정의 뉴스쇼’에 출연, 김어준 등이 배후설을 제기한 것과 관련, “백 번, 천 번 얘기해도 저 혼자밖에 없다”며 “제가 바보입니까. 제가 치매입니까”라고 되물었다. 그는 “분명히 전 치매가 아니며 누구도 거드는 사람이 없었다”고 덧붙였다.이 할머니는 “수양딸 한 사람이 제가 꾸불꾸불하게 쓴 글을 똑바로 다시 써줬다”며 “제가 생각하고 스스로 한 것이라 떳떳하다”고 했다. 이어 “제 일인데 제가 해야지 누구한테 물을 필요도 없고 거들어달라고 하는 것도 없이 전부 제가 했다”고 강조했다.기자회견장에 최용상 가자인권평화당 대표가 동석한 것에 대해서는 “꼬투리 잡을 게 없어서 그걸 잡더라”며 “그 사람은 기자를 데리고 오고 한 것뿐”이라고 말했다.윤미향 당선인에 대해서는 “재주는 곰이 부리고 돈은 다른 사람이 가져 간다고 정신대 할머니들과 위안부 피해자들을 섞어서 우리를 끌고 다니면서 돈은 정신대대책협의회의 윤미향 대표가 다 가져갔다”며 “이거 너무 분하다”고 했다.국회 입성에 대해서도 “30년이나 같이 했는데 하루 아침에 배신하고 자기가 국회로 가고 싶다고 사리사욕을 챙겨서 마음대로 했다”며 “그렇지 않다고 믿은 사람이 그런 행동을 하니까 사람은 아니고 사람으로서는 그러지 못한다”고 비판했다.이 할머니는 “지금까지 이렇게 자꾸 당하는 거는 먼저 간 할머니한테 제가 가서 할 말이 없다”며 “이렇게라도 제가 해결하고 왔습니다 하기 위해서는 제가 끝까지 전심전력을 다하겠다”고 말했다.또 윤 당선인에 대해서는 “죄를 받아야지 이런 사람을 국회의원을 어떻게 시키는가”라며 “이 나라는 법도 없는가”라고 되물었다.이정훈 "
284,"아내 살해 치매노인에 ‘치료적 사법’피고인 처벌 아닌 문제해결 지향병원 치료 조건으로 징역 3년 집행유예 5년형10일 오전 경기도 고양시 한 병원에서 환자복을 입은 이아무개(67)씨가 자신의 항소심 선고 기일 재판부를 마주하고 있다. 알츠하이머 환자인 이씨는 국내 최초로 치료적 사법을 적용 받아 병원 치료를 조건으로 징역형의 집행유예형을 선고 받았다. 법원 기자단.아내 살해 혐의로 1심에서 실형을 선고받은 치매 노인이 병원 치료 등을 전제로 2심에서 집행유예형으로 감형됐다. 국내에서 치매 환자에게 처벌이 아닌 실질적 문제해결을 지향하는 ‘치료적 사법’이 적용된 첫 판결이다.서울고법 형사1부(재판장 정준영)는 10일 살인 혐의로 재판에 넘겨진 이아무개(67)씨가 치매 치료를 받고 있는 경기 고양의 한 병원에서 항소심 선고 기일을 열었다. 재판부는 법정이 아닌 피고인이 입원 중인 병원을 직접 찾았다. 병원 복도 끝에 있는 주간 정신건강센터는 ‘일일 법정’으로 바뀌어 재판부석과 검사석, 변호인석이 간이 책상으로 마련됐다. 휠체어를 타고 들어온 이씨는 1~2미터 짧은 거리를 두고 재판장을 마주했지만 초점을 잃은 표정으로 고개를 떨궜다. 이씨는 ‘여기가 어디냐’는 아들의 질문에 “법원…”이라고 답하며 “현실에 수긍하겠다”는 짧은 한마디만 남겼다. 이씨의 아들과 병원장은 재판부에 이씨의 상태를 설명했고, 재판부는 검찰과 변호인 의견을 들은 뒤 선고를 했다. 재판부는 이씨에게 징역 3년과 집행유예 5년을 선고하며 이씨의 주거지를 병원으로 한정하고, 집행유예 기간 보호관찰과 치료를 받도록 했다. 재판부는 “이씨에게 징역형을 선고하는 것보다는 징역형의 집행유예 판결을 하면서 치료를 받도록 하는 것이 모든 국민이 인간으로서의 존엄과 가치를 가진다고 선언한 헌법과 조화를 이루는 결정으로 판단된다”고 밝혔다. 8년 전부터 치매를 앓은 이씨는 2018년 12월 아내를 때리고 흉기로 찔러 살해한 혐의로 기소됐다. 1심에서는 이씨 쪽의 심신상실 주장이 받아들여지지 않아 징역 5년을 선고받았다. 그러나 항소심 재판부는 “이씨는 구치소 수감 중 면회 온 딸에게 ‘엄마(사망한 아내)와 왜 동행하지 않았느냐’고 말하는 등 더욱 악화된 중증 알츠하이머 증상을 보인다. 검사는 치매환자 치료를 위한 감호 시설이 없어 치료감호청구를 하기 어렵다고 했지만 그런 시설이 갖춰져 있지 않다는 이유로 치료를 진행하기 어려운 교정시설에서 징역형을 집행하는 것은 현재나 미래의 대한민국을 위해 정당하다는 평가를 받기 어렵다”고 감형 이유를 밝혔다.선고를 한 정준영 부장판사는 이재용 삼성전자 부회장의 파기환송심 재판장이기도 하다. 정 부장판사는 삼성에 준법감시위원회를 꾸리도록 하고, 이 부회장의 형량을 정하는데 이를 반영하겠다고 밝혀 논란을 빚고 있다. 고양/장예지 기자"
285,자식들에게 경제적 부담을 주지 않기 위해 치매를 앓던 아내를 살해한 60대에게 실형이 선고됐습니다. 청주지방법원은 지난 2월 자신의 집에서 아내를 살해한 혐의로 기소된 63살 A 씨에게 징역 4년을 선고했습니다. 재판부는 수년간 아내를 간호하면서도 수입이 없어 경제적 어려움을 겪은 A 씨가 자식들의 고통을 덜어주려는 목적으로 범행을 저지른 점을 고려했다고 설명했습니다.송국회 기자 
286,"(사진=자료사진)자식들에게 부담이 된다는 이유로 치매를 앓고 있는 아내를 살해한 60대에게 실형이 선고됐다.청주지방법원 형사11부(조형우 부장판사)는 살인 혐의로 구속기소 된 A(63)씨에게 징역 4년을 선고했다고 21일 밝혔다.재판부는 ""유가족들이 처벌을 원하지 않고 있으나, 피해를 복구할 수 없는 중대한 범죄인 점을 고려하면 실형을 선고하지 않을 수 없다""고 설명했다.A씨는 지난 2월 2일 오호 6시쯤 청주시 서원구 자신의 집에서 잠이든 아내(61)를 질식시켜 숨지게 한 혐의로 재판에 넘겨졌다.A씨는 경찰 조사에서 아내의 치매 증상이 악화돼 자식들에게 부담을 주지 않기 위해 이 같은 짓을 저질렀다는 취지로 진술했다."
287,"자식들에게 부담을 주지 않기 위해 치매에 걸린 아내를 살해한 60대에게 실형이 선고됐다.재판 선고(PG)[제작 최자윤] 일러스트    청주지법 형사11부(조형우 부장판사)는 21일 살인 혐의로 구속기소 된 A(63)씨에게 징역 4년을 선고했다고 밝혔다.    A씨는 지난 2월 2일 오후 6시께 청주시 서원구에 있는 자신의 집 거실에서 수면제를 먹고 잠든 아내(61)를 질식 시켜 숨지게 한 혐의로 재판에 넘겨졌다.    A씨는 경찰 조사에서 아내의 치매 증상이 악화하고, 생활고가 심화하자 자식들에게 부담을 더는 주지 않으려고 이 같은 범행을 저질렀다는 취지로 진술했다.    A씨는 범행 후 자신도 극단적 선택을 시도했던 것으로 전해졌다.    재판부는 판결문에서 ""범행 동기에 참작할 부분이 있고 유가족들이 처벌을 원하지 않고 있으나, 살인죄는 인간의 생명이라는 대체 불가능한 존귀한 가치를 침해하는 것으로 어떠한 방법으로도 피해를 복구할 수 없는 중대한 범죄인 점을 고려하면 실형을 선고하지 않을 수 없다""고 지적했다.   "
288,"서울 동대문구(구청장 유덕열)는 치매안심센터에서 첨단 ICT 기기를 도입해 치매 예방 프로그램을 진행한다고 3일 밝혔다. 동대문구치매안심센터는 최근 로봇 치료를 할수 있는 프로그램 ‘피오’를 도입했다. 이 피오는 앵무새 모양의 로봇을 성장시키는 과정을 통해 다양한 인지 중재 치료 활동(정서자극, 운동치료, 미술치료, 언어치료 등)을 제공하는 통합적 프로그램이다. 동대문구치매안심센터와 기술지원을 한 ㈜와이닷츠가 2019년 6월부터 3개월 동안 로봇 치료 프로그램에 참여한 어르신 12명 및 대조군 9명을 대상으로 효과를 연구한 결과, 프로그램에 참여한 어르신들이 자존감 향상, 우울감 감소, 언어 능력 향상 등 긍정적인 변화를 겪은 것으로 나타났다. 이에 동대문구치매안심센터는 효과성 검증을 토대로 스마트 프로그램을 확대하기 위해 가상현실(VR) 일상생활동작 훈련 프로그램도 도입할 예정이다.가상현실(VR) 일상생활동작 훈련 프로그램은 현실과 비슷한 상황을 조성해 안전한 환경과 조건에서 인지훈련, 미니게임, 일상생활동작을 체험해 보는 프로그램이다. 특히 치매 환자에게 저하된 일상생활동작 능력인 시장보기, 요리하기, 빨래하기 등의 학습을 진행하여 환자의 일상생활 복귀를 도울 계획이다.이밖에도 ▷태블릿PC를 활용한 전산화 인지재활 훈련 CoTras-G ▷가상현실 운동프로그램 닌텐도 Wii fit ▷인지능력 강화 훈련을 위한 인공지능 AI 스피커(NUGU) 등 최첨단 스마트 장비를 갖추고, 전담 치료사를 배치해 시각 청각 생체피드백 신체 활동 등을 해 대상자의 능동적 참여를 유도하고 성취감도 높여 나간다. 유덕열 동대문구청장은 “치매 환자 및 위험군에 속하는 어르신이 치매 예방 활동을 더욱 즐겁고 신선한 방법으로 할 수 있도록 최첨단 ICT 기기를 구축하게 됐다”며 “앞으로도 다양한 콘텐츠를 도입해 인지재활 치료 효과를 높여 나가겠다”고 밝혔다."
289,"치매는 생활습관을 통한 예방은 물론, 조기 발견해 치료하면 경과를 변화시키고 환자와 보호자의 삶의 질 개선에도 큰 도움을 줄 수 있다(사진=클립아트코리아).어버이날이 되면 그동안 소홀했던 부모님의 건강을 살피게 된다. 이때 부모님이 기억력이나 행동 등에서 평소와 다른 모습을 보이면 혹시 치매는 아닌지 가슴이 덜컹 내려앉는다.하지만 치매는 이렇게 하루 만에 알아차려서 해결될 문제가 아니다. 어느 날 갑자기 찾아오는 것이 아니라 다양한 원인에 의해 촉발된 노화가 점점 진행되면서 뇌기능에까지 장애를 일으키는 것이기 때문이다.따라서 어버이날 하루가 아니라 평소 부모님을 꾸준히 관찰하는 것이 중요하다. 치매는 완치가 불가능하지만 그 단서를 조기에 발견해 치료를 시작하면 치매로 진행되는 것을 막을 수 있으며 설령 치매로 진단받았어도 꾸준히 치료하면 상태가 더 나빠지지 않게 할 수 있다.■기억력저하 점점 진행되는 ‘알츠하이머병 치매’치매는 원인에 따라 종류도 다양하다. 알츠하이머병 치매와 혈관성치매가 치매의 80~90%를 차지한다.우선 알츠하이머병은 뇌의 특정부위(측두엽, 두정엽 부위)에 신경독성을 가진 베타-아밀로이드 단백질이 축적되면서 뇌세포가 죽고 뇌세포 간의 신경망들이 끊어지면서 나타난다고 알려졌다.알츠하이머병 치매의 가장 특징적인 증상은 기억력저하다. 초기에는 최근에 있던 일들을 기억하지 못하는데 증상이 심해지면 옛날 기억도 점차 잊어버리며 시간에 대한 지남력(여기가 어디고 오늘이 몇 일인지 등)과 장소 및 사람에 대한 인지능력이 소실된다.상대의 말을 이해하지 못하고 말수가 점차 줄어 결국 말을 하지 못하게 되거나(언어장애) 익숙한 장소에서 길을 잃거나 이전에 잘 사용했던 도구 사용이 서툴러지기도 한다.대전선병원 신경과 김승주 전문의는 “또 전두엽이 판단력과 복잡한 문제 해결, 추상적 사고 등을 담당하기 때문에 일상생활의 간단한 일들을 혼자서 할 수 없게 된다”며 “더 진행되면 공격적인 행동, 소리 지르기, 불면증, 우울증, 환각 등 이상행동과 정신적인 증상도 나타날 수 있다”고 설명했다.■경도인지장애, 치매로의 진행 막는 최고의 찬스다행히 알츠하이머병 치매는 조기 발견의 기회가 충분하다. 바로 치매 전 단계라고 불리는 ‘경도인지장애’에서 치료를 시작해 치매로의 진행을 막는 것이다. 경도인지장애는 기억력과 인지기능저하가 나타나지만 일상생활하는 데는 큰 지장이 없는 상태로 이 중 약 10~15%가 매년 알츠하이머병 치매로 진행한다고 알려졌다.부모님이 ▲이전과 달리 중요한 약속, 행사를 기억하지 못하거나 ▲말하거나 상대방의 말을 이해하는 데 오래 걸리고 ▲평소 다니던 곳을 못 찾고 ▲매번 잘 쓰던 도구조작이 서툴러지는 등의 증상이 나타나면 치매를 덜컥 의심하기보다 정확한 검사를 통해 경도인지장애 단계인지 확인하는 것이 중요하다.■보행장애 등 여러 증상 동반하는 ‘혈관성치매’반면 혈관성치매는 인지기능과 행동조절에 관여하는 대뇌 부위에 생긴 뇌혈관질환의 후유증으로 치매가 유발된 경우를 말한다.가톨릭대학교 대전성모병원 신경과 이상봉 교수는 “알츠하이머병 치매는 기억력저하가 서서히 진행되는 반면, 혈관성치매는 인지기능장애가 발생해 계단식으로 나빠지며 요실금, 보행장애, 구음장애 등 다른 여러 가지 증상이 동반된다는 차이가 있다”고 말했다.읽고 쓰는 활동을 꾸준히 하면 기억력발달과 뇌 노화방지에 효과적이라고 알려졌다(사진=클립아트코리아).■꾸준한 약물치료로 삶의 질 개선치매는 완치가 불가능할 뿐 치료방법이 없는 건 아니다. 약물치료가 기본으로 알츠하이머병 치매의 경우 초기에는 뇌신경 손상으로 인한 아세틸콜린 감소를 막아주는 약물을 복용한다. 경우에 따라 뇌신경세포의 흥분성 손상과 연관된 NMDA 수용체를 억제하는 약제도 병용해서 사용한다.이상봉 교수는 “이러한 약제들은 치매를 완치시키는 근본적인 치료제는 아니지만 일부 인지기능장애를 완화하고 치매 진행을 막음으로써 환자 삶의 질을 높이기 때문에 주치의의 처방에 따라 꾸준히 복용하는 것이 중요하다”고 강조했다.■꾸준한 운동·두뇌활동으로 평소 예방해야치매는 이미 발병하고 나면 점점 진행되기 때문에 애초에 예방하는 것이 가장 좋다. 유산소운동, 근력운동, 스트레칭 등의 운동과 독서, 쓰기 등의 두뇌활동은 뇌세포 성장과 뇌의 유연성을 높여 치매 예방에 도움이 된다.김승주 전문의는 “과음과 흡연, 비만은 치매 위험인자이기 때문에 치매 예방을 위해서는 금주, 금연, 건강한 식습관을 유지해야한다”며 “이러한 요인은 혈관성치매를 부르는 뇌혈관질환의 발병위험도 높이기 때문에 적극 실천하는 것이 좋다”고 조언했다.한편 중앙치매센터에서 무료로 제공하는 치매 종합포털 모바일앱 ‘치매체크’에서는 치매와 관련된 여러 유용한 정보를 빠르게 확인할 수 있다.이상봉 교수는 “특히 코로나19로 외부 활동이 조심스러운 어르신들이 이 앱에 소개된 치매예방운동법, 인지자극활동 등을 집에서 적절히 활용하면 건강한 뇌를 유지하는 데 도움이 될 것”이라고 말했다.헬스경향 장인선 기자"
290,"서울 관악구(구청장 박준희)는 코로나19 사태로 중단했던 치매안심센터의 운영을 단계적으로 재개키로 하고 이동식 투명 가림막을 설치했다고 25일 밝혔다.     이는 진료나 상담 등 대면 업무로 발생하는 비말을 차단해 감염 위험을 줄이기 위한 것이다.    관악구는 약 400만 원의 예산을 투입해 관악구 치매안심센터 및 난곡치매안심분소에 이동식 투명 가림막 45개를 제작·설치했다.    구는 앞으로 일대일 치매조기검진, 촉탁의 진료, 집단으로 참여하는 인지건강프로그램, 치매환자 쉼터 운영 등에 이 가림막을 활용키로 했다.    경로당·동주민센터·복지관 등의 '찾아가는 치매조기검진'에도 이를 활용할 예정이다.    관악구는 투명 가림막 사용뿐만 아니라 대상자간 거리두기, 회당 참여인원 축소 및 분배, 신체접촉 최소화 등 생활방역을 유지하는 가운데 치매안심센터 프로그램 운영을 재개할 예정이다.   "
291,"[헤럴드경제=이진용 기자]서울 관악구(구청장 박준희)는 생활방역에 발맞춰 철저한 생활방역과 더불어 코로나19로 이용이 중단된 치매안심센터를 단계적으로 재개한다고 25일 밝혔다.구는 재개에 앞서 치매 어르신 및 건강 취약계층 등 주민의 코로나19 감염 예방을 위해 약 400만 원의 예산을 투입해 관악구 치매안심센터 및 난곡치매안심분소에 이동식 투명 가림막 45개를 제작·설치했다.이번에 설치한 투명 가림막은 일대일 치매조기검진 및 촉탁의 진료, 집단으로 참여하는 인지건강프로그램 및 치매환자 쉼터 운영 등 모든 대면 업무에 사용하여 직접접촉 및 비말로 인한 전파를 차단함으로써 감염예방 효과가 기대된다.또 투명 가림막은 이동이 가능하고 휴대 및 설치가 용이하여 장소 구분 없이 어디서나 사용할 수 있어 코로나19로 중단됐던 경로당, 동주민센터, 복지관 등에서 실시하는 ‘찾아가는 치매조기검진’에도 활용할 계획이다.한편 관악구치매안심센터는 간호사, 사회복지사, 작업치료사 등 전문 인력이 상시 배치되어 ▷치매상담 및 등록관리 ▷치매조기검진 및 예방관리 ▷인지건강프로그램 및 치매환자 쉼터 운영 ▷치매의료비 지원 ▷실종예방 등 다양한 사업을 지원하고 있다.또한 코로나19 생활 속 거리두기 전환에 따라 그 동안 중단됐던 사업을 단계적으로 시작하고 있으며 센터 내 손소독제 비치, 마스크 착용, 방문자 비접촉 체온 측정, 호흡기 증상 여부 및 이력 확인, 정기적 소독 등 감염예방에 최선을 다하고 있다.향후 집단 프로그램 운영 재개 시에도 개인별 투명 가림막을 사용해 대상자간 거리두기, 회당 참여인원 축소 및 분배, 신체접촉 최소화 등 철저한 생활방역을 통해 코로나19 예방을 최우선으로 고려해 실시할 계획이다.박준희 구청장은 “투명 가림막 설치 및 철저한 생활 방역을 통해 코로나19로 중단됐던 치매안심센터 이용 어르신들의 감염예방 및 건강관리에 최선을 다할 것”이라며 “구민 여러분들께서 생활 속 거리두기 실천지침을 숙지하고, 적극적으로 참여해주시길 부탁드린다”고 말했다"
292,KT는 20일 서울 KT 광화문빌딩 이스트에서 조선대 광주치매코호트연구단과 클라우드·인공지능(AI) 기반 치매 예측 및 조기진단 연구를 위한 양해각서(MOU)를 체결한다고 밝혔다.    양측은 치매 연구 데이터와 분석 시스템을 클라우드 플랫폼에 접목해 연구자들이 활용할 수 있도록 협력할 예정이다.     또 클라우드 인프라를 기반으로 치매 조기진단 인공지능(AI) 기술 개발에 협력할 계획이다. 세부적으로 ▲ 치매 극복연구개발사업 추진을 위한 KT 클라우드 인프라 제공 및 기술협력 ▲ 모바일 치매 예방 및 관리 플랫폼 개발 등을 추진한다. KT[연합뉴스TV 제공]   
293,"윤동식 KT 클라우드/DX 사업단 전무(왼쪽)와 이건호 조선대 광주치매코호트연구단 단장이 업무협약 체결 후 사진촬영을 하고 있다.KT가 조선대 광주치매코호트연구단과 클라우드·인공지능(AI) 기반 치매 예측과 조기진단 연구를 위한 양해각서(MOU)를 교환했다.KT와 광주치매코호트연구단은 치매 연구 데이터와 분석 시스템을 클라우드 플랫폼에 접목해 연구자가 활용하도록 협력할 예정이다. 광주치매코호트연구단은 10여년간 치매 연구로 1만명 검진·임상실험 데이터를 보유하고 있다.양사는 클라우드 인프라를 기반으로 치매 조기진단 AI 기술 개발에 협력한다. △치매 극복연구개발사업 성공적 추진을 위한 KT 클라우드 인프라 제공과 기술협력 △모바일 치매 예방·관리 플랫폼 개발 등을 공동 추진한다.윤동식 KT 클라우드/DX 사업단 전무는 “KT는 의료정보보호시스템 인증을 취득하고 전자의무기록 보존 관리를 충족하며 의료 분야 클라우드 서비스를 제공하고 있다”며 “앞으로도 KT 클라우드 인프라로 의료 데이터를 안전하게 제공, 의료산업 활성화를 위해 노력하겠다”고 말했다.이건호 조선대 광주치매코호트연구단 단장은 “KT와 협력으로 의료·바이오산업을 AI를 이용해 선도할 수 있는 계기를 만들었다는 점에서 의의가 있다”며 “치매에 대해 원인 규명, 조기 예측과 진단, 예방과 치료기술 개발로 치매 유병률을 낮출 수 있을 것으로 기대한다”고 전했다.박종진기자"
294,"조선대 광주치매코호트연구단(단장 이건호)은 20일 KT(대표 구현모)와 인공지능(AI) 및 클라우드 인프라 기반 치매극복 플랫폼 구축을 위한 업무협약(MOU)을 체결했다.양 측은 △치매극복 연구개발 사업 추진 △치매 예측 및 조기진단 AI기술 개발 협력 △ 모바일 치매예방 및 관리 플랫폼 개발 협력 △여러 자원제공 및 기술교류 등에 협력하기로 했다.조선대 광주치매코호트연구단은 20일 KT와 AI 및 클라우드 인프라 기반 치매극복 플랫폼 구축을 위한 업무협약(MOU)을 체결했다.이건호 단장은 “치매 분야 아시아 최대 빅데이터를 이용한 클라우드 기반 데이터베이스(DB)플랫폼을 공동으로 개발할 계획”이라며 “인류적 난제로 급부상하고 있는 치매를 극복하기 위한 바이오헬스 분야 AI기술을 주도할 수 있는 계기가 될 것”이라고 말했다.윤동식 KT 클라우드/DX 사업단 전무는 “KT는 전자의무기록 보존·관리 기준을 충족하고 의료정보보호시스템 인증(ISO27799)을 취득하는 등 클라우드 기반 의료 산업 활성화를 위해 노력해 왔다”며 “앞으로 클라우드 인프라를 통해 의료, 바이오 분야에 필요한 의료 데이터를 안전하게 제공할 수 있도록 협력해 나가겠다”고 밝혔다.광주=김한식기자"
